Date: Tue, 13 Jun 2006 11:28:51 -0400
From: Mark Lord <>
Subject: Re: 2.6.17: networking bug??
Sender: linux-kernel-owner@vger.kernel.org
Precedence: bulk
List-ID: <linux-kernel.vger.kernel.org>
X-Mailing-List: linux-kernel@vger.kernel.org
X-Lkml-Link: https://lkml.org/lkml/2006/6/13/120

Mmm.  I notice that 2.6.17 has a new sysctl related
to this stuff:  /proc/sys/net/ipv4/tcp_workaround_signed_windows
It makes no difference whatsoever for me here
when varied while /proc/sys/net/ipv4/tcp_window_scaling==1.
The site www.everymac.com is still not browseable until
setting /proc/sys/net/ipv4/tcp_window_scaling===0.
There's one other difference I see in the tcpdump traces.
The first packets from each trace below show different
values for "wscale".  The old (working) kernels use "wscale 2",
whereas 2.6.17 uses "wscale 6".  In both cases, the value
seen in /proc/sys/net/ipv4/tcp_adv_win_scale is 2.
This is from (working) 2.6.16.18:
> 
> IP silvy.localnet.56224 > 216-145-246-23.rev.dls.net.www: S 2933486277:2933486277(0) win 5840 <mss 1460,sackOK,timestamp 730285 0,nop,wscale 2>
> IP 216-145-246-23.rev.dls.net.www > silvy.localnet.56224: S 2545625510:2545625510(0) ack 2933486278 win 65535 <mss 1452,nop,wscale 1,nop,nop,timestamp 134760199 730285>
> IP silvy.localnet.56224 > 216-145-246-23.rev.dls.net.www: . ack 1 win 1460 <nop,nop,timestamp 730448 134760199>
> IP silvy.localnet.56224 > 216-145-246-23.rev.dls.net.www: P 1:607(606) ack 1 win 1460 <nop,nop,timestamp 730448 134760199>
> IP 216-145-246-23.rev.dls.net.www > silvy.localnet.56224: P 1:206(205) ack 607 win 32798 <nop,nop,timestamp 134760217 730448>
> IP silvy.localnet.56224 > 216-145-246-23.rev.dls.net.www: . ack 206 win 1728 <nop,nop,timestamp 730626 134760217> 
This is from (failing) 2.6.17-rc6-git2:
> 
> IP silvy.localnet.33472 > 216-145-246-23.rev.dls.net.www: S 3000518105:3000518105(0) win 5840 <mss 1460,sackOK,timestamp 4294759165 0,nop,wscale 6>
> IP 216-145-246-23.rev.dls.net.www > silvy.localnet.33472: S 3368494549:3368494549(0) ack 3000518106 win 65535 <mss 1452,nop,wscale 1,nop,nop,timestamp 134771817 4294759165> 
> IP silvy.localnet.33472 > 216-145-246-23.rev.dls.net.www: . ack 1 win 92 <nop,nop,timestamp 4294759337 134771817>
> IP silvy.localnet.33472 > 216-145-246-23.rev.dls.net.www: P 1:607(606) ack 1 win 92 <nop,nop,timestamp 4294759337 134771817>
> IP silvy.localnet.33472 > 216-145-246-23.rev.dls.net.www: P 1:607(606) ack 1 win 92 <nop,nop,timestamp 4294760162 134771817>
> IP 216-145-246-23.rev.dls.net.www > silvy.localnet.33472: . ack 607 win 32798 <nop,nop,timestamp 134771918 4294760162> 
Something is broken somewhere.
-
To unsubscribe from this list: send the line "unsubscribe linux-kernel" in
the body of a message to majordomo@vger.kernel.org
More majordomo info at  
http://vger.kernel.org/majordomo-info.html
Please read the FAQ at  
http://www.tux.org/lkml/