Date: 14 Jul 1999 17:08:07 +0200
From: Andi Kleen <>
Subject: Re: Unable to get www.opendx.org/index.html in Linux 2.2.* (Debian 2.1)
Sender: linux-kernel-owner@vger.kernel.org
Precedence: bulk
List-ID: <linux-kernel.vger.kernel.org>
X-Mailing-List: linux-kernel@vger.kernel.org
X-Lkml-Link: https://lkml.org/lkml/1999/7/14/91

Dan.Monster@uni-c.dk (Dan Mønster) writes:
> 
> 12:57:49.020076 dan-m.uni-c.dk.3094 > www.montana.com.www: S 1081050655:1081050655(0) win 32120 <mss 1460,sackOK,timestamp 180921653[|tcp]> (DF)
Connection begin.
> 12:57:49.221530 www.montana.com.www > dan-m.uni-c.dk.3094: S 2669539961:2669539961(0) ack 1081050656 win 2920 <mss 1460,nop,nop,timestamp 260613[|tcp]> (DF)
They answer, but with a strange small window, but this shouldn't matter.
> 12:57:49.221669 dan-m.uni-c.dk.3094 > www.montana.com.www: . ack 1 win 32120 <nop,nop,timestamp 180921673 260613> (DF)
Connection set up.
> 12:57:49.223563 dan-m.uni-c.dk.3094 > www.montana.com.www: P 1:81(80) ack 1 win 32120 <nop,nop,timestamp 180921673 260613> (DF)
> 12:57:52.217880 dan-m.uni-c.dk.3094 > www.montana.com.www: P 1:81(80) ack 1 win 32120 <nop,nop,timestamp 180921973 260613> (DF)
> 12:57:58.217693 dan-m.uni-c.dk.3094 > www.montana.com.www: P 1:81(80) ack 1 win 32120 <nop,nop,timestamp 180922573 260613> (DF)
> 12:58:10.217355 dan-m.uni-c.dk.3094 > www.montana.com.www: P 1:81(80) ack 1 win 32120 <nop,nop,timestamp 180923773 260613> (DF)
> 12:58:34.216632 dan-m.uni-c.dk.3094 > www.montana.com.www: P 1:81(80) ack 1 win 32120 <nop,nop,timestamp 180926173 260613> (DF)
They don't answer. This is near a minute. Seems wget times out the connection.
> 12:58:34.422050 www.montana.com.www > dan-m.uni-c.dk.3094: . ack 81 win 8760 <nop,nop,timestamp 260703 180921673> (DF)
Finally they answer.
> 13:06:51.723096 www.montana.com.www > dan-m.uni-c.dk.3094: R 1461:2921(1460) ack 81 win 8760 (DF)
But we have already closed it.
Try increasing the wget timeout. With a brief look at wget --help  it looks
like the -T option might help you.
-Andi
-- 
This is like TV. I don't like TV.
-
To unsubscribe from this list: send the line "unsubscribe linux-kernel" in
the body of a message to majordomo@vger.rutgers.edu
Please read the FAQ at 
http://www.tux.org/lkml/