Date: Sat, 19 Feb 2000 16:48:46 +0000
From: David Woodhouse <>
Subject: Re: TCP stuck (RH 2.2.12-20 <-> 2.2.13)
Sender: linux-kernel-owner@vger.kernel.org
Precedence: bulk
List-ID: <linux-kernel.vger.kernel.org>
X-Mailing-List: linux-kernel@vger.kernel.org
X-Lkml-Link: https://lkml.org/lkml/2000/2/19/96

I left my stuck connexion overnight, and it came back to life almost exactly
two hours after I last sent it data from my end. 
The offending machine is running the RH 2.2.12-20 UP kernel on a single 
Pentium, and the interface it's using for this traffic is 
eth1: RealTek RTL8139 Fast Ethernet at 0x6600, IRQ 11, 00:e0:7d:02:bf:f2.
I'm not sure exactly what board it is:
00:11.0 Ethernet controller: Realtek Semiconductor Co., Ltd. 8139 (rev 10)
	Subsystem: Unknown device 10ec:8139
02:45:12.864184 < gate.mvhi.com.1021 > lnx.keraben.com.ssh: P 3044:3072(28) ack 1 win 31856 <nop,nop,timestamp 766271340 97787209> (DF) [tos 0x10] 
02:45:12.881096 > lnx.keraben.com.ssh > gate.mvhi.com.1021: . 1:1(0) ack 3072 win 31856 <nop,nop,timestamp 97787235 766271340> (DF) [tos 0x10] 
04:45:45.755525 > lnx.keraben.com.ssh > gate.mvhi.com.1021: P 1:1449(1448) ack 3072 win 31856 <nop,nop,timestamp 98510552 766271340> (DF) [tos 0x10] 
04:45:47.727507 < gate.mvhi.com.1021 > lnx.keraben.com.ssh: . 3072:3072(0) ack 1449 win 31856 <nop,nop,timestamp 766994804 98510552> (DF) [tos 0x10] 
04:45:47.727596 > lnx.keraben.com.ssh > gate.mvhi.com.1021: P 1449:2897(1448) ack 3072 win 31856 <nop,nop,timestamp 98510749 766994804> (DF) [tos 0x10] 
04:45:49.192082 < gate.mvhi.com.1021 > lnx.keraben.com.ssh: P 3072:3988(916) ack 2897 win 31856 <nop,nop,timestamp 766994948 98510749> (DF) [tos 0x10] 
04:45:49.192200 > lnx.keraben.com.ssh > gate.mvhi.com.1021: P 2897:4345(1448) ack 3988 win 31856 <nop,nop,timestamp 98510895 766994948> (DF) [tos 0x10] 
04:45:50.468051 < gate.mvhi.com.1021 > lnx.keraben.com.ssh: P 3072:3988(916) ack 2897 win 31856 <nop,nop,timestamp 766995080 98510749> (DF) [tos 0x10] 
--
dwmw2
-
To unsubscribe from this list: send the line "unsubscribe linux-kernel" in
the body of a message to majordomo@vger.rutgers.edu
Please read the FAQ at 
http://www.tux.org/lkml/