Date: Thu, 25 Feb 1999 16:13:21 +0000 (GMT)
From: (Alan Cox)
Subject: Re: PROBLEM: Sending mail-attachment > 45k with Netscape via sendmail hangs
Sender: linux-kernel-owner@vger.kernel.org
Precedence: bulk
List-ID: <linux-kernel.vger.kernel.org>
X-Mailing-List: linux-kernel@vger.kernel.org
X-Lkml-Link: https://lkml.org/lkml/1999/2/25/90

> 15:57:16.363257 localhost.1024 > localhost.3333: . ack 11096 win 19977 <nop,nop,timestamp 7039 7039> (DF)
> 15:57:16.363257 localhost.1024 > localhost.3333: . ack 11096 win 19977 <nop,nop,timestamp 7039 7039> (DF)
> 15:57:16.363295 localhost.3333 > localhost.1024: P 11096:12681(1585) ack 1 win 31072 <nop,nop,timestamp 7039 7039> (DF)
Ok to this point
> 15:57:16.363358 localhost.1024 > localhost.3333: . ack 14266 win 16807 <nop,nop,timestamp 7039 7039> (DF)
> 15:57:16.363358 localhost.1024 > localhost.3333: . ack 14266 win 16807 <nop,nop,timestamp 7039 7039> (DF)
Now either the trace goes bad or we just went completely gaga, this is acking
data that isnt being reported. Is your tcpdump missing some transmitted frames ?
Alan
-
To unsubscribe from this list: send the line "unsubscribe linux-kernel" in
the body of a message to majordomo@vger.rutgers.edu
Please read the FAQ at 
http://www.tux.org/lkml/