Date: Fri, 12 Oct 2007 17:39:49 -0700
From: Andrew Morton <>
Subject: Re: sometimes very long response times on network interfaces since 2.6.22
Sender: linux-kernel-owner@vger.kernel.org
Precedence: bulk
List-ID: <linux-kernel.vger.kernel.org>
X-Mailing-List: linux-kernel@vger.kernel.org
X-Lkml-Link: https://lkml.org/lkml/2007/10/12/522

On Wed, 10 Oct 2007 11:03:07 +0200
Ingo Freund <linux-kernel-news@e-dict.net> wrote:
> On 10.10.2007 09:00, Eric Dumazet wrote (please find the answer below the original text):
> > Ingo Freund a __crit :
> >> Hello,
> >>
> >> since I switched to kernel 2.6.22 my dell 1750 server
> >> with the two onboard BCM5704 network interfaces doesn't
> >> work properly anymore.
> >> TCP requests sometimes need more than 30 seconds to be answered
> >> (or to get away) and the application stops with timeouts.
> >> We are talking about two servers connected via Gigabit switch.
> >> The timeouts happen up to ten times a day.
> >> In the meantime I tried an old 3com 3c905c NIC which showed
> >> the same behaviour.
> >> I still couldn't figure out in which special situation the
> >> communication stops.
> >> The only solution ist to boot the old 2.6.21.5 kernel.
> >> With this, all runs fine.
> >> Did I miss a config issue in the migration to 2.6.22?
> >> The machines run in a productive environment and there is
> >> not much room (time) to debug, but if needed, I could try
> >> if anyone would need more information for help.
> >>
> > 
> > Hi
> > 1) A tcpdump would help for sure...
> 
> 
> thank you for the answer.
> Find attached 2 dumps of the timeout situation
> The sender side works with 2.6.21.5 (and all the
> other kernels I used before since 2004) while with
> 2.6.22.n the error situations come up.
> I didn't find any error log entries.
> 
> > 2) Could you try 2.6.23
> 
> for sure
> 1. are there changes concerning my problem?
> 2. will need some time (productive machines as I said)
> 
You removed Eric from cc - please don't do that.  Always do reply-to-all.
Please cc netdev@vger.kernel.org on networking-related matters.
03:34:48.030534 192.168.47.51.80 > 192.168.47.49.36263: P 1:127(126) ack 1262 win 260 <nop,nop,timestamp 4648492 16668476> (DF)
03:34:48.030718 192.168.47.49.36263 > 192.168.47.51.80: . ack 127 win 92 <nop,nop,timestamp 16668508 4648492> (DF)
03:34:48.031050 192.168.47.51.80 > 192.168.47.49.36263: F 127:127(0) ack 1262 win 260 <nop,nop,timestamp 4648493 16668508> (DF)
03:34:48.031316 192.168.47.49.36263 > 192.168.47.51.80: F 1262:1262(0) ack 128 win 92 <nop,nop,timestamp 16668508 4648493> (DF)
03:34:48.031335 192.168.47.51.80 > 192.168.47.49.36263: . ack 1263 win 260 <nop,nop,timestamp 4648493 16668508> (DF)
03:34:48.039552 192.168.47.49.36270 > 192.168.47.51.80: S 770791894:770791894(0) win 5840 <mss 1460,sackOK,timestamp 16668510 0,nop,wscale 6> (DF)
03:34:48.039575 192.168.47.51.80 > 192.168.47.49.36270: S 2383819929:2383819929(0) ack 770791895 win 5792 <mss 1460,sackOK,timestamp 4648495 16668510,nop,wscale 5> (DF)
03:34:48.039752 192.168.47.49.36270 > 192.168.47.51.80: . ack 1 win 92 <nop,nop,timestamp 16668510 4648495> (DF)
03:34:48.039801 192.168.47.49.36270 > 192.168.47.51.80: P 1:613(612) ack 1 win 92 <nop,nop,timestamp 16668510 4648495> (DF)
03:34:48.039812 192.168.47.51.80 > 192.168.47.49.36270: . ack 613 win 220 <nop,nop,timestamp 4648495 16668510> (DF)
03:34:48.086440 192.168.47.49.36262 > 192.168.47.51.80: P 1:1262(1261) ack 1 win 92 <nop,nop,timestamp 16668522 4648456> (DF)
03:34:48.086501 192.168.47.51.80 > 192.168.47.49.36262: . ack 1262 win 260 <nop,nop,timestamp 4648506 16668522,nop,nop,sack sack 1 {1:1262} > (DF)
03:34:48.086820 192.168.47.51.80 > 192.168.47.49.36270: P 1:127(126) ack 613 win 220 <nop,nop,timestamp 4648507 16668510> (DF)
03:34:48.086899 192.168.47.51.80 > 192.168.47.49.36270: F 127:127(0) ack 613 win 220 <nop,nop,timestamp 4648507 16668510> (DF)
03:34:48.086926 192.168.47.49.36270 > 192.168.47.51.80: . ack 127 win 92 <nop,nop,timestamp 16668522 4648507> (DF)
03:34:48.087126 192.168.47.49.36270 > 192.168.47.51.80: F 613:613(0) ack 128 win 92 <nop,nop,timestamp 16668522 4648507> (DF)
03:34:48.087139 192.168.47.51.80 > 192.168.47.49.36270: . ack 614 win 220 <nop,nop,timestamp 4648507 16668522> (DF)
03:34:48.162526 192.168.47.51.80 > 192.168.47.49.36262: FP 1:127(126) ack 1262 win 260 <nop,nop,timestamp 4648526 16668522> (DF)
03:34:48.494421 192.168.47.49.36262 > 192.168.47.51.80: P 1:1262(1261) ack 1 win 92 <nop,nop,timestamp 16668624 4648456> (DF)
03:34:48.494441 192.168.47.51.80 > 192.168.47.49.36262: . ack 1262 win 260 <nop,nop,timestamp 4648608 16668624,nop,nop,sack sack 1 {1:1262} > (DF)
03:34:48.570549 192.168.47.51.80 > 192.168.47.49.36262: FP 1:127(126) ack 1262 win 260 <nop,nop,timestamp 4648628 16668624> (DF)
03:34:49.310357 192.168.47.49.36262 > 192.168.47.51.80: P 1:1262(1261) ack 1 win 92 <nop,nop,timestamp 16668828 4648456> (DF)
03:34:49.310374 192.168.47.51.80 > 192.168.47.49.36262: . ack 1262 win 260 <nop,nop,timestamp 4648812 16668828,nop,nop,sack sack 1 {1:1262} > (DF)
03:34:49.386616 192.168.47.51.80 > 192.168.47.49.36262: FP 1:127(126) ack 1262 win 260 <nop,nop,timestamp 4648832 16668828> (DF)
03:34:50.942288 192.168.47.49.36262 > 192.168.47.51.80: P 1:1262(1261) ack 1 win 92 <nop,nop,timestamp 16669236 4648456> (DF)
03:34:50.942339 192.168.47.51.80 > 192.168.47.49.36262: . ack 1262 win 260 <nop,nop,timestamp 4649220 16669236,nop,nop,sack sack 1 {1:1262} > (DF)
03:34:51.018746 192.168.47.51.80 > 192.168.47.49.36262: FP 1:127(126) ack 1262 win 260 <nop,nop,timestamp 4649240 16669236> (DF)
03:34:52.714232 192.168.47.49.36191 > 192.168.47.51.80: P 1:1262(1261) ack 1 win 92 <nop,nop,timestamp 16669679 4643187> (DF)
03:34:52.714255 192.168.47.51.80 > 192.168.47.49.36191: . ack 1262 win 260 <nop,nop,timestamp 4649663 16669679,nop,nop,sack sack 1 {1:1262} > (DF)
03:34:52.718075 192.168.47.49.36192 > 192.168.47.51.80: P 1:1270(1269) ack 1 win 92 <nop,nop,timestamp 16669680 4643188> (DF)
03:34:52.718092 192.168.47.51.80 > 192.168.47.49.36192: . ack 1270 win 261 <nop,nop,timestamp 4649664 16669680,nop,nop,sack sack 1 {1:1270} > (DF)
03:34:52.806888 192.168.47.51.80 > 192.168.47.49.36192: FP 1:127(126) ack 1270 win 261 <nop,nop,timestamp 4649687 16669680> (DF)
03:34:52.807182 192.168.47.49.36192 > 192.168.47.51.80: F 1270:1270(0) ack 128 win 92 <nop,nop,timestamp 16669702 4649687> (DF)
03:34:52.807199 192.168.47.51.80 > 192.168.47.49.36192: . ack 1271 win 261 <nop,nop,timestamp 4649687 16669702> (DF)
03:34:52.814884 192.168.47.51.80 > 192.168.47.49.36191: FP 1:127(126) ack 1262 win 260 <nop,nop,timestamp 4649689 16669679> (DF)
03:34:52.815319 192.168.47.49.36191 > 192.168.47.51.80: F 1262:1262(0) ack 128 win 92 <nop,nop,timestamp 16669704 4649689> (DF)
03:34:52.815330 192.168.47.51.80 > 192.168.47.49.36191: . ack 1263 win 260 <nop,nop,timestamp 4649689 16669704> (DF)
03:34:53.922039 192.168.47.49.36193 > 192.168.47.51.80: . 1:1449(1448) ack 1 win 92 <nop,nop,timestamp 16669981 4643489> (DF)
03:34:53.922052 192.168.47.51.80 > 192.168.47.49.36193: . ack 2186 win 362 <nop,nop,timestamp 4649965 16663504,nop,nop,sack sack 1 {1:1449} > (DF)
03:34:53.970980 192.168.47.51.80 > 192.168.47.49.36193: FP 1:127(126) ack 2186 win 362 <nop,nop,timestamp 4649978 16663504> (DF)
03:34:53.971259 192.168.47.49.36193 > 192.168.47.51.80: F 2186:2186(0) ack 128 win 92 <nop,nop,timestamp 16669993 4649978> (DF)
03:34:53.971274 192.168.47.51.80 > 192.168.47.49.36193: . ack 2187 win 362 <nop,nop,timestamp 4649978 16669993> (DF)
03:34:54.206131 192.168.47.49.36262 > 192.168.47.51.80: P 1:1262(1261) ack 1 win 92 <nop,nop,timestamp 16670052 4648456> (DF)
03:34:54.206147 192.168.47.51.80 > 192.168.47.49.36262: . ack 1262 win 260 <nop,nop,timestamp 4650036 16670052,nop,nop,sack sack 1 {1:1262} > (DF)
03:34:54.283003 192.168.47.51.80 > 192.168.47.49.36262: FP 1:127(126) ack 1262 win 260 <nop,nop,timestamp 4650056 16670052> (DF)
03:34:55.144222 192.168.47.49.36289 > 192.168.47.51.80: S 3581686605:3581686605(0) win 5840 <mss 1460,sackOK,timestamp 16670286 0,nop,wscale 6> (DF)
03:34:55.144241 192.168.47.51.80 > 192.168.47.49.36289: S 897930458:897930458(0) ack 3581686606 win 5792 <mss 1460,sackOK,timestamp 4650271 16670286,nop,wscale 5> (DF)
03:34:55.144372 192.168.47.49.36289 > 192.168.47.51.80: . ack 1 win 92 <nop,nop,timestamp 16670286 4650271> (DF)
03:34:55.144621 192.168.47.49.36289 > 192.168.47.51.80: . 1:1449(1448) ack 1 win 92 <nop,nop,timestamp 16670286 4650271> (DF)
03:34:55.144638 192.168.47.51.80 > 192.168.47.49.36289: . ack 1449 win 272 <nop,nop,timestamp 4650271 16670286> (DF)
03:34:55.144622 192.168.47.49.36289 > 192.168.47.51.80: P 1449:1902(453) ack 1 win 92 <nop,nop,timestamp 16670286 4650271> (DF)
03:34:55.144644 192.168.47.51.80 > 192.168.47.49.36289: . ack 1902 win 362 <nop,nop,timestamp 4650271 16670286> (DF)
03:34:55.194583 192.168.47.51.80 > 192.168.47.49.36289: P 1:127(126) ack 1902 win 362 <nop,nop,timestamp 4650283 16670286> (DF)
03:34:55.194743 192.168.47.49.36289 > 192.168.47.51.80: . ack 127 win 92 <nop,nop,timestamp 16670299 4650283> (DF)
03:34:55.195012 192.168.47.51.80 > 192.168.47.49.36289: F 127:127(0) ack 1902 win 362 <nop,nop,timestamp 4650283 16670299> (DF)
03:34:55.195191 192.168.47.49.36289 > 192.168.47.51.80: F 1902:1902(0) ack 128 win 92 <nop,nop,timestamp 16670299 4650283> (DF)
03:34:55.195210 192.168.47.51.80 > 192.168.47.49.36289: . ack 1903 win 362 <nop,nop,timestamp 4650284 16670299> (DF)
03:34:55.251100 192.168.47.49.36290 > 192.168.47.51.80: S 3681005327:3681005327(0) win 5840 <mss 1460,sackOK,timestamp 16670313 0,nop,wscale 6> (DF)
03:34:55.251123 192.168.47.51.80 > 192.168.47.49.36290: S 993631602:993631602(0) ack 3681005328 win 5792 <mss 1460,sackOK,timestamp 4650298 16670313,nop,wscale 5> (DF)
03:34:55.251250 192.168.47.49.36290 > 192.168.47.51.80: . ack 1 win 92 <nop,nop,timestamp 16670313 4650298> (DF)
03:34:55.251399 192.168.47.49.36290 > 192.168.47.51.80: P 1:597(596) ack 1 win 92 <nop,nop,timestamp 16670313 4650298> (DF)
03:34:55.251411 192.168.47.51.80 > 192.168.47.49.36290: . ack 597 win 219 <nop,nop,timestamp 4650298 16670313> (DF)
03:34:55.299608 192.168.47.51.80 > 192.168.47.49.36290: P 1:127(126) ack 597 win 219 <nop,nop,timestamp 4650310 16670313> (DF)
03:34:55.299714 192.168.47.51.80 > 192.168.47.49.36290: F 127:127(0) ack 597 win 219 <nop,nop,timestamp 4650310 16670313> (DF)
03:34:55.299724 192.168.47.49.36290 > 192.168.47.51.80: . ack 127 win 92 <nop,nop,timestamp 16670325 4650310> (DF)
03:34:55.299922 192.168.47.49.36290 > 192.168.47.51.80: F 597:597(0) ack 128 win 92 <nop,nop,timestamp 16670325 4650310> (DF)
03:34:55.299934 192.168.47.51.80 > 192.168.47.49.36290: . ack 598 win 219 <nop,nop,timestamp 4650310 16670325> (DF)
03:34:55.306511 192.168.47.49.36291 > 192.168.47.51.80: S 3743831949:3743831949(0) win 5840 <mss 1460,sackOK,timestamp 16670327 0,nop,wscale 6> (DF)
03:34:55.306536 192.168.47.51.80 > 192.168.47.49.36291: S 1060099595:1060099595(0) ack 3743831950 win 5792 <mss 1460,sackOK,timestamp 4650311 16670327,nop,wscale 5> (DF)
03:34:55.306661 192.168.47.49.36291 > 192.168.47.51.80: . ack 1 win 92 <nop,nop,timestamp 16670327 4650311> (DF)
03:34:55.306810 192.168.47.49.36291 > 192.168.47.51.80: P 1:1041(1040) ack 1 win 92 <nop,nop,timestamp 16670327 4650311> (DF)
03:34:55.306822 192.168.47.51.80 > 192.168.47.49.36291: . ack 1041 win 246 <nop,nop,timestamp 4650311 16670327> (DF)
03:34:55.356083 192.168.47.51.80 > 192.168.47.49.36291: P 1:127(126) ack 1041 win 246 <nop,nop,timestamp 4650324 16670327> (DF)
03:34:55.356234 192.168.47.49.36291 > 192.168.47.51.80: . ack 127 win 92 <nop,nop,timestamp 16670339 4650324> (DF)
03:34:55.356555 192.168.47.51.80 > 192.168.47.49.36291: F 127:127(0) ack 1041 win 246 <nop,nop,timestamp 4650324 16670339> (DF)
03:34:55.356730 192.168.47.49.36291 > 192.168.47.51.80: F 1041:1041(0) ack 128 win 92 <nop,nop,timestamp 16670339 4650324> (DF)
03:34:55.356747 192.168.47.51.80 > 192.168.47.49.36291: . ack 1042 win 246 <nop,nop,timestamp 4650324 16670339> (DF)
03:34:55.359526 192.168.47.49.36292 > 192.168.47.51.80: S 3792747634:3792747634(0) win 5840 <mss 1460,sackOK,timestamp 16670340 0,nop,wscale 6> (DF)
03:34:55.359548 192.168.47.51.80 > 192.168.47.49.36292: S 1107827245:1107827245(0) ack 3792747635 win 5792 <mss 1460,sackOK,timestamp 4650325 16670340,nop,wscale 5> (DF)
03:34:55.359676 192.168.47.49.36292 > 192.168.47.51.80: . ack 1 win 92 <nop,nop,timestamp 16670340 4650325> (DF)
03:34:55.359775 192.168.47.49.36292 > 192.168.47.51.80: P 1:669(668) ack 1 win 92 <nop,nop,timestamp 16670340 4650325> (DF)
03:34:55.359787 192.168.47.51.80 > 192.168.47.49.36292: . ack 669 win 223 <nop,nop,timestamp 4650325 16670340> (DF)
03:34:55.408744 192.168.47.51.80 > 192.168.47.49.36292: P 1:127(126) ack 669 win 223 <nop,nop,timestamp 4650337 16670340> (DF)
03:34:55.408854 192.168.47.51.80 > 192.168.47.49.36292: F 127:127(0) ack 669 win 223 <nop,nop,timestamp 4650337 16670340> (DF)
03:34:55.408898 192.168.47.49.36292 > 192.168.47.51.80: . ack 127 win 92 <nop,nop,timestamp 16670352 4650337> (DF)
03:34:55.409046 192.168.47.49.36292 > 192.168.47.51.80: F 669:669(0) ack 128 win 92 <nop,nop,timestamp 16670352 4650337> (DF)
03:34:55.409058 192.168.47.51.80 > 192.168.47.49.36292: . ack 670 win 223 <nop,nop,timestamp 4650337 16670352> (DF)
03:34:55.479084 192.168.47.49.36293 > 192.168.47.51.80: S 3923414935:3923414935(0) win 5840 <mss 1460,sackOK,timestamp 16670370 0,nop,wscale 6> (DF)
03:34:55.479110 192.168.47.51.80 > 192.168.47.49.36293: S 1219399545:1219399545(0) ack 3923414936 win 5792 <mss 1460,sackOK,timestamp 4650355 16670370,nop,wscale 5> (DF)
03:34:55.479233 192.168.47.49.36293 > 192.168.47.51.80: . ack 1 win 92 <nop,nop,timestamp 16670370 4650355> (DF)
03:34:55.479433 192.168.47.49.36293 > 192.168.47.51.80: . 1:1449(1448) ack 1 win 92 <nop,nop,timestamp 16670370 4650355> (DF)
03:34:55.479448 192.168.47.51.80 > 192.168.47.49.36293: . ack 1449 win 272 <nop,nop,timestamp 4650355 16670370> (DF)
03:34:55.479434 192.168.47.49.36293 > 192.168.47.51.80: P 1449:2174(725) ack 1 win 92 <nop,nop,timestamp 16670370 4650355> (DF)
03:34:55.479455 192.168.47.51.80 > 192.168.47.49.36293: . ack 2174 win 362 <nop,nop,timestamp 4650355 16670370> (DF)
03:34:55.529053 192.168.47.51.80 > 192.168.47.49.36293: P 1:127(126) ack 2174 win 362 <nop,nop,timestamp 4650367 16670370> (DF)
03:34:55.529175 192.168.47.51.80 > 192.168.47.49.36293: F 127:127(0) ack 2174 win 362 <nop,nop,timestamp 4650367 16670370> (DF)
03:34:55.529206 192.168.47.49.36293 > 192.168.47.51.80: . ack 127 win 92 <nop,nop,timestamp 16670382 4650367> (DF)
03:34:55.529402 192.168.47.49.36293 > 192.168.47.51.80: F 2174:2174(0) ack 128 win 92 <nop,nop,timestamp 16670382 4650367> (DF)
03:34:55.529415 192.168.47.51.80 > 192.168.47.49.36293: . ack 2175 win 362 <nop,nop,timestamp 4650367 16670382> (DF)
03:34:55.677572 192.168.47.49.36294 > 192.168.47.51.80: S 4109734837:4109734837(0) win 5840 <mss 1460,sackOK,timestamp 16670419 0,nop,wscale 6> (DF)
03:34:55.677618 192.168.47.51.80 > 192.168.47.49.36294: S 1421783916:1421783916(0) ack 4109734838 win 5792 <mss 1460,sackOK,timestamp 4650404 16670419,nop,wscale 5> (DF)
03:34:55.677764 192.168.47.49.36294 > 192.168.47.51.80: . ack 1 win 92 <nop,nop,timestamp 16670419 4650404> (DF)
03:34:55.677913 192.168.47.49.36294 > 192.168.47.51.80: P 1:1262(1261) ack 1 win 92 <nop,nop,timestamp 16670419 4650404> (DF)
03:34:55.677927 192.168.47.51.80 > 192.168.47.49.36294: . ack 1262 win 260 <nop,nop,timestamp 4650404 16670419> (DF)
03:34:55.683268 192.168.47.49.36295 > 192.168.47.51.80: S 4121699830:4121699830(0) win 5840 <mss 1460,sackOK,timestamp 16670421 0,nop,wscale 6> (DF)
03:34:55.683329 192.168.47.51.80 > 192.168.47.49.36295: S 1429247880:1429247880(0) ack 4121699831 win 5792 <mss 1460,sackOK,timestamp 4650406 16670421,nop,wscale 5> (DF)
03:34:55.683455 192.168.47.49.36295 > 192.168.47.51.80: . ack 1 win 92 <nop,nop,timestamp 16670421 4650406> (DF)
03:34:55.683604 192.168.47.49.36295 > 192.168.47.51.80: P 1:1033(1032) ack 1 win 92 <nop,nop,timestamp 16670421 4650406> (DF)
03:34:55.683619 192.168.47.51.80 > 192.168.47.49.36295: . ack 1033 win 246 <nop,nop,timestamp 4650406 16670421> (DF)
03:34:55.732611 192.168.47.51.80 > 192.168.47.49.36295: P 1:127(126) ack 1033 win 246 <nop,nop,timestamp 4650418 16670421> (DF)
03:34:55.732727 192.168.47.49.36295 > 192.168.47.51.80: . ack 127 win 92 <nop,nop,timestamp 16670433 4650418> (DF)
03:34:55.732747 192.168.47.51.80 > 192.168.47.49.36295: F 127:127(0) ack 1033 win 246 <nop,nop,timestamp 4650418 16670421> (DF)
03:34:55.733025 192.168.47.49.36295 > 192.168.47.51.80: F 1033:1033(0) ack 128 win 92 <nop,nop,timestamp 16670433 4650418> (DF)
03:34:55.733037 192.168.47.51.80 > 192.168.47.49.36295: . ack 1034 win 246 <nop,nop,timestamp 4650418 16670433> (DF)
03:34:55.774933 192.168.47.51.80 > 192.168.47.49.36294: P 1:127(126) ack 1262 win 260 <nop,nop,timestamp 4650428 16670419> (DF)
03:34:55.775159 192.168.47.49.36294 > 192.168.47.51.80: . ack 127 win 92 <nop,nop,timestamp 16670444 4650428> (DF)
03:34:55.775389 192.168.47.51.80 > 192.168.47.49.36294: F 127:127(0) ack 1262 win 260 <nop,nop,timestamp 4650429 16670444> (DF)
03:34:55.775606 192.168.47.49.36294 > 192.168.47.51.80: F 1262:1262(0) ack 128 win 92 <nop,nop,timestamp 16670444 4650429> (DF)
03:34:55.775623 192.168.47.51.80 > 192.168.47.49.36294: . ack 1263 win 260 <nop,nop,timestamp 4650429 16670444> (DF)
03:34:55.838309 192.168.47.49.36305 > 192.168.47.51.80: S 4267786438:4267786438(0) win 5840 <mss 1460,sackOK,timestamp 16670460 0,nop,wscale 6> (DF)
03:34:55.838342 192.168.47.51.80 > 192.168.47.49.36305: S 1587635997:1587635997(0) ack 4267786439 win 5792 <mss 1460,sackOK,timestamp 4650444 16670460,nop,wscale 5> (DF)
03:34:55.838505 192.168.47.49.36305 > 192.168.47.51.80: . ack 1 win 92 <nop,nop,timestamp 16670460 4650444> (DF)
03:34:55.838755 192.168.47.49.36305 > 192.168.47.51.80: P 1:1041(1040) ack 1 win 92 <nop,nop,timestamp 16670460 4650444> (DF)
03:34:55.838879 192.168.47.51.80 > 192.168.47.49.36305: . ack 1041 win 246 <nop,nop,timestamp 4650444 16670460> (DF)
03:34:55.887968 192.168.47.51.80 > 192.168.47.49.36305: P 1:127(126) ack 1041 win 246 <nop,nop,timestamp 4650457 16670460> (DF)
03:34:55.888177 192.168.47.49.36305 > 192.168.47.51.80: . ack 127 win 92 <nop,nop,timestamp 16670472 4650457> (DF)
03:34:55.888417 192.168.47.51.80 > 192.168.47.49.36305: F 127:127(0) ack 1041 win 246 <nop,nop,timestamp 4650457 16670472> (DF)
03:34:55.890223 192.168.47.49.36305 > 192.168.47.51.80: F 1041:1041(0) ack 128 win 92 <nop,nop,timestamp 16670473 4650457> (DF)
03:34:55.890241 192.168.47.51.80 > 192.168.47.49.36305: . ack 1042 win 246 <nop,nop,timestamp 4650457 16670473> (DF)
03:34:55.937996 192.168.47.49.36308 > 192.168.47.51.80: S 75835109:75835109(0) win 5840 <mss 1460,sackOK,timestamp 16670485 0,nop,wscale 6> (DF)
03:34:55.938022 192.168.47.51.80 > 192.168.47.49.36308: S 1684224709:1684224709(0) ack 75835110 win 5792 <mss 1460,sackOK,timestamp 4650469 16670485,nop,wscale 5> (DF)
03:34:55.938145 192.168.47.49.36308 > 192.168.47.51.80: . ack 1 win 92 <nop,nop,timestamp 16670485 4650469> (DF)
03:34:55.938345 192.168.47.49.36308 > 192.168.47.51.80: P 1:1262(1261) ack 1 win 92 <nop,nop,timestamp 16670485 4650469> (DF)
03:34:55.938360 192.168.47.51.80 > 192.168.47.49.36308: . ack 1262 win 260 <nop,nop,timestamp 4650469 16670485> (DF)
03:34:55.985278 192.168.47.51.80 > 192.168.47.49.36308: P 1:127(126) ack 1262 win 260 <nop,nop,timestamp 4650481 16670485> (DF)
03:34:55.985386 192.168.47.51.80 > 192.168.47.49.36308: F 127:127(0) ack 1262 win 260 <nop,nop,timestamp 4650481 16670485> (DF)
03:34:55.985469 192.168.47.49.36308 > 192.168.47.51.80: . ack 127 win 92 <nop,nop,timestamp 16670496 4650481> (DF)
03:34:55.986368 192.168.47.49.36308 > 192.168.47.51.80: F 1262:1262(0) ack 128 win 92 <nop,nop,timestamp 16670497 4650481> (DF)
03:34:55.986381 192.168.47.51.80 > 192.168.47.49.36308: . ack 1263 win 260 <nop,nop,timestamp 4650481 16670497> (DF)
03:34:56.066288 192.168.47.49.36317 > 192.168.47.51.80: S 214429163:214429163(0) win 5840 <mss 1460,sackOK,timestamp 16670517 0,nop,wscale 6> (DF)
03:34:56.066313 192.168.47.51.80 > 192.168.47.49.36317: S 1813590994:1813590994(0) ack 214429164 win 5792 <mss 1460,sackOK,timestamp 4650501 16670517,nop,wscale 5> (DF)
03:34:56.066438 192.168.47.49.36317 > 192.168.47.51.80: . ack 1 win 92 <nop,nop,timestamp 16670517 4650501> (DF)
03:34:56.066588 192.168.47.49.36317 > 192.168.47.51.80: P 1:1033(1032) ack 1 win 92 <nop,nop,timestamp 16670517 4650501> (DF)
03:34:56.066600 192.168.47.51.80 > 192.168.47.49.36317: . ack 1033 win 246 <nop,nop,timestamp 4650501 16670517> (DF)
03:34:56.115904 192.168.47.51.80 > 192.168.47.49.36317: P 1:127(126) ack 1033 win 246 <nop,nop,timestamp 4650514 16670517> (DF)
03:34:56.116013 192.168.47.51.80 > 192.168.47.49.36317: F 127:127(0) ack 1033 win 246 <nop,nop,timestamp 4650514 16670517> (DF)
03:34:56.136328 192.168.47.49.36318 > 192.168.47.51.80: S 275549970:275549970(0) win 5840 <mss 1460,sackOK,timestamp 16670534 0,nop,wscale 6> (DF)
03:34:56.136365 192.168.47.51.80 > 192.168.47.49.36318: S 1890180815:1890180815(0) ack 275549971 win 5792 <mss 1460,sackOK,timestamp 4650519 16670534,nop,wscale 5> (DF)
03:34:56.136476 192.168.47.49.36318 > 192.168.47.51.80: . ack 1 win 92 <nop,nop,timestamp 16670534 4650519> (DF)
03:34:56.136676 192.168.47.49.36318 > 192.168.47.51.80: P 1:1270(1269) ack 1 win 92 <nop,nop,timestamp 16670534 4650519> (DF)
03:34:56.136691 192.168.47.51.80 > 192.168.47.49.36318: . ack 1270 win 261 <nop,nop,timestamp 4650519 16670534> (DF)
03:34:56.183357 192.168.47.51.80 > 192.168.47.49.36318: P 1:127(126) ack 1270 win 261 <nop,nop,timestamp 4650531 16670534> (DF)
03:34:56.183658 192.168.47.51.80 > 192.168.47.49.36318: F 127:127(0) ack 1270 win 261 <nop,nop,timestamp 4650531 16670534> (DF)
03:34:56.319172 192.168.47.51.80 > 192.168.47.49.36317: FP 1:127(126) ack 1033 win 246 <nop,nop,timestamp 4650565 16670517> (DF)
03:34:56.387170 192.168.47.51.80 > 192.168.47.49.36318: FP 1:127(126) ack 1270 win 261 <nop,nop,timestamp 4650582 16670534> (DF)
03:34:56.727196 192.168.47.51.80 > 192.168.47.49.36317: FP 1:127(126) ack 1033 win 246 <nop,nop,timestamp 4650667 16670517> (DF)
03:34:56.795201 192.168.47.51.80 > 192.168.47.49.36318: FP 1:127(126) ack 1270 win 261 <nop,nop,timestamp 4650684 16670534> (DF)
03:34:57.543262 192.168.47.51.80 > 192.168.47.49.36317: FP 1:127(126) ack 1033 win 246 <nop,nop,timestamp 4650871 16670517> (DF)
03:34:57.611266 192.168.47.51.80 > 192.168.47.49.36318: FP 1:127(126) ack 1270 win 261 <nop,nop,timestamp 4650888 16670534> (DF)
03:34:58.174996 192.168.47.49.36320 > 192.168.47.51.80: S 2319470609:2319470609(0) win 5840 <mss 1460,sackOK,timestamp 16671044 0,nop,wscale 6> (DF)
03:34:58.175023 192.168.47.51.80 > 192.168.47.49.36320: S 3915424938:3915424938(0) ack 2319470610 win 5792 <mss 1460,sackOK,timestamp 4651028 16671044,nop,wscale 5> (DF)
03:34:58.175145 192.168.47.49.36320 > 192.168.47.51.80: . ack 1 win 92 <nop,nop,timestamp 16671044 4651028> (DF)
03:34:58.175345 192.168.47.49.36320 > 192.168.47.51.80: P 1:1033(1032) ack 1 win 92 <nop,nop,timestamp 16671044 4651028> (DF)
03:34:58.175359 192.168.47.51.80 > 192.168.47.49.36320: . ack 1033 win 246 <nop,nop,timestamp 4651029 16671044> (DF)
03:34:58.222724 192.168.47.51.80 > 192.168.47.49.36320: P 1:127(126) ack 1033 win 246 <nop,nop,timestamp 4651040 16671044> (DF)
03:34:58.222833 192.168.47.51.80 > 192.168.47.49.36320: F 127:127(0) ack 1033 win 246 <nop,nop,timestamp 4651040 16671044> (DF)
03:34:58.222870 192.168.47.49.36320 > 192.168.47.51.80: . ack 127 win 92 <nop,nop,timestamp 16671056 4651040> (DF)
03:34:58.223019 192.168.47.49.36320 > 192.168.47.51.80: F 1033:1033(0) ack 128 win 92 <nop,nop,timestamp 16671056 4651040> (DF)
03:34:58.223030 192.168.47.51.80 > 192.168.47.49.36320: . ack 1034 win 246 <nop,nop,timestamp 4651040 16671056> (DF)
03:34:58.230258 192.168.47.49.36321 > 192.168.47.51.80: S 2364570356:2364570356(0) win 5840 <mss 1460,sackOK,timestamp 16671058 0,nop,wscale 6> (DF)
03:34:58.230286 192.168.47.51.80 > 192.168.47.49.36321: S 3986884306:3986884306(0) ack 2364570357 win 5792 <mss 1460,sackOK,timestamp 4651042 16671058,nop,wscale 5> (DF)
03:34:58.230406 192.168.47.49.36321 > 192.168.47.51.80: . ack 1 win 92 <nop,nop,timestamp 16671058 4651042> (DF)
03:34:58.230555 192.168.47.49.36321 > 192.168.47.51.80: P 1:817(816) ack 1 win 92 <nop,nop,timestamp 16671058 4651042> (DF)
03:34:58.230567 192.168.47.51.80 > 192.168.47.49.36321: . ack 817 win 232 <nop,nop,timestamp 4651042 16671058> (DF)
03:34:58.277534 192.168.47.51.80 > 192.168.47.49.36321: P 1:127(126) ack 817 win 232 <nop,nop,timestamp 4651054 16671058> (DF)
03:34:58.277682 192.168.47.49.36321 > 192.168.47.51.80: . ack 127 win 92 <nop,nop,timestamp 16671069 4651054> (DF)
03:34:58.277940 192.168.47.51.80 > 192.168.47.49.36321: F 127:127(0) ack 817 win 232 <nop,nop,timestamp 4651054 16671069> (DF)
03:34:58.278131 192.168.47.49.36321 > 192.168.47.51.80: F 817:817(0) ack 128 win 92 <nop,nop,timestamp 16671070 4651054> (DF)
03:34:58.278152 192.168.47.51.80 > 192.168.47.49.36321: . ack 818 win 232 <nop,nop,timestamp 4651054 16671070> (DF)
03:34:59.175399 192.168.47.51.80 > 192.168.47.49.36317: FP 1:127(126) ack 1033 win 246 <nop,nop,timestamp 4651279 16670517> (DF)
03:34:59.243394 192.168.47.51.80 > 192.168.47.49.36318: FP 1:127(126) ack 1270 win 261 <nop,nop,timestamp 4651296 16670534> (DF)
03:35:00.733833 192.168.47.49.36262 > 192.168.47.51.80: P 1:1262(1261) ack 1 win 92 <nop,nop,timestamp 16671684 4648456> (DF)
03:35:00.733886 192.168.47.51.80 > 192.168.47.49.36262: . ack 1262 win 260 <nop,nop,timestamp 4651668 16671684,nop,nop,sack sack 1 {1:1262} > (DF)
03:35:00.811533 192.168.47.51.80 > 192.168.47.49.36262: FP 1:127(126) ack 1262 win 260 <nop,nop,timestamp 4651688 16671684> (DF)
03:35:00.811854 192.168.47.49.36262 > 192.168.47.51.80: F 1262:1262(0) ack 128 win 92 <nop,nop,timestamp 16671703 4651688> (DF)
03:35:00.811880 192.168.47.51.80 > 192.168.47.49.36262: . ack 1263 win 260 <nop,nop,timestamp 4651688 16671703> (DF)
03:35:00.820141 192.168.47.49.36330 > 192.168.47.51.80: S 671062810:671062810(0) win 5840 <mss 1460,sackOK,timestamp 16671705 0,nop,wscale 6> (DF)
03:35:00.820170 192.168.47.51.80 > 192.168.47.49.36330: S 2287081102:2287081102(0) ack 671062811 win 5792 <mss 1460,sackOK,timestamp 4651690 16671705,nop,wscale 5> (DF)
03:35:00.820288 192.168.47.49.36330 > 192.168.47.51.80: . ack 1 win 92 <nop,nop,timestamp 16671705 4651690> (DF)
03:35:00.820487 192.168.47.49.36330 > 192.168.47.51.80: P 1:817(816) ack 1 win 92 <nop,nop,timestamp 16671705 4651690> (DF)
03:35:00.820500 192.168.47.51.80 > 192.168.47.49.36330: . ack 817 win 232 <nop,nop,timestamp 4651690 16671705> (DF)
03:35:00.867593 192.168.47.51.80 > 192.168.47.49.36330: P 1:127(126) ack 817 win 232 <nop,nop,timestamp 4651702 16671705> (DF)
03:35:00.867695 192.168.47.51.80 > 192.168.47.49.36330: F 127:127(0) ack 817 win 232 <nop,nop,timestamp 4651702 16671705> (DF)
03:35:01.071547 192.168.47.51.80 > 192.168.47.49.36330: FP 1:127(126) ack 817 win 232 <nop,nop,timestamp 4651753 16671705> (DF)
03:35:01.479573 192.168.47.51.80 > 192.168.47.49.36330: FP 1:127(126) ack 817 win 232 <nop,nop,timestamp 4651855 16671705> (DF)
03:35:02.295644 192.168.47.51.80 > 192.168.47.49.36330: FP 1:127(126) ack 817 win 232 <nop,nop,timestamp 4652059 16671705> (DF)
03:35:02.439650 192.168.47.51.80 > 192.168.47.49.36317: FP 1:127(126) ack 1033 win 246 <nop,nop,timestamp 4652095 16670517> (DF)
03:35:02.507653 192.168.47.51.80 > 192.168.47.49.36318: FP 1:127(126) ack 1270 win 261 <nop,nop,timestamp 4652112 16670534> (DF)
03:35:03.927767 192.168.47.51.80 > 192.168.47.49.36330: FP 1:127(126) ack 817 win 232 <nop,nop,timestamp 4652467 16671705> (DF)
03:35:07.192041 192.168.47.51.80 > 192.168.47.49.36330: FP 1:127(126) ack 817 win 232 <nop,nop,timestamp 4653283 16671705> (DF)
03:35:08.968169 192.168.47.51.80 > 192.168.47.49.36317: FP 1:127(126) ack 1033 win 246 <nop,nop,timestamp 4653727 16670517> (DF)
03:35:09.036167 192.168.47.51.80 > 192.168.47.49.36318: FP 1:127(126) ack 1270 win 261 <nop,nop,timestamp 4653744 16670534> (DF)
03:35:11.684858 192.168.47.49.36317 > 192.168.47.51.80: P 1:1033(1032) ack 1 win 92 <nop,nop,timestamp 16674422 4650501> (DF)
03:35:11.684910 192.168.47.51.80 > 192.168.47.49.36317: . ack 1033 win 246 <nop,nop,timestamp 4654406 16674422,nop,nop,sack sack 1 {1:1033} > (DF)
03:35:11.752893 192.168.47.49.36318 > 192.168.47.51.80: P 1:1270(1269) ack 1 win 92 <nop,nop,timestamp 16674439 4650519> (DF)
03:35:11.752910 192.168.47.51.80 > 192.168.47.49.36318: . ack 1270 win 261 <nop,nop,timestamp 4654423 16674439,nop,nop,sack sack 1 {1:1270} > (DF)
03:35:13.720546 192.168.47.51.80 > 192.168.47.49.36330: FP 1:127(126) ack 817 win 232 <nop,nop,timestamp 4654915 16671705> (DF)
03:35:13.808685 192.168.47.49.36330 > 192.168.47.51.80: P 1:817(816) ack 1 win 92 <nop,nop,timestamp 16674953 4651690> (DF)
03:35:13.808702 192.168.47.51.80 > 192.168.47.49.36330: . ack 817 win 232 <nop,nop,timestamp 4654937 16674953,nop,nop,sack sack 1 {1:817} > (DF)
03:35:17.921316 192.168.47.49.36332 > 192.168.47.51.80: S 589043232:589043232(0) win 5840 <mss 1460,sackOK,timestamp 16675981 0,nop,wscale 6> (DF)
03:35:17.921359 192.168.47.51.80 > 192.168.47.49.36332: S 2204085694:2204085694(0) ack 589043233 win 5792 <mss 1460,sackOK,timestamp 4655965 16675981,nop,wscale 5> (DF)
03:35:17.921466 192.168.47.49.36332 > 192.168.47.51.80: . ack 1 win 92 <nop,nop,timestamp 16675981 4655965> (DF)
03:35:17.921565 192.168.47.49.36332 > 192.168.47.51.80: P 1:989(988) ack 1 win 92 <nop,nop,timestamp 16675981 4655965> (DF)
03:35:17.921579 192.168.47.51.80 > 192.168.47.49.36332: . ack 989 win 243 <nop,nop,timestamp 4655965 16675981> (DF)
03:35:17.971527 192.168.47.51.80 > 192.168.47.49.36332: P 1:127(126) ack 989 win 243 <nop,nop,timestamp 4655977 16675981> (DF)
03:35:17.971908 192.168.47.51.80 > 192.168.47.49.36332: F 127:127(0) ack 989 win 243 <nop,nop,timestamp 4655977 16675981> (DF)
03:35:18.172898 192.168.47.51.80 > 192.168.47.49.36332: FP 1:127(126) ack 989 win 243 <nop,nop,timestamp 4656028 16675981> (DF)
03:35:18.580921 192.168.47.51.80 > 192.168.47.49.36332: FP 1:127(126) ack 989 win 243 <nop,nop,timestamp 4656130 16675981> (DF)
03:35:19.396989 192.168.47.51.80 > 192.168.47.49.36332: FP 1:127(126) ack 989 win 243 <nop,nop,timestamp 4656334 16675981> (DF)
03:35:21.029133 192.168.47.51.80 > 192.168.47.49.36332: FP 1:127(126) ack 989 win 243 <nop,nop,timestamp 4656742 16675981> (DF)
03:35:22.025196 192.168.47.51.80 > 192.168.47.49.36317: FP 1:127(126) ack 1033 win 246 <nop,nop,timestamp 4656991 16674422> (DF)
03:35:22.093200 192.168.47.51.80 > 192.168.47.49.36318: FP 1:127(126) ack 1270 win 261 <nop,nop,timestamp 4657008 16674439> (DF)
03:35:24.293382 192.168.47.51.80 > 192.168.47.49.36332: FP 1:127(126) ack 989 win 243 <nop,nop,timestamp 4657558 16675981> (DF)
03:35:26.044394 192.168.47.49.36333 > 192.168.47.51.80: S 124002532:124002532(0) win 5840 <mss 1460,sackOK,timestamp 16678012 0,nop,wscale 6> (DF)
03:35:26.044433 192.168.47.51.80 > 192.168.47.49.36333: S 1738901120:1738901120(0) ack 124002533 win 5792 <mss 1460,sackOK,timestamp 4657995 16678012,nop,wscale 5> (DF)
03:35:26.044544 192.168.47.49.36333 > 192.168.47.51.80: . ack 1 win 92 <nop,nop,timestamp 16678012 4657995> (DF)
03:35:26.044743 192.168.47.49.36333 > 192.168.47.51.80: . 1:1449(1448) ack 1 win 92 <nop,nop,timestamp 16678012 4657995> (DF)
03:35:26.044761 192.168.47.51.80 > 192.168.47.49.36333: . ack 1449 win 272 <nop,nop,timestamp 4657995 16678012> (DF)
03:35:26.044744 192.168.47.49.36333 > 192.168.47.51.80: P 1449:2174(725) ack 1 win 92 <nop,nop,timestamp 16678012 4657995> (DF)
03:35:26.044768 192.168.47.51.80 > 192.168.47.49.36333: . ack 2174 win 362 <nop,nop,timestamp 4657995 16678012> (DF)
03:35:26.063970 192.168.47.49.36317 > 192.168.47.51.80: F 1033:1033(0) ack 1 win 92 <nop,nop,timestamp 16678017 4650501> (DF)
03:35:26.064034 192.168.47.51.80 > 192.168.47.49.36317: . ack 1034 win 246 <nop,nop,timestamp 4658000 16678017> (DF)
03:35:26.072611 192.168.47.49.36334 > 192.168.47.51.80: S 151107142:151107142(0) win 5840 <mss 1460,sackOK,timestamp 16678019 0,nop,wscale 6> (DF)
03:35:26.072672 192.168.47.51.80 > 192.168.47.49.36334: S 1773432068:1773432068(0) ack 151107143 win 5792 <mss 1460,sackOK,timestamp 4658002 16678019,nop,wscale 5> (DF)
03:35:26.072800 192.168.47.49.36334 > 192.168.47.51.80: . ack 1 win 92 <nop,nop,timestamp 16678019 4658002> (DF)
03:35:26.072948 192.168.47.49.36334 > 192.168.47.51.80: P 1:817(816) ack 1 win 92 <nop,nop,timestamp 16678019 4658002> (DF)
03:35:26.072964 192.168.47.51.80 > 192.168.47.49.36334: . ack 817 win 232 <nop,nop,timestamp 4658002 16678019> (DF)
03:35:26.109178 192.168.47.51.80 > 192.168.47.49.36333: P 1:127(126) ack 2174 win 362 <nop,nop,timestamp 4658011 16678012> (DF)
03:35:26.109285 192.168.47.51.80 > 192.168.47.49.36333: F 127:127(0) ack 2174 win 362 <nop,nop,timestamp 4658011 16678012> (DF)
03:35:26.109291 192.168.47.49.36333 > 192.168.47.51.80: . ack 127 win 92 <nop,nop,timestamp 16678028 4658011> (DF)
03:35:26.109640 192.168.47.49.36333 > 192.168.47.51.80: F 2174:2174(0) ack 128 win 92 <nop,nop,timestamp 16678028 4658011> (DF)
03:35:26.109656 192.168.47.51.80 > 192.168.47.49.36333: . ack 2175 win 362 <nop,nop,timestamp 4658012 16678028> (DF)
03:35:26.132018 192.168.47.49.36318 > 192.168.47.51.80: F 1270:1270(0) ack 1 win 92 <nop,nop,timestamp 16678034 4650519> (DF)
03:35:26.132094 192.168.47.51.80 > 192.168.47.49.36318: . ack 1271 win 261 <nop,nop,timestamp 4658017 16678034> (DF)
03:35:26.144314 192.168.47.51.80 > 192.168.47.49.36334: P 1:127(126) ack 817 win 232 <nop,nop,timestamp 4658020 16678019> (DF)
03:35:26.144534 192.168.47.49.36334 > 192.168.47.51.80: . ack 127 win 92 <nop,nop,timestamp 16678037 4658020> (DF)
03:35:26.144741 192.168.47.51.80 > 192.168.47.49.36334: F 127:127(0) ack 817 win 232 <nop,nop,timestamp 4658020 16678037> (DF)
03:35:26.148278 192.168.47.49.36334 > 192.168.47.51.80: F 817:817(0) ack 128 win 92 <nop,nop,timestamp 16678038 4658020> (DF)
03:35:26.148296 192.168.47.51.80 > 192.168.47.49.36334: . ack 818 win 232 <nop,nop,timestamp 4658021 16678038> (DF)
03:35:26.187713 192.168.47.49.36335 > 192.168.47.51.80: S 274424664:274424664(0) win 5840 <mss 1460,sackOK,timestamp 16678047 0,nop,wscale 6> (DF)
03:35:26.187737 192.168.47.51.80 > 192.168.47.49.36335: S 1889614011:1889614011(0) ack 274424665 win 5792 <mss 1460,sackOK,timestamp 4658031 16678047,nop,wscale 5> (DF)
03:35:26.187863 192.168.47.49.36335 > 192.168.47.51.80: . ack 1 win 92 <nop,nop,timestamp 16678047 4658031> (DF)
03:35:26.188012 192.168.47.49.36335 > 192.168.47.51.80: P 1:993(992) ack 1 win 92 <nop,nop,timestamp 16678048 4658031> (DF)
03:35:26.188023 192.168.47.51.80 > 192.168.47.49.36335: . ack 993 win 243 <nop,nop,timestamp 4658031 16678048> (DF)
03:35:26.236034 192.168.47.51.80 > 192.168.47.49.36335: P 1:127(126) ack 993 win 243 <nop,nop,timestamp 4658043 16678048> (DF)
03:35:26.236157 192.168.47.51.80 > 192.168.47.49.36335: F 127:127(0) ack 993 win 243 <nop,nop,timestamp 4658043 16678048> (DF)
03:35:26.236237 192.168.47.49.36335 > 192.168.47.51.80: . ack 127 win 92 <nop,nop,timestamp 16678060 4658043> (DF)
03:35:26.240480 192.168.47.49.36335 > 192.168.47.51.80: F 993:993(0) ack 128 win 92 <nop,nop,timestamp 16678061 4658043> (DF)
03:35:26.240493 192.168.47.51.80 > 192.168.47.49.36335: . ack 994 win 243 <nop,nop,timestamp 4658044 16678061> (DF)
03:35:26.290949 192.168.47.49.36336 > 192.168.47.51.80: S 364699584:364699584(0) win 5840 <mss 1460,sackOK,timestamp 16678073 0,nop,wscale 6> (DF)
03:35:26.290973 192.168.47.51.80 > 192.168.47.49.36336: S 1989280707:1989280707(0) ack 364699585 win 5792 <mss 1460,sackOK,timestamp 4658057 16678073,nop,wscale 5> (DF)
03:35:26.291147 192.168.47.49.36336 > 192.168.47.51.80: . ack 1 win 92 <nop,nop,timestamp 16678073 4658057> (DF)
03:35:26.291347 192.168.47.49.36336 > 192.168.47.51.80: . 1:1449(1448) ack 1 win 92 <nop,nop,timestamp 16678073 4658057> (DF)
03:35:26.291348 192.168.47.49.36336 > 192.168.47.51.80: . 1449:2897(1448) ack 1 win 92 <nop,nop,timestamp 16678073 4658057> (DF)
03:35:26.291349 192.168.47.49.36336 > 192.168.47.51.80: P 2897:3486(589) ack 1 win 92 <nop,nop,timestamp 16678073 4658057> (DF)
03:35:26.291738 192.168.47.51.80 > 192.168.47.49.36336: . ack 1449 win 272 <nop,nop,timestamp 4658057 16678073> (DF)
03:35:26.291747 192.168.47.51.80 > 192.168.47.49.36336: . ack 2897 win 362 <nop,nop,timestamp 4658057 16678073> (DF)
03:35:26.291752 192.168.47.51.80 > 192.168.47.49.36336: . ack 3486 win 453 <nop,nop,timestamp 4658057 16678073> (DF)
03:35:26.292607 192.168.47.49.36337 > 192.168.47.51.80: S 369328236:369328236(0) win 5840 <mss 1460,sackOK,timestamp 16678074 0,nop,wscale 6> (DF)
03:35:26.292660 192.168.47.51.80 > 192.168.47.49.36337: S 2000470138:2000470138(0) ack 369328237 win 5792 <mss 1460,sackOK,timestamp 4658057 16678074,nop,wscale 5> (DF)
03:35:26.292795 192.168.47.49.36337 > 192.168.47.51.80: . ack 1 win 92 <nop,nop,timestamp 16678074 4658057> (DF)
03:35:26.293044 192.168.47.49.36337 > 192.168.47.51.80: P 1:829(828) ack 1 win 92 <nop,nop,timestamp 16678074 4658057> (DF)
03:35:26.293064 192.168.47.51.80 > 192.168.47.49.36337: . ack 829 win 233 <nop,nop,timestamp 4658057 16678074> (DF)
03:35:26.300196 192.168.47.49.36338 > 192.168.47.51.80: S 378520579:378520579(0) win 5840 <mss 1460,sackOK,timestamp 16678076 0,nop,wscale 6> (DF)
03:35:26.300260 192.168.47.51.80 > 192.168.47.49.36338: S 2004233461:2004233461(0) ack 378520580 win 5792 <mss 1460,sackOK,timestamp 4658059 16678076,nop,wscale 5> (DF)
03:35:26.300382 192.168.47.49.36338 > 192.168.47.51.80: . ack 1 win 92 <nop,nop,timestamp 16678076 4658059> (DF)
03:35:26.300582 192.168.47.49.36338 > 192.168.47.51.80: . 1:1449(1448) ack 1 win 92 <nop,nop,timestamp 16678076 4658059> (DF)
03:35:26.300601 192.168.47.51.80 > 192.168.47.49.36338: . ack 1449 win 272 <nop,nop,timestamp 4658059 16678076> (DF)
03:35:26.300583 192.168.47.49.36338 > 192.168.47.51.80: P 1449:2186(737) ack 1 win 92 <nop,nop,timestamp 16678076 4658059> (DF)
03:35:26.300609 192.168.47.51.80 > 192.168.47.49.36338: . ack 2186 win 362 <nop,nop,timestamp 4658059 16678076> (DF)
03:35:26.381463 192.168.47.51.80 > 192.168.47.49.36336: P 1:127(126) ack 3486 win 453 <nop,nop,timestamp 4658079 16678073> (DF)
03:35:26.381604 192.168.47.49.36336 > 192.168.47.51.80: . ack 127 win 92 <nop,nop,timestamp 16678096 4658079> (DF)
03:35:26.381629 192.168.47.51.80 > 192.168.47.49.36336: F 127:127(0) ack 3486 win 453 <nop,nop,timestamp 4658080 16678073> (DF)
03:35:26.381802 192.168.47.49.36336 > 192.168.47.51.80: F 3486:3486(0) ack 128 win 92 <nop,nop,timestamp 16678096 4658080> (DF)
03:35:26.381815 192.168.47.51.80 > 192.168.47.49.36336: . ack 3487 win 453 <nop,nop,timestamp 4658080 16678096> (DF)
03:35:26.391376 192.168.47.51.80 > 192.168.47.49.36337: P 1:127(126) ack 829 win 233 <nop,nop,timestamp 4658082 16678074> (DF)
03:35:26.391486 192.168.47.51.80 > 192.168.47.49.36337: F 127:127(0) ack 829 win 233 <nop,nop,timestamp 4658082 16678074> (DF)
03:35:26.391587 192.168.47.49.36337 > 192.168.47.51.80: . ack 127 win 92 <nop,nop,timestamp 16678098 4658082> (DF)
03:35:26.396239 192.168.47.49.36337 > 192.168.47.51.80: F 829:829(0) ack 128 win 92 <nop,nop,timestamp 16678100 4658082> (DF)
03:35:26.396297 192.168.47.51.80 > 192.168.47.49.36337: . ack 830 win 233 <nop,nop,timestamp 4658083 16678100> (DF)
03:35:26.440440 192.168.47.51.80 > 192.168.47.49.36338: P 1:127(126) ack 2186 win 362 <nop,nop,timestamp 4658094 16678076> (DF)
03:35:26.440545 192.168.47.51.80 > 192.168.47.49.36338: F 127:127(0) ack 2186 win 362 <nop,nop,timestamp 4658094 16678076> (DF)
03:35:26.440658 192.168.47.49.36338 > 192.168.47.51.80: . ack 127 win 92 <nop,nop,timestamp 16678111 4658094> (DF)
03:35:26.440857 192.168.47.49.36338 > 192.168.47.51.80: F 2186:2186(0) ack 128 win 92 <nop,nop,timestamp 16678111 4658094> (DF)
03:35:26.440870 192.168.47.51.80 > 192.168.47.49.36338: . ack 2187 win 362 <nop,nop,timestamp 4658094 16678111> (DF)
03:35:26.777579 192.168.47.51.80 > 192.168.47.49.36330: FP 1:127(126) ack 817 win 232 <nop,nop,timestamp 4658179 16674953> (DF)
03:35:30.815625 192.168.47.49.36330 > 192.168.47.51.80: F 817:817(0) ack 1 win 92 <nop,nop,timestamp 16679205 4651690> (DF)
03:35:30.815674 192.168.47.51.80 > 192.168.47.49.36330: . ack 818 win 232 <nop,nop,timestamp 4659188 16679205> (DF)
03:35:30.821894 192.168.47.51.80 > 192.168.47.49.36332: FP 1:127(126) ack 989 win 243 <nop,nop,timestamp 4659190 16675981> (DF)
03:35:30.911663 192.168.47.49.36332 > 192.168.47.51.80: P 1:989(988) ack 1 win 92 <nop,nop,timestamp 16679229 4655965> (DF)
03:35:30.911684 192.168.47.51.80 > 192.168.47.49.36332: . ack 989 win 243 <nop,nop,timestamp 4659212 16679229,nop,nop,sack sack 1 {1:989} > (DF)
03:35:43.878944 192.168.47.51.80 > 192.168.47.49.36332: FP 1:127(126) ack 989 win 243 <nop,nop,timestamp 4662454 16679229> (DF)
03:35:43.879198 192.168.47.49.36332 > 192.168.47.51.80: F 989:989(0) ack 128 win 92 <nop,nop,timestamp 16682471 4662454> (DF)
03:35:43.879231 192.168.47.51.80 > 192.168.47.49.36332: . ack 990 win 243 <nop,nop,timestamp 4662454 16682471> (DF)
03:35:48.139281 192.168.47.51.80 > 192.168.47.49.36317: FP 1:127(126) ack 1034 win 246 <nop,nop,timestamp 4663519 16678017> (DF)
03:35:48.139442 192.168.47.49.36317 > 192.168.47.51.80: R 214430197:214430197(0) win 0 (DF)
03:35:48.207268 192.168.47.51.80 > 192.168.47.49.36318: FP 1:127(126) ack 1271 win 261 <nop,nop,timestamp 4663536 16678034> (DF)
03:35:48.207432 192.168.47.49.36318 > 192.168.47.51.80: R 275551241:275551241(0) win 0 (DF)
03:35:52.891656 192.168.47.51.80 > 192.168.47.49.36330: FP 1:127(126) ack 818 win 232 <nop,nop,timestamp 4664707 16679205> (DF)
03:35:52.891846 192.168.47.49.36330 > 192.168.47.51.80: R 671063628:671063628(0) win 0 (DF)
03:36:32.812550 192.168.47.49.36416 > 192.168.47.51.80: S 2458342137:2458342137(0) win 5840 <mss 1460,sackOK,timestamp 16694704 0,nop,wscale 6> (DF)
03:36:32.812597 192.168.47.51.80 > 192.168.47.49.36416: S 4095144779:4095144779(0) ack 2458342138 win 5792 <mss 1460,sackOK,timestamp 4674686 16694704,nop,wscale 5> (DF)
03:36:32.812799 192.168.47.49.36416 > 192.168.47.51.80: . ack 1 win 92 <nop,nop,timestamp 16694704 4674686> (DF)
03:36:32.812900 192.168.47.49.36416 > 192.168.47.51.80: P 1:96(95) ack 1 win 92 <nop,nop,timestamp 16694704 4674686> (DF)
03:36:32.812914 192.168.47.51.80 > 192.168.47.49.36416: . ack 96 win 181 <nop,nop,timestamp 4674686 16694704> (DF)
03:36:32.815397 192.168.47.51.80 > 192.168.47.49.36416: P 1:119(118) ack 96 win 181 <nop,nop,timestamp 4674687 16694704> (DF)
03:36:32.815683 192.168.47.51.80 > 192.168.47.49.36416: F 119:119(0) ack 96 win 181 <nop,nop,timestamp 4674687 16694704> (DF)
03:36:32.815696 192.168.47.49.36416 > 192.168.47.51.80: . ack 119 win 92 <nop,nop,timestamp 16694705 4674687> (DF)
03:36:32.831570 192.168.47.49.36416 > 192.168.47.51.80: F 96:96(0) ack 120 win 92 <nop,nop,timestamp 16694709 4674687> (DF)
03:36:32.831584 192.168.47.51.80 > 192.168.47.49.36416: . ack 97 win 181 <nop,nop,timestamp 4674691 16694709> (DF)
03:38:32.731309 192.168.47.49.36526 > 192.168.47.51.80: S 2127614375:2127614375(0) win 5840 <mss 1460,sackOK,timestamp 16724685 0,nop,wscale 6> (DF)
03:38:32.731326 192.168.47.51.80 > 192.168.47.49.36526: S 3748260601:3748260601(0) ack 2127614376 win 5792 <mss 1460,sackOK,timestamp 4704663 16724685,nop,wscale 5> (DF)
03:38:32.731458 192.168.47.49.36526 > 192.168.47.51.80: . ack 1 win 92 <nop,nop,timestamp 16724685 4704663> (DF)
03:38:32.731559 192.168.47.49.36526 > 192.168.47.51.80: P 1:96(95) ack 1 win 92 <nop,nop,timestamp 16724685 4704663> (DF)
03:38:32.731577 192.168.47.51.80 > 192.168.47.49.36526: . ack 96 win 181 <nop,nop,timestamp 4704663 16724685> (DF)
03:38:32.732289 192.168.47.51.80 > 192.168.47.49.36526: P 1:119(118) ack 96 win 181 <nop,nop,timestamp 4704663 16724685> (DF)
03:38:32.732340 192.168.47.51.80 > 192.168.47.49.36526: F 119:119(0) ack 96 win 181 <nop,nop,timestamp 4704663 16724685> (DF)
03:38:32.732458 192.168.47.49.36526 > 192.168.47.51.80: . ack 119 win 92 <nop,nop,timestamp 16724685 4704663> (DF)
03:38:32.732507 192.168.47.49.36526 > 192.168.47.51.80: F 96:96(0) ack 120 win 92 <nop,nop,timestamp 16724685 4704663> (DF)
03:38:32.732518 192.168.47.51.80 > 192.168.47.49.36526: . ack 97 win 181 <nop,nop,timestamp 4704663 16724685> (DF)
03:40:32.308085 192.168.47.49.48957 > 192.168.47.51.80: S 1462391007:1462391007(0) win 5840 <mss 1460,sackOK,timestamp 16754582 0,nop,wscale 6> (DF)
03:40:32.308127 192.168.47.51.80 > 192.168.47.49.48957: S 3089510102:3089510102(0) ack 1462391008 win 5792 <mss 1460,sackOK,timestamp 4734555 16754582,nop,wscale 5> (DF)
03:40:32.308335 192.168.47.49.48957 > 192.168.47.51.80: . ack 1 win 92 <nop,nop,timestamp 16754582 4734555> (DF)
03:40:32.308485 192.168.47.49.48957 > 192.168.47.51.80: P 1:96(95) ack 1 win 92 <nop,nop,timestamp 16754582 4734555> (DF)
03:40:32.308502 192.168.47.51.80 > 192.168.47.49.48957: . ack 96 win 181 <nop,nop,timestamp 4734555 16754582> (DF)
03:40:32.310546 192.168.47.51.80 > 192.168.47.49.48957: P 1:119(118) ack 96 win 181 <nop,nop,timestamp 4734555 16754582> (DF)
03:40:32.310643 192.168.47.51.80 > 192.168.47.49.48957: F 119:119(0) ack 96 win 181 <nop,nop,timestamp 4734555 16754582> (DF)
03:40:32.344329 192.168.47.49.48957 > 192.168.47.51.80: . ack 119 win 92 <nop,nop,timestamp 16754591 4734555> (DF)
03:40:32.344427 192.168.47.49.48957 > 192.168.47.51.80: F 96:96(0) ack 120 win 92 <nop,nop,timestamp 16754591 4734555> (DF)
03:40:32.344440 192.168.47.51.80 > 192.168.47.49.48957: . ack 97 win 181 <nop,nop,timestamp 4734564 16754591> (DF)
03:42:32.998779 192.168.47.49.49054 > 192.168.47.51.80: S 1896172928:1896172928(0) win 5840 <mss 1460,sackOK,timestamp 16784756 0,nop,wscale 6> (DF)
03:42:32.998821 192.168.47.51.80 > 192.168.47.49.49054: S 3515440759:3515440759(0) ack 1896172929 win 5792 <mss 1460,sackOK,timestamp 4764725 16784756,nop,wscale 5> (DF)
03:42:32.999027 192.168.47.49.49054 > 192.168.47.51.80: . ack 1 win 92 <nop,nop,timestamp 16784756 4764725> (DF)
03:42:33.048899 192.168.47.49.49054 > 192.168.47.51.80: P 1:96(95) ack 1 win 92 <nop,nop,timestamp 16784769 4764725> (DF)
03:42:33.049035 192.168.47.51.80 > 192.168.47.49.49054: . ack 96 win 181 <nop,nop,timestamp 4764737 16784769> (DF)
03:42:33.049742 192.168.47.51.80 > 192.168.47.49.49054: P 1:119(118) ack 96 win 181 <nop,nop,timestamp 4764737 16784769> (DF)
03:42:33.049807 192.168.47.51.80 > 192.168.47.49.49054: F 119:119(0) ack 96 win 181 <nop,nop,timestamp 4764737 16784769> (DF)
03:42:33.050047 192.168.47.49.49054 > 192.168.47.51.80: . ack 119 win 92 <nop,nop,timestamp 16784769 4764737> (DF)
03:42:33.050196 192.168.47.49.49054 > 192.168.47.51.80: F 96:96(0) ack 120 win 92 <nop,nop,timestamp 16784769 4764737> (DF)
03:42:33.050209 192.168.47.51.80 > 192.168.47.49.49054: . ack 97 win 181 <nop,nop,timestamp 4764738 16784769> (DF)
03:34:48.018207 192.168.47.49.36263 > 192.168.47.51.80: . ack 127 win 92 <nop,nop,timestamp 16668508 4648492> (DF)
03:34:48.018654 192.168.47.51.80 > 192.168.47.49.36263: F 127:127(0) ack 1262 win 260 <nop,nop,timestamp 4648493 16668508> (DF)
03:34:48.018802 192.168.47.49.36263 > 192.168.47.51.80: F 1262:1262(0) ack 128 win 92 <nop,nop,timestamp 16668508 4648493> (DF)
03:34:48.018933 192.168.47.51.80 > 192.168.47.49.36263: . ack 1263 win 260 <nop,nop,timestamp 4648493 16668508> (DF)
03:34:48.027025 192.168.47.49.36270 > 192.168.47.51.80: S 770791894:770791894(0) win 5840 <mss 1460,sackOK,timestamp 16668510 0,nop,wscale 6> (DF)
03:34:48.027176 192.168.47.51.80 > 192.168.47.49.36270: S 2383819929:2383819929(0) ack 770791895 win 5792 <mss 1460,sackOK,timestamp 4648495 16668510,nop,wscale 5> (DF)
03:34:48.027228 192.168.47.49.36270 > 192.168.47.51.80: . ack 1 win 92 <nop,nop,timestamp 16668510 4648495> (DF)
03:34:48.027295 192.168.47.49.36270 > 192.168.47.51.80: P 1:613(612) ack 1 win 92 <nop,nop,timestamp 16668510 4648495> (DF)
03:34:48.027410 192.168.47.51.80 > 192.168.47.49.36270: . ack 613 win 220 <nop,nop,timestamp 4648495 16668510> (DF)
03:34:48.073849 192.168.47.49.36262 > 192.168.47.51.80: P 1:1262(1261) ack 1 win 92 <nop,nop,timestamp 16668522 4648456> (DF)
03:34:48.074118 192.168.47.51.80 > 192.168.47.49.36262: . ack 1262 win 260 <nop,nop,timestamp 4648506 16668522,nop,nop,sack sack 1 {1:1262} > (DF)
03:34:48.074428 192.168.47.51.80 > 192.168.47.49.36270: P 1:127(126) ack 613 win 220 <nop,nop,timestamp 4648507 16668510> (DF)
03:34:48.074445 192.168.47.49.36270 > 192.168.47.51.80: . ack 127 win 92 <nop,nop,timestamp 16668522 4648507> (DF)
03:34:48.074501 192.168.47.51.80 > 192.168.47.49.36270: F 127:127(0) ack 613 win 220 <nop,nop,timestamp 4648507 16668510> (DF)
03:34:48.074610 192.168.47.49.36270 > 192.168.47.51.80: F 613:613(0) ack 128 win 92 <nop,nop,timestamp 16668522 4648507> (DF)
03:34:48.074740 192.168.47.51.80 > 192.168.47.49.36270: . ack 614 win 220 <nop,nop,timestamp 4648507 16668522> (DF)
03:34:48.150138 192.168.47.51.80 > 192.168.47.49.36262: FP 1:127(126) ack 1262 win 260 <nop,nop,timestamp 4648526 16668522> (DF)
03:34:48.481857 192.168.47.49.36262 > 192.168.47.51.80: P 1:1262(1261) ack 1 win 92 <nop,nop,timestamp 16668624 4648456> (DF)
03:34:48.482053 192.168.47.51.80 > 192.168.47.49.36262: . ack 1262 win 260 <nop,nop,timestamp 4648608 16668624,nop,nop,sack sack 1 {1:1262} > (DF)
03:34:48.558171 192.168.47.51.80 > 192.168.47.49.36262: FP 1:127(126) ack 1262 win 260 <nop,nop,timestamp 4648628 16668624> (DF)
03:34:49.297822 192.168.47.49.36262 > 192.168.47.51.80: P 1:1262(1261) ack 1 win 92 <nop,nop,timestamp 16668828 4648456> (DF)
03:34:49.297993 192.168.47.51.80 > 192.168.47.49.36262: . ack 1262 win 260 <nop,nop,timestamp 4648812 16668828,nop,nop,sack sack 1 {1:1262} > (DF)
03:34:49.374247 192.168.47.51.80 > 192.168.47.49.36262: FP 1:127(126) ack 1262 win 260 <nop,nop,timestamp 4648832 16668828> (DF)
03:34:50.929788 192.168.47.49.36262 > 192.168.47.51.80: P 1:1262(1261) ack 1 win 92 <nop,nop,timestamp 16669236 4648456> (DF)
03:34:50.929998 192.168.47.51.80 > 192.168.47.49.36262: . ack 1262 win 260 <nop,nop,timestamp 4649220 16669236,nop,nop,sack sack 1 {1:1262} > (DF)
03:34:51.006411 192.168.47.51.80 > 192.168.47.49.36262: FP 1:127(126) ack 1262 win 260 <nop,nop,timestamp 4649240 16669236> (DF)
03:34:52.701754 192.168.47.49.36191 > 192.168.47.51.80: P 1:1262(1261) ack 1 win 92 <nop,nop,timestamp 16669679 4643187> (DF)
03:34:52.701940 192.168.47.51.80 > 192.168.47.49.36191: . ack 1262 win 260 <nop,nop,timestamp 4649663 16669679,nop,nop,sack sack 1 {1:1262} > (DF)
03:34:52.705596 192.168.47.49.36192 > 192.168.47.51.80: P 1:1270(1269) ack 1 win 92 <nop,nop,timestamp 16669680 4643188> (DF)
03:34:52.705774 192.168.47.51.80 > 192.168.47.49.36192: . ack 1270 win 261 <nop,nop,timestamp 4649664 16669680,nop,nop,sack sack 1 {1:1270} > (DF)
03:34:52.794582 192.168.47.51.80 > 192.168.47.49.36192: FP 1:127(126) ack 1270 win 261 <nop,nop,timestamp 4649687 16669680> (DF)
03:34:52.794744 192.168.47.49.36192 > 192.168.47.51.80: F 1270:1270(0) ack 128 win 92 <nop,nop,timestamp 16669702 4649687> (DF)
03:34:52.794884 192.168.47.51.80 > 192.168.47.49.36192: . ack 1271 win 261 <nop,nop,timestamp 4649687 16669702> (DF)
03:34:52.802589 192.168.47.51.80 > 192.168.47.49.36191: FP 1:127(126) ack 1262 win 260 <nop,nop,timestamp 4649689 16669679> (DF)
03:34:52.802920 192.168.47.49.36191 > 192.168.47.51.80: F 1262:1262(0) ack 128 win 92 <nop,nop,timestamp 16669704 4649689> (DF)
03:34:52.803022 192.168.47.51.80 > 192.168.47.49.36191: . ack 1263 win 260 <nop,nop,timestamp 4649689 16669704> (DF)
03:34:53.909593 192.168.47.49.36193 > 192.168.47.51.80: . 1:1449(1448) ack 1 win 92 <nop,nop,timestamp 16669981 4643489> (DF)
03:34:53.909773 192.168.47.51.80 > 192.168.47.49.36193: . ack 2186 win 362 <nop,nop,timestamp 4649965 16663504,nop,nop,sack sack 1 {1:1449} > (DF)
03:34:53.958711 192.168.47.51.80 > 192.168.47.49.36193: FP 1:127(126) ack 2186 win 362 <nop,nop,timestamp 4649978 16663504> (DF)
03:34:53.958874 192.168.47.49.36193 > 192.168.47.51.80: F 2186:2186(0) ack 128 win 92 <nop,nop,timestamp 16669993 4649978> (DF)
03:34:53.958998 192.168.47.51.80 > 192.168.47.49.36193: . ack 2187 win 362 <nop,nop,timestamp 4649978 16669993> (DF)
03:34:54.193706 192.168.47.49.36262 > 192.168.47.51.80: P 1:1262(1261) ack 1 win 92 <nop,nop,timestamp 16670052 4648456> (DF)
03:34:54.193880 192.168.47.51.80 > 192.168.47.49.36262: . ack 1262 win 260 <nop,nop,timestamp 4650036 16670052,nop,nop,sack sack 1 {1:1262} > (DF)
03:34:54.270746 192.168.47.51.80 > 192.168.47.49.36262: FP 1:127(126) ack 1262 win 260 <nop,nop,timestamp 4650056 16670052> (DF)
03:34:55.131873 192.168.47.49.36289 > 192.168.47.51.80: S 3581686605:3581686605(0) win 5840 <mss 1460,sackOK,timestamp 16670286 0,nop,wscale 6> (DF)
03:34:55.132007 192.168.47.51.80 > 192.168.47.49.36289: S 897930458:897930458(0) ack 3581686606 win 5792 <mss 1460,sackOK,timestamp 4650271 16670286,nop,wscale 5> (DF)
03:34:55.132038 192.168.47.49.36289 > 192.168.47.51.80: . ack 1 win 92 <nop,nop,timestamp 16670286 4650271> (DF)
03:34:55.132214 192.168.47.49.36289 > 192.168.47.51.80: . 1:1449(1448) ack 1 win 92 <nop,nop,timestamp 16670286 4650271> (DF)
03:34:55.132230 192.168.47.49.36289 > 192.168.47.51.80: P 1449:1902(453) ack 1 win 92 <nop,nop,timestamp 16670286 4650271> (DF)
03:34:55.132409 192.168.47.51.80 > 192.168.47.49.36289: . ack 1449 win 272 <nop,nop,timestamp 4650271 16670286> (DF)
03:34:55.132427 192.168.47.51.80 > 192.168.47.49.36289: . ack 1902 win 362 <nop,nop,timestamp 4650271 16670286> (DF)
03:34:55.182373 192.168.47.51.80 > 192.168.47.49.36289: P 1:127(126) ack 1902 win 362 <nop,nop,timestamp 4650283 16670286> (DF)
03:34:55.182385 192.168.47.49.36289 > 192.168.47.51.80: . ack 127 win 92 <nop,nop,timestamp 16670299 4650283> (DF)
03:34:55.182780 192.168.47.51.80 > 192.168.47.49.36289: F 127:127(0) ack 1902 win 362 <nop,nop,timestamp 4650283 16670299> (DF)
03:34:55.182855 192.168.47.49.36289 > 192.168.47.51.80: F 1902:1902(0) ack 128 win 92 <nop,nop,timestamp 16670299 4650283> (DF)
03:34:55.182976 192.168.47.51.80 > 192.168.47.49.36289: . ack 1903 win 362 <nop,nop,timestamp 4650284 16670299> (DF)
03:34:55.238756 192.168.47.49.36290 > 192.168.47.51.80: S 3681005327:3681005327(0) win 5840 <mss 1460,sackOK,timestamp 16670313 0,nop,wscale 6> (DF)
03:34:55.238890 192.168.47.51.80 > 192.168.47.49.36290: S 993631602:993631602(0) ack 3681005328 win 5792 <mss 1460,sackOK,timestamp 4650298 16670313,nop,wscale 5> (DF)
03:34:55.238919 192.168.47.49.36290 > 192.168.47.51.80: . ack 1 win 92 <nop,nop,timestamp 16670313 4650298> (DF)
03:34:55.239030 192.168.47.49.36290 > 192.168.47.51.80: P 1:597(596) ack 1 win 92 <nop,nop,timestamp 16670313 4650298> (DF)
03:34:55.239177 192.168.47.51.80 > 192.168.47.49.36290: . ack 597 win 219 <nop,nop,timestamp 4650298 16670313> (DF)
03:34:55.287396 192.168.47.51.80 > 192.168.47.49.36290: P 1:127(126) ack 597 win 219 <nop,nop,timestamp 4650310 16670313> (DF)
03:34:55.287408 192.168.47.49.36290 > 192.168.47.51.80: . ack 127 win 92 <nop,nop,timestamp 16670325 4650310> (DF)
03:34:55.287482 192.168.47.51.80 > 192.168.47.49.36290: F 127:127(0) ack 597 win 219 <nop,nop,timestamp 4650310 16670313> (DF)
03:34:55.287590 192.168.47.49.36290 > 192.168.47.51.80: F 597:597(0) ack 128 win 92 <nop,nop,timestamp 16670325 4650310> (DF)
03:34:55.287700 192.168.47.51.80 > 192.168.47.49.36290: . ack 598 win 219 <nop,nop,timestamp 4650310 16670325> (DF)
03:34:55.294183 192.168.47.49.36291 > 192.168.47.51.80: S 3743831949:3743831949(0) win 5840 <mss 1460,sackOK,timestamp 16670327 0,nop,wscale 6> (DF)
03:34:55.294303 192.168.47.51.80 > 192.168.47.49.36291: S 1060099595:1060099595(0) ack 3743831950 win 5792 <mss 1460,sackOK,timestamp 4650311 16670327,nop,wscale 5> (DF)
03:34:55.294335 192.168.47.49.36291 > 192.168.47.51.80: . ack 1 win 92 <nop,nop,timestamp 16670327 4650311> (DF)
03:34:55.294439 192.168.47.49.36291 > 192.168.47.51.80: P 1:1041(1040) ack 1 win 92 <nop,nop,timestamp 16670327 4650311> (DF)
03:34:55.294588 192.168.47.51.80 > 192.168.47.49.36291: . ack 1041 win 246 <nop,nop,timestamp 4650311 16670327> (DF)
03:34:55.343874 192.168.47.51.80 > 192.168.47.49.36291: P 1:127(126) ack 1041 win 246 <nop,nop,timestamp 4650324 16670327> (DF)
03:34:55.343887 192.168.47.49.36291 > 192.168.47.51.80: . ack 127 win 92 <nop,nop,timestamp 16670339 4650324> (DF)
03:34:55.344321 192.168.47.51.80 > 192.168.47.49.36291: F 127:127(0) ack 1041 win 246 <nop,nop,timestamp 4650324 16670339> (DF)
03:34:55.344397 192.168.47.49.36291 > 192.168.47.51.80: F 1041:1041(0) ack 128 win 92 <nop,nop,timestamp 16670339 4650324> (DF)
03:34:55.344512 192.168.47.51.80 > 192.168.47.49.36291: . ack 1042 win 246 <nop,nop,timestamp 4650324 16670339> (DF)
03:34:55.347191 192.168.47.49.36292 > 192.168.47.51.80: S 3792747634:3792747634(0) win 5840 <mss 1460,sackOK,timestamp 16670340 0,nop,wscale 6> (DF)
03:34:55.347315 192.168.47.51.80 > 192.168.47.49.36292: S 1107827245:1107827245(0) ack 3792747635 win 5792 <mss 1460,sackOK,timestamp 4650325 16670340,nop,wscale 5> (DF)
03:34:55.347350 192.168.47.49.36292 > 192.168.47.51.80: . ack 1 win 92 <nop,nop,timestamp 16670340 4650325> (DF)
03:34:55.347419 192.168.47.49.36292 > 192.168.47.51.80: P 1:669(668) ack 1 win 92 <nop,nop,timestamp 16670340 4650325> (DF)
03:34:55.347552 192.168.47.51.80 > 192.168.47.49.36292: . ack 669 win 223 <nop,nop,timestamp 4650325 16670340> (DF)
03:34:55.396531 192.168.47.51.80 > 192.168.47.49.36292: P 1:127(126) ack 669 win 223 <nop,nop,timestamp 4650337 16670340> (DF)
03:34:55.396544 192.168.47.49.36292 > 192.168.47.51.80: . ack 127 win 92 <nop,nop,timestamp 16670352 4650337> (DF)
03:34:55.396618 192.168.47.51.80 > 192.168.47.49.36292: F 127:127(0) ack 669 win 223 <nop,nop,timestamp 4650337 16670340> (DF)
03:34:55.396715 192.168.47.49.36292 > 192.168.47.51.80: F 669:669(0) ack 128 win 92 <nop,nop,timestamp 16670352 4650337> (DF)
03:34:55.396822 192.168.47.51.80 > 192.168.47.49.36292: . ack 670 win 223 <nop,nop,timestamp 4650337 16670352> (DF)
03:34:55.466753 192.168.47.49.36293 > 192.168.47.51.80: S 3923414935:3923414935(0) win 5840 <mss 1460,sackOK,timestamp 16670370 0,nop,wscale 6> (DF)
03:34:55.466875 192.168.47.51.80 > 192.168.47.49.36293: S 1219399545:1219399545(0) ack 3923414936 win 5792 <mss 1460,sackOK,timestamp 4650355 16670370,nop,wscale 5> (DF)
03:34:55.466907 192.168.47.49.36293 > 192.168.47.51.80: . ack 1 win 92 <nop,nop,timestamp 16670370 4650355> (DF)
03:34:55.467024 192.168.47.49.36293 > 192.168.47.51.80: . 1:1449(1448) ack 1 win 92 <nop,nop,timestamp 16670370 4650355> (DF)
03:34:55.467039 192.168.47.49.36293 > 192.168.47.51.80: P 1449:2174(725) ack 1 win 92 <nop,nop,timestamp 16670370 4650355> (DF)
03:34:55.467218 192.168.47.51.80 > 192.168.47.49.36293: . ack 1449 win 272 <nop,nop,timestamp 4650355 16670370> (DF)
03:34:55.467233 192.168.47.51.80 > 192.168.47.49.36293: . ack 2174 win 362 <nop,nop,timestamp 4650355 16670370> (DF)
03:34:55.516840 192.168.47.51.80 > 192.168.47.49.36293: P 1:127(126) ack 2174 win 362 <nop,nop,timestamp 4650367 16670370> (DF)
03:34:55.516852 192.168.47.49.36293 > 192.168.47.51.80: . ack 127 win 92 <nop,nop,timestamp 16670382 4650367> (DF)
03:34:55.516937 192.168.47.51.80 > 192.168.47.49.36293: F 127:127(0) ack 2174 win 362 <nop,nop,timestamp 4650367 16670370> (DF)
03:34:55.517041 192.168.47.49.36293 > 192.168.47.51.80: F 2174:2174(0) ack 128 win 92 <nop,nop,timestamp 16670382 4650367> (DF)
03:34:55.517177 192.168.47.51.80 > 192.168.47.49.36293: . ack 2175 win 362 <nop,nop,timestamp 4650367 16670382> (DF)
03:34:55.665237 192.168.47.49.36294 > 192.168.47.51.80: S 4109734837:4109734837(0) win 5840 <mss 1460,sackOK,timestamp 16670419 0,nop,wscale 6> (DF)
03:34:55.665382 192.168.47.51.80 > 192.168.47.49.36294: S 1421783916:1421783916(0) ack 4109734838 win 5792 <mss 1460,sackOK,timestamp 4650404 16670419,nop,wscale 5> (DF)
03:34:55.665437 192.168.47.49.36294 > 192.168.47.51.80: . ack 1 win 92 <nop,nop,timestamp 16670419 4650404> (DF)
03:34:55.665506 192.168.47.49.36294 > 192.168.47.51.80: P 1:1262(1261) ack 1 win 92 <nop,nop,timestamp 16670419 4650404> (DF)
03:34:55.665685 192.168.47.51.80 > 192.168.47.49.36294: . ack 1262 win 260 <nop,nop,timestamp 4650404 16670419> (DF)
03:34:55.670881 192.168.47.49.36295 > 192.168.47.51.80: S 4121699830:4121699830(0) win 5840 <mss 1460,sackOK,timestamp 16670421 0,nop,wscale 6> (DF)
03:34:55.671090 192.168.47.51.80 > 192.168.47.49.36295: S 1429247880:1429247880(0) ack 4121699831 win 5792 <mss 1460,sackOK,timestamp 4650406 16670421,nop,wscale 5> (DF)
03:34:55.671121 192.168.47.49.36295 > 192.168.47.51.80: . ack 1 win 92 <nop,nop,timestamp 16670421 4650406> (DF)
03:34:55.671236 192.168.47.49.36295 > 192.168.47.51.80: P 1:1033(1032) ack 1 win 92 <nop,nop,timestamp 16670421 4650406> (DF)
03:34:55.671377 192.168.47.51.80 > 192.168.47.49.36295: . ack 1033 win 246 <nop,nop,timestamp 4650406 16670421> (DF)
03:34:55.720393 192.168.47.51.80 > 192.168.47.49.36295: P 1:127(126) ack 1033 win 246 <nop,nop,timestamp 4650418 16670421> (DF)
03:34:55.720408 192.168.47.49.36295 > 192.168.47.51.80: . ack 127 win 92 <nop,nop,timestamp 16670433 4650418> (DF)
03:34:55.720493 192.168.47.51.80 > 192.168.47.49.36295: F 127:127(0) ack 1033 win 246 <nop,nop,timestamp 4650418 16670421> (DF)
03:34:55.720690 192.168.47.49.36295 > 192.168.47.51.80: F 1033:1033(0) ack 128 win 92 <nop,nop,timestamp 16670433 4650418> (DF)
03:34:55.720788 192.168.47.51.80 > 192.168.47.49.36295: . ack 1034 win 246 <nop,nop,timestamp 4650418 16670433> (DF)
03:34:55.762722 192.168.47.51.80 > 192.168.47.49.36294: P 1:127(126) ack 1262 win 260 <nop,nop,timestamp 4650428 16670419> (DF)
03:34:55.762792 192.168.47.49.36294 > 192.168.47.51.80: . ack 127 win 92 <nop,nop,timestamp 16670444 4650428> (DF)
03:34:55.763150 192.168.47.51.80 > 192.168.47.49.36294: F 127:127(0) ack 1262 win 260 <nop,nop,timestamp 4650429 16670444> (DF)
03:34:55.763270 192.168.47.49.36294 > 192.168.47.51.80: F 1262:1262(0) ack 128 win 92 <nop,nop,timestamp 16670444 4650429> (DF)
03:34:55.763380 192.168.47.51.80 > 192.168.47.49.36294: . ack 1263 win 260 <nop,nop,timestamp 4650429 16670444> (DF)
03:34:55.825967 192.168.47.49.36305 > 192.168.47.51.80: S 4267786438:4267786438(0) win 5840 <mss 1460,sackOK,timestamp 16670460 0,nop,wscale 6> (DF)
03:34:55.826101 192.168.47.51.80 > 192.168.47.49.36305: S 1587635997:1587635997(0) ack 4267786439 win 5792 <mss 1460,sackOK,timestamp 4650444 16670460,nop,wscale 5> (DF)
03:34:55.826149 192.168.47.49.36305 > 192.168.47.51.80: . ack 1 win 92 <nop,nop,timestamp 16670460 4650444> (DF)
03:34:55.826343 192.168.47.49.36305 > 192.168.47.51.80: P 1:1041(1040) ack 1 win 92 <nop,nop,timestamp 16670460 4650444> (DF)
03:34:55.826641 192.168.47.51.80 > 192.168.47.49.36305: . ack 1041 win 246 <nop,nop,timestamp 4650444 16670460> (DF)
03:34:55.875760 192.168.47.51.80 > 192.168.47.49.36305: P 1:127(126) ack 1041 win 246 <nop,nop,timestamp 4650457 16670460> (DF)
03:34:55.875831 192.168.47.49.36305 > 192.168.47.51.80: . ack 127 win 92 <nop,nop,timestamp 16670472 4650457> (DF)
03:34:55.876176 192.168.47.51.80 > 192.168.47.49.36305: F 127:127(0) ack 1041 win 246 <nop,nop,timestamp 4650457 16670472> (DF)
03:34:55.877857 192.168.47.49.36305 > 192.168.47.51.80: F 1041:1041(0) ack 128 win 92 <nop,nop,timestamp 16670473 4650457> (DF)
03:34:55.877999 192.168.47.51.80 > 192.168.47.49.36305: . ack 1042 win 246 <nop,nop,timestamp 4650457 16670473> (DF)
03:34:55.925664 192.168.47.49.36308 > 192.168.47.51.80: S 75835109:75835109(0) win 5840 <mss 1460,sackOK,timestamp 16670485 0,nop,wscale 6> (DF)
03:34:55.925778 192.168.47.51.80 > 192.168.47.49.36308: S 1684224709:1684224709(0) ack 75835110 win 5792 <mss 1460,sackOK,timestamp 4650469 16670485,nop,wscale 5> (DF)
03:34:55.925810 192.168.47.49.36308 > 192.168.47.51.80: . ack 1 win 92 <nop,nop,timestamp 16670485 4650469> (DF)
03:34:55.925916 192.168.47.49.36308 > 192.168.47.51.80: P 1:1262(1261) ack 1 win 92 <nop,nop,timestamp 16670485 4650469> (DF)
03:34:55.926114 192.168.47.51.80 > 192.168.47.49.36308: . ack 1262 win 260 <nop,nop,timestamp 4650469 16670485> (DF)
03:34:55.973065 192.168.47.51.80 > 192.168.47.49.36308: P 1:127(126) ack 1262 win 260 <nop,nop,timestamp 4650481 16670485> (DF)
03:34:55.973135 192.168.47.49.36308 > 192.168.47.51.80: . ack 127 win 92 <nop,nop,timestamp 16670496 4650481> (DF)
03:34:55.973145 192.168.47.51.80 > 192.168.47.49.36308: F 127:127(0) ack 1262 win 260 <nop,nop,timestamp 4650481 16670485> (DF)
03:34:55.974024 192.168.47.49.36308 > 192.168.47.51.80: F 1262:1262(0) ack 128 win 92 <nop,nop,timestamp 16670497 4650481> (DF)
03:34:55.974137 192.168.47.51.80 > 192.168.47.49.36308: . ack 1263 win 260 <nop,nop,timestamp 4650481 16670497> (DF)
03:34:56.053933 192.168.47.49.36317 > 192.168.47.51.80: S 214429163:214429163(0) win 5840 <mss 1460,sackOK,timestamp 16670517 0,nop,wscale 6> (DF)
03:34:56.054068 192.168.47.51.80 > 192.168.47.49.36317: S 1813590994:1813590994(0) ack 214429164 win 5792 <mss 1460,sackOK,timestamp 4650501 16670517,nop,wscale 5> (DF)
03:34:56.054098 192.168.47.49.36317 > 192.168.47.51.80: . ack 1 win 92 <nop,nop,timestamp 16670517 4650501> (DF)
03:34:56.054211 192.168.47.49.36317 > 192.168.47.51.80: P 1:1033(1032) ack 1 win 92 <nop,nop,timestamp 16670517 4650501> (DF)
03:34:56.054353 192.168.47.51.80 > 192.168.47.49.36317: . ack 1033 win 246 <nop,nop,timestamp 4650501 16670517> (DF)
03:34:56.103690 192.168.47.51.80 > 192.168.47.49.36317: P 1:127(126) ack 1033 win 246 <nop,nop,timestamp 4650514 16670517> (DF)
03:34:56.103767 192.168.47.51.80 > 192.168.47.49.36317: F 127:127(0) ack 1033 win 246 <nop,nop,timestamp 4650514 16670517> (DF)
03:34:56.123959 192.168.47.49.36318 > 192.168.47.51.80: S 275549970:275549970(0) win 5840 <mss 1460,sackOK,timestamp 16670534 0,nop,wscale 6> (DF)
03:34:56.124120 192.168.47.51.80 > 192.168.47.49.36318: S 1890180815:1890180815(0) ack 275549971 win 5792 <mss 1460,sackOK,timestamp 4650519 16670534,nop,wscale 5> (DF)
03:34:56.124149 192.168.47.49.36318 > 192.168.47.51.80: . ack 1 win 92 <nop,nop,timestamp 16670534 4650519> (DF)
03:34:56.124264 192.168.47.49.36318 > 192.168.47.51.80: P 1:1270(1269) ack 1 win 92 <nop,nop,timestamp 16670534 4650519> (DF)
03:34:56.124444 192.168.47.51.80 > 192.168.47.49.36318: . ack 1270 win 261 <nop,nop,timestamp 4650519 16670534> (DF)
03:34:56.171131 192.168.47.51.80 > 192.168.47.49.36318: P 1:127(126) ack 1270 win 261 <nop,nop,timestamp 4650531 16670534> (DF)
03:34:56.171414 192.168.47.51.80 > 192.168.47.49.36318: F 127:127(0) ack 1270 win 261 <nop,nop,timestamp 4650531 16670534> (DF)
03:34:56.306937 192.168.47.51.80 > 192.168.47.49.36317: FP 1:127(126) ack 1033 win 246 <nop,nop,timestamp 4650565 16670517> (DF)
03:34:56.374936 192.168.47.51.80 > 192.168.47.49.36318: FP 1:127(126) ack 1270 win 261 <nop,nop,timestamp 4650582 16670534> (DF)
03:34:56.714976 192.168.47.51.80 > 192.168.47.49.36317: FP 1:127(126) ack 1033 win 246 <nop,nop,timestamp 4650667 16670517> (DF)
03:34:56.782983 192.168.47.51.80 > 192.168.47.49.36318: FP 1:127(126) ack 1270 win 261 <nop,nop,timestamp 4650684 16670534> (DF)
03:34:57.531079 192.168.47.51.80 > 192.168.47.49.36317: FP 1:127(126) ack 1033 win 246 <nop,nop,timestamp 4650871 16670517> (DF)
03:34:57.599083 192.168.47.51.80 > 192.168.47.49.36318: FP 1:127(126) ack 1270 win 261 <nop,nop,timestamp 4650888 16670534> (DF)
03:34:58.162723 192.168.47.49.36320 > 192.168.47.51.80: S 2319470609:2319470609(0) win 5840 <mss 1460,sackOK,timestamp 16671044 0,nop,wscale 6> (DF)
03:34:58.162861 192.168.47.51.80 > 192.168.47.49.36320: S 3915424938:3915424938(0) ack 2319470610 win 5792 <mss 1460,sackOK,timestamp 4651028 16671044,nop,wscale 5> (DF)
03:34:58.162892 192.168.47.49.36320 > 192.168.47.51.80: . ack 1 win 92 <nop,nop,timestamp 16671044 4651028> (DF)
03:34:58.163011 192.168.47.49.36320 > 192.168.47.51.80: P 1:1033(1032) ack 1 win 92 <nop,nop,timestamp 16671044 4651028> (DF)
03:34:58.163195 192.168.47.51.80 > 192.168.47.49.36320: . ack 1033 win 246 <nop,nop,timestamp 4651029 16671044> (DF)
03:34:58.210582 192.168.47.51.80 > 192.168.47.49.36320: P 1:127(126) ack 1033 win 246 <nop,nop,timestamp 4651040 16671044> (DF)
03:34:58.210595 192.168.47.49.36320 > 192.168.47.51.80: . ack 127 win 92 <nop,nop,timestamp 16671056 4651040> (DF)
03:34:58.210671 192.168.47.51.80 > 192.168.47.49.36320: F 127:127(0) ack 1033 win 246 <nop,nop,timestamp 4651040 16671044> (DF)
03:34:58.210777 192.168.47.49.36320 > 192.168.47.51.80: F 1033:1033(0) ack 128 win 92 <nop,nop,timestamp 16671056 4651040> (DF)
03:34:58.210865 192.168.47.51.80 > 192.168.47.49.36320: . ack 1034 win 246 <nop,nop,timestamp 4651040 16671056> (DF)
03:34:58.218003 192.168.47.49.36321 > 192.168.47.51.80: S 2364570356:2364570356(0) win 5840 <mss 1460,sackOK,timestamp 16671058 0,nop,wscale 6> (DF)
03:34:58.218127 192.168.47.51.80 > 192.168.47.49.36321: S 3986884306:3986884306(0) ack 2364570357 win 5792 <mss 1460,sackOK,timestamp 4651042 16671058,nop,wscale 5> (DF)
03:34:58.218159 192.168.47.49.36321 > 192.168.47.51.80: . ack 1 win 92 <nop,nop,timestamp 16671058 4651042> (DF)
03:34:58.218275 192.168.47.49.36321 > 192.168.47.51.80: P 1:817(816) ack 1 win 92 <nop,nop,timestamp 16671058 4651042> (DF)
03:34:58.218404 192.168.47.51.80 > 192.168.47.49.36321: . ack 817 win 232 <nop,nop,timestamp 4651042 16671058> (DF)
03:34:58.265396 192.168.47.51.80 > 192.168.47.49.36321: P 1:127(126) ack 817 win 232 <nop,nop,timestamp 4651054 16671058> (DF)
03:34:58.265418 192.168.47.49.36321 > 192.168.47.51.80: . ack 127 win 92 <nop,nop,timestamp 16671069 4651054> (DF)
03:34:58.265784 192.168.47.51.80 > 192.168.47.49.36321: F 127:127(0) ack 817 win 232 <nop,nop,timestamp 4651054 16671069> (DF)
03:34:58.265870 192.168.47.49.36321 > 192.168.47.51.80: F 817:817(0) ack 128 win 92 <nop,nop,timestamp 16671070 4651054> (DF)
03:34:58.265990 192.168.47.51.80 > 192.168.47.49.36321: . ack 818 win 232 <nop,nop,timestamp 4651054 16671070> (DF)
03:34:59.163294 192.168.47.51.80 > 192.168.47.49.36317: FP 1:127(126) ack 1033 win 246 <nop,nop,timestamp 4651279 16670517> (DF)
03:34:59.231281 192.168.47.51.80 > 192.168.47.49.36318: FP 1:127(126) ack 1270 win 261 <nop,nop,timestamp 4651296 16670534> (DF)
03:35:00.721586 192.168.47.49.36262 > 192.168.47.51.80: P 1:1262(1261) ack 1 win 92 <nop,nop,timestamp 16671684 4648456> (DF)
03:35:00.721831 192.168.47.51.80 > 192.168.47.49.36262: . ack 1262 win 260 <nop,nop,timestamp 4651668 16671684,nop,nop,sack sack 1 {1:1262} > (DF)
03:35:00.799480 192.168.47.51.80 > 192.168.47.49.36262: FP 1:127(126) ack 1262 win 260 <nop,nop,timestamp 4651688 16671684> (DF)
03:35:00.799690 192.168.47.49.36262 > 192.168.47.51.80: F 1262:1262(0) ack 128 win 92 <nop,nop,timestamp 16671703 4651688> (DF)
03:35:00.799818 192.168.47.51.80 > 192.168.47.49.36262: . ack 1263 win 260 <nop,nop,timestamp 4651688 16671703> (DF)
03:35:00.807985 192.168.47.49.36330 > 192.168.47.51.80: S 671062810:671062810(0) win 5840 <mss 1460,sackOK,timestamp 16671705 0,nop,wscale 6> (DF)
03:35:00.808112 192.168.47.51.80 > 192.168.47.49.36330: S 2287081102:2287081102(0) ack 671062811 win 5792 <mss 1460,sackOK,timestamp 4651690 16671705,nop,wscale 5> (DF)
03:35:00.808146 192.168.47.49.36330 > 192.168.47.51.80: . ack 1 win 92 <nop,nop,timestamp 16671705 4651690> (DF)
03:35:00.808270 192.168.47.49.36330 > 192.168.47.51.80: P 1:817(816) ack 1 win 92 <nop,nop,timestamp 16671705 4651690> (DF)
03:35:00.808439 192.168.47.51.80 > 192.168.47.49.36330: . ack 817 win 232 <nop,nop,timestamp 4651690 16671705> (DF)
03:35:00.855562 192.168.47.51.80 > 192.168.47.49.36330: P 1:127(126) ack 817 win 232 <nop,nop,timestamp 4651702 16671705> (DF)
03:35:00.855638 192.168.47.51.80 > 192.168.47.49.36330: F 127:127(0) ack 817 win 232 <nop,nop,timestamp 4651702 16671705> (DF)
03:35:01.059510 192.168.47.51.80 > 192.168.47.49.36330: FP 1:127(126) ack 817 win 232 <nop,nop,timestamp 4651753 16671705> (DF)
03:35:01.467547 192.168.47.51.80 > 192.168.47.49.36330: FP 1:127(126) ack 817 win 232 <nop,nop,timestamp 4651855 16671705> (DF)
03:35:02.283639 192.168.47.51.80 > 192.168.47.49.36330: FP 1:127(126) ack 817 win 232 <nop,nop,timestamp 4652059 16671705> (DF)
03:35:02.427649 192.168.47.51.80 > 192.168.47.49.36317: FP 1:127(126) ack 1033 win 246 <nop,nop,timestamp 4652095 16670517> (DF)
03:35:02.495653 192.168.47.51.80 > 192.168.47.49.36318: FP 1:127(126) ack 1270 win 261 <nop,nop,timestamp 4652112 16670534> (DF)
03:35:03.915806 192.168.47.51.80 > 192.168.47.49.36330: FP 1:127(126) ack 817 win 232 <nop,nop,timestamp 4652467 16671705> (DF)
03:35:07.180231 192.168.47.51.80 > 192.168.47.49.36330: FP 1:127(126) ack 817 win 232 <nop,nop,timestamp 4653283 16671705> (DF)
03:35:08.956447 192.168.47.51.80 > 192.168.47.49.36317: FP 1:127(126) ack 1033 win 246 <nop,nop,timestamp 4653727 16670517> (DF)
03:35:09.024441 192.168.47.51.80 > 192.168.47.49.36318: FP 1:127(126) ack 1270 win 261 <nop,nop,timestamp 4653744 16670534> (DF)
03:35:11.673142 192.168.47.49.36317 > 192.168.47.51.80: P 1:1033(1032) ack 1 win 92 <nop,nop,timestamp 16674422 4650501> (DF)
03:35:11.673332 192.168.47.51.80 > 192.168.47.49.36317: . ack 1033 win 246 <nop,nop,timestamp 4654406 16674422,nop,nop,sack sack 1 {1:1033} > (DF)
03:35:11.741133 192.168.47.49.36318 > 192.168.47.51.80: P 1:1270(1269) ack 1 win 92 <nop,nop,timestamp 16674439 4650519> (DF)
03:35:11.741333 192.168.47.51.80 > 192.168.47.49.36318: . ack 1270 win 261 <nop,nop,timestamp 4654423 16674439,nop,nop,sack sack 1 {1:1270} > (DF)
03:35:13.709118 192.168.47.51.80 > 192.168.47.49.36330: FP 1:127(126) ack 817 win 232 <nop,nop,timestamp 4654915 16671705> (DF)
03:35:13.797100 192.168.47.49.36330 > 192.168.47.51.80: P 1:817(816) ack 1 win 92 <nop,nop,timestamp 16674953 4651690> (DF)
03:35:13.797253 192.168.47.51.80 > 192.168.47.49.36330: . ack 817 win 232 <nop,nop,timestamp 4654937 16674953,nop,nop,sack sack 1 {1:817} > (DF)
03:35:17.909890 192.168.47.49.36332 > 192.168.47.51.80: S 589043232:589043232(0) win 5840 <mss 1460,sackOK,timestamp 16675981 0,nop,wscale 6> (DF)
03:35:17.910046 192.168.47.51.80 > 192.168.47.49.36332: S 2204085694:2204085694(0) ack 589043233 win 5792 <mss 1460,sackOK,timestamp 4655965 16675981,nop,wscale 5> (DF)
03:35:17.910074 192.168.47.49.36332 > 192.168.47.51.80: . ack 1 win 92 <nop,nop,timestamp 16675981 4655965> (DF)
03:35:17.910114 192.168.47.49.36332 > 192.168.47.51.80: P 1:989(988) ack 1 win 92 <nop,nop,timestamp 16675981 4655965> (DF)
03:35:17.910260 192.168.47.51.80 > 192.168.47.49.36332: . ack 989 win 243 <nop,nop,timestamp 4655965 16675981> (DF)
03:35:17.960239 192.168.47.51.80 > 192.168.47.49.36332: P 1:127(126) ack 989 win 243 <nop,nop,timestamp 4655977 16675981> (DF)
03:35:17.960596 192.168.47.51.80 > 192.168.47.49.36332: F 127:127(0) ack 989 win 243 <nop,nop,timestamp 4655977 16675981> (DF)
03:35:18.161597 192.168.47.51.80 > 192.168.47.49.36332: FP 1:127(126) ack 989 win 243 <nop,nop,timestamp 4656028 16675981> (DF)
03:35:18.569647 192.168.47.51.80 > 192.168.47.49.36332: FP 1:127(126) ack 989 win 243 <nop,nop,timestamp 4656130 16675981> (DF)
03:35:19.385751 192.168.47.51.80 > 192.168.47.49.36332: FP 1:127(126) ack 989 win 243 <nop,nop,timestamp 4656334 16675981> (DF)
03:35:21.017960 192.168.47.51.80 > 192.168.47.49.36332: FP 1:127(126) ack 989 win 243 <nop,nop,timestamp 4656742 16675981> (DF)
03:35:22.014065 192.168.47.51.80 > 192.168.47.49.36317: FP 1:127(126) ack 1033 win 246 <nop,nop,timestamp 4656991 16674422> (DF)
03:35:22.082066 192.168.47.51.80 > 192.168.47.49.36318: FP 1:127(126) ack 1270 win 261 <nop,nop,timestamp 4657008 16674439> (DF)
03:35:24.282343 192.168.47.51.80 > 192.168.47.49.36332: FP 1:127(126) ack 989 win 243 <nop,nop,timestamp 4657558 16675981> (DF)
03:35:26.033241 192.168.47.49.36333 > 192.168.47.51.80: S 124002532:124002532(0) win 5840 <mss 1460,sackOK,timestamp 16678012 0,nop,wscale 6> (DF)
03:35:26.033411 192.168.47.51.80 > 192.168.47.49.36333: S 1738901120:1738901120(0) ack 124002533 win 5792 <mss 1460,sackOK,timestamp 4657995 16678012,nop,wscale 5> (DF)
03:35:26.033442 192.168.47.49.36333 > 192.168.47.51.80: . ack 1 win 92 <nop,nop,timestamp 16678012 4657995> (DF)
03:35:26.033559 192.168.47.49.36333 > 192.168.47.51.80: . 1:1449(1448) ack 1 win 92 <nop,nop,timestamp 16678012 4657995> (DF)
03:35:26.033574 192.168.47.49.36333 > 192.168.47.51.80: P 1449:2174(725) ack 1 win 92 <nop,nop,timestamp 16678012 4657995> (DF)
03:35:26.033742 192.168.47.51.80 > 192.168.47.49.36333: . ack 1449 win 272 <nop,nop,timestamp 4657995 16678012> (DF)
03:35:26.033756 192.168.47.51.80 > 192.168.47.49.36333: . ack 2174 win 362 <nop,nop,timestamp 4657995 16678012> (DF)
03:35:26.052825 192.168.47.49.36317 > 192.168.47.51.80: F 1033:1033(0) ack 1 win 92 <nop,nop,timestamp 16678017 4650501> (DF)
03:35:26.053014 192.168.47.51.80 > 192.168.47.49.36317: . ack 1034 win 246 <nop,nop,timestamp 4658000 16678017> (DF)
03:35:26.061482 192.168.47.49.36334 > 192.168.47.51.80: S 151107142:151107142(0) win 5840 <mss 1460,sackOK,timestamp 16678019 0,nop,wscale 6> (DF)
03:35:26.061651 192.168.47.51.80 > 192.168.47.49.36334: S 1773432068:1773432068(0) ack 151107143 win 5792 <mss 1460,sackOK,timestamp 4658002 16678019,nop,wscale 5> (DF)
03:35:26.061680 192.168.47.49.36334 > 192.168.47.51.80: . ack 1 win 92 <nop,nop,timestamp 16678019 4658002> (DF)
03:35:26.061791 192.168.47.49.36334 > 192.168.47.51.80: P 1:817(816) ack 1 win 92 <nop,nop,timestamp 16678019 4658002> (DF)
03:35:26.061940 192.168.47.51.80 > 192.168.47.49.36334: . ack 817 win 232 <nop,nop,timestamp 4658002 16678019> (DF)
03:35:26.098177 192.168.47.51.80 > 192.168.47.49.36333: P 1:127(126) ack 2174 win 362 <nop,nop,timestamp 4658011 16678012> (DF)
03:35:26.098193 192.168.47.49.36333 > 192.168.47.51.80: . ack 127 win 92 <nop,nop,timestamp 16678028 4658011> (DF)
03:35:26.098274 192.168.47.51.80 > 192.168.47.49.36333: F 127:127(0) ack 2174 win 362 <nop,nop,timestamp 4658011 16678012> (DF)
03:35:26.098494 192.168.47.49.36333 > 192.168.47.51.80: F 2174:2174(0) ack 128 win 92 <nop,nop,timestamp 16678028 4658011> (DF)
03:35:26.098633 192.168.47.51.80 > 192.168.47.49.36333: . ack 2175 win 362 <nop,nop,timestamp 4658012 16678028> (DF)
03:35:26.120889 192.168.47.49.36318 > 192.168.47.51.80: F 1270:1270(0) ack 1 win 92 <nop,nop,timestamp 16678034 4650519> (DF)
03:35:26.121080 192.168.47.51.80 > 192.168.47.49.36318: . ack 1271 win 261 <nop,nop,timestamp 4658017 16678034> (DF)
03:35:26.133325 192.168.47.51.80 > 192.168.47.49.36334: P 1:127(126) ack 817 win 232 <nop,nop,timestamp 4658020 16678019> (DF)
03:35:26.133394 192.168.47.49.36334 > 192.168.47.51.80: . ack 127 win 92 <nop,nop,timestamp 16678037 4658020> (DF)
03:35:26.133722 192.168.47.51.80 > 192.168.47.49.36334: F 127:127(0) ack 817 win 232 <nop,nop,timestamp 4658020 16678037> (DF)
03:35:26.137129 192.168.47.49.36334 > 192.168.47.51.80: F 817:817(0) ack 128 win 92 <nop,nop,timestamp 16678038 4658020> (DF)
03:35:26.137278 192.168.47.51.80 > 192.168.47.49.36334: . ack 818 win 232 <nop,nop,timestamp 4658021 16678038> (DF)
03:35:26.176574 192.168.47.49.36335 > 192.168.47.51.80: S 274424664:274424664(0) win 5840 <mss 1460,sackOK,timestamp 16678047 0,nop,wscale 6> (DF)
03:35:26.176717 192.168.47.51.80 > 192.168.47.49.36335: S 1889614011:1889614011(0) ack 274424665 win 5792 <mss 1460,sackOK,timestamp 4658031 16678047,nop,wscale 5> (DF)
03:35:26.176744 192.168.47.49.36335 > 192.168.47.51.80: . ack 1 win 92 <nop,nop,timestamp 16678047 4658031> (DF)
03:35:26.176869 192.168.47.49.36335 > 192.168.47.51.80: P 1:993(992) ack 1 win 92 <nop,nop,timestamp 16678048 4658031> (DF)
03:35:26.177003 192.168.47.51.80 > 192.168.47.49.36335: . ack 993 win 243 <nop,nop,timestamp 4658031 16678048> (DF)
03:35:26.225049 192.168.47.51.80 > 192.168.47.49.36335: P 1:127(126) ack 993 win 243 <nop,nop,timestamp 4658043 16678048> (DF)
03:35:26.225125 192.168.47.49.36335 > 192.168.47.51.80: . ack 127 win 92 <nop,nop,timestamp 16678060 4658043> (DF)
03:35:26.225134 192.168.47.51.80 > 192.168.47.49.36335: F 127:127(0) ack 993 win 243 <nop,nop,timestamp 4658043 16678048> (DF)
03:35:26.229353 192.168.47.49.36335 > 192.168.47.51.80: F 993:993(0) ack 128 win 92 <nop,nop,timestamp 16678061 4658043> (DF)
03:35:26.229476 192.168.47.51.80 > 192.168.47.49.36335: . ack 994 win 243 <nop,nop,timestamp 4658044 16678061> (DF)
03:35:26.279803 192.168.47.49.36336 > 192.168.47.51.80: S 364699584:364699584(0) win 5840 <mss 1460,sackOK,timestamp 16678073 0,nop,wscale 6> (DF)
03:35:26.279957 192.168.47.51.80 > 192.168.47.49.36336: S 1989280707:1989280707(0) ack 364699585 win 5792 <mss 1460,sackOK,timestamp 4658057 16678073,nop,wscale 5> (DF)
03:35:26.280009 192.168.47.49.36336 > 192.168.47.51.80: . ack 1 win 92 <nop,nop,timestamp 16678073 4658057> (DF)
03:35:26.280136 192.168.47.49.36336 > 192.168.47.51.80: . 1:1449(1448) ack 1 win 92 <nop,nop,timestamp 16678073 4658057> (DF)
03:35:26.280153 192.168.47.49.36336 > 192.168.47.51.80: . 1449:2897(1448) ack 1 win 92 <nop,nop,timestamp 16678073 4658057> (DF)
03:35:26.280168 192.168.47.49.36336 > 192.168.47.51.80: P 2897:3486(589) ack 1 win 92 <nop,nop,timestamp 16678073 4658057> (DF)
03:35:26.280734 192.168.47.51.80 > 192.168.47.49.36336: . ack 1449 win 272 <nop,nop,timestamp 4658057 16678073> (DF)
03:35:26.280754 192.168.47.51.80 > 192.168.47.49.36336: . ack 2897 win 362 <nop,nop,timestamp 4658057 16678073> (DF)
03:35:26.280775 192.168.47.51.80 > 192.168.47.49.36336: . ack 3486 win 453 <nop,nop,timestamp 4658057 16678073> (DF)
03:35:26.281443 192.168.47.49.36337 > 192.168.47.51.80: S 369328236:369328236(0) win 5840 <mss 1460,sackOK,timestamp 16678074 0,nop,wscale 6> (DF)
03:35:26.281646 192.168.47.51.80 > 192.168.47.49.36337: S 2000470138:2000470138(0) ack 369328237 win 5792 <mss 1460,sackOK,timestamp 4658057 16678074,nop,wscale 5> (DF)
03:35:26.281676 192.168.47.49.36337 > 192.168.47.51.80: . ack 1 win 92 <nop,nop,timestamp 16678074 4658057> (DF)
03:35:26.281875 192.168.47.49.36337 > 192.168.47.51.80: P 1:829(828) ack 1 win 92 <nop,nop,timestamp 16678074 4658057> (DF)
03:35:26.282047 192.168.47.51.80 > 192.168.47.49.36337: . ack 829 win 233 <nop,nop,timestamp 4658057 16678074> (DF)
03:35:26.289047 192.168.47.49.36338 > 192.168.47.51.80: S 378520579:378520579(0) win 5840 <mss 1460,sackOK,timestamp 16678076 0,nop,wscale 6> (DF)
03:35:26.289244 192.168.47.51.80 > 192.168.47.49.36338: S 2004233461:2004233461(0) ack 378520580 win 5792 <mss 1460,sackOK,timestamp 4658059 16678076,nop,wscale 5> (DF)
03:35:26.289274 192.168.47.49.36338 > 192.168.47.51.80: . ack 1 win 92 <nop,nop,timestamp 16678076 4658059> (DF)
03:35:26.289383 192.168.47.49.36338 > 192.168.47.51.80: . 1:1449(1448) ack 1 win 92 <nop,nop,timestamp 16678076 4658059> (DF)
03:35:26.289397 192.168.47.49.36338 > 192.168.47.51.80: P 1449:2186(737) ack 1 win 92 <nop,nop,timestamp 16678076 4658059> (DF)
03:35:26.289590 192.168.47.51.80 > 192.168.47.49.36338: . ack 1449 win 272 <nop,nop,timestamp 4658059 16678076> (DF)
03:35:26.289604 192.168.47.51.80 > 192.168.47.49.36338: . ack 2186 win 362 <nop,nop,timestamp 4658059 16678076> (DF)
03:35:26.370470 192.168.47.51.80 > 192.168.47.49.36336: P 1:127(126) ack 3486 win 453 <nop,nop,timestamp 4658079 16678073> (DF)
03:35:26.370497 192.168.47.49.36336 > 192.168.47.51.80: . ack 127 win 92 <nop,nop,timestamp 16678096 4658079> (DF)
03:35:26.370615 192.168.47.51.80 > 192.168.47.49.36336: F 127:127(0) ack 3486 win 453 <nop,nop,timestamp 4658080 16678073> (DF)
03:35:26.370691 192.168.47.49.36336 > 192.168.47.51.80: F 3486:3486(0) ack 128 win 92 <nop,nop,timestamp 16678096 4658080> (DF)
03:35:26.370801 192.168.47.51.80 > 192.168.47.49.36336: . ack 3487 win 453 <nop,nop,timestamp 4658080 16678096> (DF)
03:35:26.380390 192.168.47.51.80 > 192.168.47.49.36337: P 1:127(126) ack 829 win 233 <nop,nop,timestamp 4658082 16678074> (DF)
03:35:26.380459 192.168.47.49.36337 > 192.168.47.51.80: . ack 127 win 92 <nop,nop,timestamp 16678098 4658082> (DF)
03:35:26.380469 192.168.47.51.80 > 192.168.47.49.36337: F 127:127(0) ack 829 win 233 <nop,nop,timestamp 4658082 16678074> (DF)
03:35:26.385125 192.168.47.49.36337 > 192.168.47.51.80: F 829:829(0) ack 128 win 92 <nop,nop,timestamp 16678100 4658082> (DF)
03:35:26.385286 192.168.47.51.80 > 192.168.47.49.36337: . ack 830 win 233 <nop,nop,timestamp 4658083 16678100> (DF)
03:35:26.429459 192.168.47.51.80 > 192.168.47.49.36338: P 1:127(126) ack 2186 win 362 <nop,nop,timestamp 4658094 16678076> (DF)
03:35:26.429538 192.168.47.49.36338 > 192.168.47.51.80: . ack 127 win 92 <nop,nop,timestamp 16678111 4658094> (DF)
03:35:26.429547 192.168.47.51.80 > 192.168.47.49.36338: F 127:127(0) ack 2186 win 362 <nop,nop,timestamp 4658094 16678076> (DF)
03:35:26.429735 192.168.47.49.36338 > 192.168.47.51.80: F 2186:2186(0) ack 128 win 92 <nop,nop,timestamp 16678111 4658094> (DF)
03:35:26.429857 192.168.47.51.80 > 192.168.47.49.36338: . ack 2187 win 362 <nop,nop,timestamp 4658094 16678111> (DF)
03:35:26.766596 192.168.47.51.80 > 192.168.47.49.36330: FP 1:127(126) ack 817 win 232 <nop,nop,timestamp 4658179 16674953> (DF)
03:35:30.804719 192.168.47.49.36330 > 192.168.47.51.80: F 817:817(0) ack 1 win 92 <nop,nop,timestamp 16679205 4651690> (DF)
03:35:30.804881 192.168.47.51.80 > 192.168.47.49.36330: . ack 818 win 232 <nop,nop,timestamp 4659188 16679205> (DF)
03:35:30.811110 192.168.47.51.80 > 192.168.47.49.36332: FP 1:127(126) ack 989 win 243 <nop,nop,timestamp 4659190 16675981> (DF)
03:35:30.900728 192.168.47.49.36332 > 192.168.47.51.80: P 1:989(988) ack 1 win 92 <nop,nop,timestamp 16679229 4655965> (DF)
03:35:30.900894 192.168.47.51.80 > 192.168.47.49.36332: . ack 989 win 243 <nop,nop,timestamp 4659212 16679229,nop,nop,sack sack 1 {1:989} > (DF)
03:35:43.868306 192.168.47.51.80 > 192.168.47.49.36332: FP 1:127(126) ack 989 win 243 <nop,nop,timestamp 4662454 16679229> (DF)
03:35:43.868444 192.168.47.49.36332 > 192.168.47.51.80: F 989:989(0) ack 128 win 92 <nop,nop,timestamp 16682471 4662454> (DF)
03:35:43.868585 192.168.47.51.80 > 192.168.47.49.36332: . ack 990 win 243 <nop,nop,timestamp 4662454 16682471> (DF)
03:35:48.128701 192.168.47.51.80 > 192.168.47.49.36317: FP 1:127(126) ack 1034 win 246 <nop,nop,timestamp 4663519 16678017> (DF)
03:35:48.128733 192.168.47.49.36317 > 192.168.47.51.80: R 214430197:214430197(0) win 0 (DF)
03:35:48.196694 192.168.47.51.80 > 192.168.47.49.36318: FP 1:127(126) ack 1271 win 261 <nop,nop,timestamp 4663536 16678034> (DF)
03:35:48.196757 192.168.47.49.36318 > 192.168.47.51.80: R 275551241:275551241(0) win 0 (DF)
03:35:52.881249 192.168.47.51.80 > 192.168.47.49.36330: FP 1:127(126) ack 818 win 232 <nop,nop,timestamp 4664707 16679205> (DF)
03:35:52.881311 192.168.47.49.36330 > 192.168.47.51.80: R 671063628:671063628(0) win 0 (DF)
03:36:32.801120 192.168.47.49.36416 > 192.168.47.51.80: S 2458342137:2458342137(0) win 5840 <mss 1460,sackOK,timestamp 16694704 0,nop,wscale 6> (DF)
03:36:32.801311 192.168.47.51.80 > 192.168.47.49.36416: S 4095144779:4095144779(0) ack 2458342138 win 5792 <mss 1460,sackOK,timestamp 4674686 16694704,nop,wscale 5> (DF)
03:36:32.801372 192.168.47.49.36416 > 192.168.47.51.80: . ack 1 win 92 <nop,nop,timestamp 16694704 4674686> (DF)
03:36:32.801510 192.168.47.49.36416 > 192.168.47.51.80: P 1:96(95) ack 1 win 92 <nop,nop,timestamp 16694704 4674686> (DF)
03:36:32.801602 192.168.47.51.80 > 192.168.47.49.36416: . ack 96 win 181 <nop,nop,timestamp 4674686 16694704> (DF)
03:36:32.804124 192.168.47.51.80 > 192.168.47.49.36416: P 1:119(118) ack 96 win 181 <nop,nop,timestamp 4674687 16694704> (DF)
03:36:32.804273 192.168.47.49.36416 > 192.168.47.51.80: . ack 119 win 92 <nop,nop,timestamp 16694705 4674687> (DF)
03:36:32.804368 192.168.47.51.80 > 192.168.47.49.36416: F 119:119(0) ack 96 win 181 <nop,nop,timestamp 4674687 16694704> (DF)
03:36:32.820163 192.168.47.49.36416 > 192.168.47.51.80: F 96:96(0) ack 120 win 92 <nop,nop,timestamp 16694709 4674687> (DF)
03:36:32.820278 192.168.47.51.80 > 192.168.47.49.36416: . ack 97 win 181 <nop,nop,timestamp 4674691 16694709> (DF)
03:38:32.721665 192.168.47.49.36526 > 192.168.47.51.80: S 2127614375:2127614375(0) win 5840 <mss 1460,sackOK,timestamp 16724685 0,nop,wscale 6> (DF)
03:38:32.721812 192.168.47.51.80 > 192.168.47.49.36526: S 3748260601:3748260601(0) ack 2127614376 win 5792 <mss 1460,sackOK,timestamp 4704663 16724685,nop,wscale 5> (DF)
03:38:32.721852 192.168.47.49.36526 > 192.168.47.51.80: . ack 1 win 92 <nop,nop,timestamp 16724685 4704663> (DF)
03:38:32.721948 192.168.47.49.36526 > 192.168.47.51.80: P 1:96(95) ack 1 win 92 <nop,nop,timestamp 16724685 4704663> (DF)
03:38:32.722063 192.168.47.51.80 > 192.168.47.49.36526: . ack 96 win 181 <nop,nop,timestamp 4704663 16724685> (DF)
03:38:32.722788 192.168.47.51.80 > 192.168.47.49.36526: P 1:119(118) ack 96 win 181 <nop,nop,timestamp 4704663 16724685> (DF)
03:38:32.722830 192.168.47.49.36526 > 192.168.47.51.80: . ack 119 win 92 <nop,nop,timestamp 16724685 4704663> (DF)
03:38:32.722836 192.168.47.51.80 > 192.168.47.49.36526: F 119:119(0) ack 96 win 181 <nop,nop,timestamp 4704663 16724685> (DF)
03:38:32.722899 192.168.47.49.36526 > 192.168.47.51.80: F 96:96(0) ack 120 win 92 <nop,nop,timestamp 16724685 4704663> (DF)
03:38:32.723005 192.168.47.51.80 > 192.168.47.49.36526: . ack 97 win 181 <nop,nop,timestamp 4704663 16724685> (DF)
03:40:32.305033 192.168.47.49.48957 > 192.168.47.51.80: S 1462391007:1462391007(0) win 5840 <mss 1460,sackOK,timestamp 16754582 0,nop,wscale 6> (DF)
03:40:32.305221 192.168.47.51.80 > 192.168.47.49.48957: S 3089510102:3089510102(0) ack 1462391008 win 5792 <mss 1460,sackOK,timestamp 4734555 16754582,nop,wscale 5> (DF)
03:40:32.305294 192.168.47.49.48957 > 192.168.47.51.80: . ack 1 win 92 <nop,nop,timestamp 16754582 4734555> (DF)
03:40:32.305434 192.168.47.49.48957 > 192.168.47.51.80: P 1:96(95) ack 1 win 92 <nop,nop,timestamp 16754582 4734555> (DF)
03:40:32.305582 192.168.47.51.80 > 192.168.47.49.48957: . ack 96 win 181 <nop,nop,timestamp 4734555 16754582> (DF)
03:40:32.307653 192.168.47.51.80 > 192.168.47.49.48957: P 1:119(118) ack 96 win 181 <nop,nop,timestamp 4734555 16754582> (DF)
03:40:32.307723 192.168.47.51.80 > 192.168.47.49.48957: F 119:119(0) ack 96 win 181 <nop,nop,timestamp 4734555 16754582> (DF)
03:40:32.341292 192.168.47.49.48957 > 192.168.47.51.80: . ack 119 win 92 <nop,nop,timestamp 16754591 4734555> (DF)
03:40:32.341409 192.168.47.49.48957 > 192.168.47.51.80: F 96:96(0) ack 120 win 92 <nop,nop,timestamp 16754591 4734555> (DF)
03:40:32.341525 192.168.47.51.80 > 192.168.47.49.48957: . ack 97 win 181 <nop,nop,timestamp 4734564 16754591> (DF)
03:42:32.997704 192.168.47.49.49054 > 192.168.47.51.80: S 1896172928:1896172928(0) win 5840 <mss 1460,sackOK,timestamp 16784756 0,nop,wscale 6> (DF)
03:42:32.997842 192.168.47.51.80 > 192.168.47.49.49054: S 3515440759:3515440759(0) ack 1896172929 win 5792 <mss 1460,sackOK,timestamp 4764725 16784756,nop,wscale 5> (DF)
03:42:32.997922 192.168.47.49.49054 > 192.168.47.51.80: . ack 1 win 92 <nop,nop,timestamp 16784756 4764725> (DF)
03:42:33.047793 192.168.47.49.49054 > 192.168.47.51.80: P 1:96(95) ack 1 win 92 <nop,nop,timestamp 16784769 4764725> (DF)
03:42:33.048059 192.168.47.51.80 > 192.168.47.49.49054: . ack 96 win 181 <nop,nop,timestamp 4764737 16784769> (DF)
03:42:33.048779 192.168.47.51.80 > 192.168.47.49.49054: P 1:119(118) ack 96 win 181 <nop,nop,timestamp 4764737 16784769> (DF)
03:42:33.048827 192.168.47.51.80 > 192.168.47.49.49054: F 119:119(0) ack 96 win 181 <nop,nop,timestamp 4764737 16784769> (DF)
03:42:33.048976 192.168.47.49.49054 > 192.168.47.51.80: . ack 119 win 92 <nop,nop,timestamp 16784769 4764737> (DF)
03:42:33.049111 192.168.47.49.49054 > 192.168.47.51.80: F 96:96(0) ack 120 win 92 <nop,nop,timestamp 16784769 4764737> (DF)
03:42:33.049230 192.168.47.51.80 > 192.168.47.49.49054: . ack 97 win 181 <nop,nop,timestamp 4764738 16784769> (DF)
-
To unsubscribe from this list: send the line "unsubscribe linux-kernel" in
the body of a message to majordomo@vger.kernel.org
More majordomo info at  
http://vger.kernel.org/majordomo-info.html
Please read the FAQ at  
http://www.tux.org/lkml/