Date: Thu, 09 Jan 2003 19:32:38 +1100
From: Herbert Xu <>
Subject: Re: ipv6 stack seems to forget to send ACKs
Sender: linux-kernel-owner@vger.kernel.org
Precedence: bulk
List-ID: <linux-kernel.vger.kernel.org>
X-Mailing-List: linux-kernel@vger.kernel.org
X-Lkml-Link: https://lkml.org/lkml/2003/1/9/31

Wichert Akkerman <wichert@wiggy.net> wrote:
>
> 13:57:40.310471 tornado.wiggy.net.33035 > 2001:968:1::2.8000: . ack 9359225 win 32616 <nop,nop,timestamp 846112 369670744,nop,nop,sack sack 1 {9360653:9363289} >
> 13:57:40.325396 2001:968:1::2.8000 > tornado.wiggy.net.33035: . 9363289:9363509(220) ack 1 win 5712 <nop,nop,timestamp 369670750 846111> [class 0x2]
> 13:57:40.325447 tornado.wiggy.net.33035 > 2001:968:1::2.8000: . ack 9359225 win 32616 <nop,nop,timestamp 846113 369670744,nop,nop,sack sack 1 {9360653:9363509} >
> 13:57:40.568652 2001:968:1::2.8000 > tornado.wiggy.net.33035: . 9359225:9360433(1208) ack 1 win 5712 <nop,nop,timestamp 369670773 846113>
> 13:57:41.121608 2001:968:1::2.8000 > tornado.wiggy.net.33035: . 9359225:9360433(1208) ack 1 win 5712 <nop,nop,timestamp 369670829 846113>
> 13:57:42.242095 2001:968:1::2.8000 > tornado.wiggy.net.33035: . 9359225:9360433(1208) ack 1 win 5712 <nop,nop,timestamp 369670941 846113>
> 13:57:44.481379 2001:968:1::2.8000 > tornado.wiggy.net.33035: . 9359225:9360433(1208) ack 1 win 5712 <nop,nop,timestamp 369671165 846113>
> 13:57:48.963035 2001:968:1::2.8000 > tornado.wiggy.net.33035: . 9359225:9360433(1208) ack 1 win 5712 <nop,nop,timestamp 369671613 846113>
Verify the checksum of that packet, it's probably corrupt.
-- 
Debian GNU/Linux 3.0 is out! ( 
http://www.debian.org/
 )
Email:  Herbert Xu 许志壬 <herbert@gondor.apana.org.au>
Home Page: 
http://gondor.apana.org.au/herbert/
PGP Key: 
http://gondor.apana.org.au/herbert/pubkey.txt
-
To unsubscribe from this list: send the line "unsubscribe linux-kernel" in
the body of a message to majordomo@vger.kernel.org
More majordomo info at  
http://vger.kernel.org/majordomo-info.html
Please read the FAQ at  
http://www.tux.org/lkml/