Date: Tue, 26 Jan 1999 22:55:20 -0500 (EST)
From: Joel Gallun <>
Subject: tcp output over ppp broken in 2.2.0
Sender: linux-kernel-owner@vger.kernel.org
Precedence: bulk
List-ID: <linux-kernel.vger.kernel.org>
X-Mailing-List: linux-kernel@vger.kernel.org
X-Lkml-Link: https://lkml.org/lkml/1999/1/26/281

I noticed uploads were taking longer yesterday so I tcpdumped some
transfers. It seems that tcp output over ppp is broken on my system which
was running 2.2.0 with everything except the boot disk as module when I
made this trace. It's compiled with egcs. 
Linux version 2.2.0 (root@lorax) (gcc version egcs-2.90.29 980515
(egcs-1.0.3 release)) #27 Mon Jan 25 23:49:13 EST 1999
I've appended my .config to the end of this message.
This is a tcpdump of a scp of a 200K file. The target system in
this case was solaris, but I get the same results when the
target is linux.
Everything is going great until 21:56:48.414123, when we haven't had the
last 5 segments acked yet (so the window is full now) and we retransmit
the previous segment. It looks to me like we retransmit each segment from
there on until the file is completely transmitted.
root@lorax:/usr/src/linux# tcpdump 
tcpdump: listening on ppp0
21:56:43.959571 199.125.238.15.1025 > 164.109.1.3.domain: 5202+ (41)
21:56:44.257098 164.109.1.3.domain > 199.125.238.15.1025: 5202 1/2/2 (141) (DF)
21:56:44.260337 199.125.238.15.1023 > 206.72.224.51.ssh: S 2434297801:2434297801(0) win 32120 <mss 1460,sackOK,timestamp 228413 0,nop,wscale 0> (DF)
21:56:44.447059 206.72.224.51.ssh > 199.125.238.15.1023: S 3017326418:3017326418(0) ack 2434297802 win 8760 <mss 1460> (DF)
21:56:44.447139 199.125.238.15.1023 > 206.72.224.51.ssh: . ack 1 win 32120 (DF)
21:56:44.737021 206.72.224.51.ssh > 199.125.238.15.1023: P 1:16(15) ack 1 win 8760 (DF) [tos 0x10]
21:56:44.740824 199.125.238.15.1023 > 206.72.224.51.ssh: P 1:16(15) ack 16 win 32120 (DF) [tos 0x10]
21:56:45.037033 206.72.224.51.ssh > 199.125.238.15.1023: P 16:292(276) ack 16 win 8760 (DF) [tos 0x10]
21:56:45.057002 199.125.238.15.1023 > 206.72.224.51.ssh: . ack 292 win 32120 (DF) [tos 0x10]
21:56:45.062054 199.125.238.15.1023 > 206.72.224.51.ssh: P 16:172(156) ack 292 win 32120 (DF) [tos 0x10]
21:56:45.366987 206.72.224.51.ssh > 199.125.238.15.1023: . ack 172 win 8760 (DF) [tos 0x10]
21:56:46.076925 206.72.224.51.ssh > 199.125.238.15.1023: P 292:304(12) ack 172 win 8760 (DF) [tos 0x10]
21:56:46.079735 199.125.238.15.1023 > 206.72.224.51.ssh: P 172:192(20) ack 304 win 32120 (DF) [tos 0x10]
21:56:46.336920 206.72.224.51.ssh > 199.125.238.15.1023: . ack 192 win 8760 (DF) [tos 0x10]
21:56:46.336943 206.72.224.51.ssh > 199.125.238.15.1023: P 304:316(12) ack 192 win 8760 (DF) [tos 0x10]
21:56:46.344285 199.125.238.15.1023 > 206.72.224.51.ssh: P 192:348(156) ack 316 win 32120 (DF) [tos 0x10]
21:56:46.586898 206.72.224.51.ssh > 199.125.238.15.1023: P 316:328(12) ack 348 win 8760 (DF) [tos 0x10]
21:56:46.594393 199.125.238.15.1023 > 206.72.224.51.ssh: P 348:488(140) ack 328 win 32120 (DF) [tos 0x10]
21:56:46.896855 206.72.224.51.ssh > 199.125.238.15.1023: P 328:468(140) ack 488 win 8760 (DF) [tos 0x10]
21:56:46.916835 199.125.238.15.1023 > 206.72.224.51.ssh: . ack 468 win 32120 (DF) [tos 0x10]
21:56:46.999085 199.125.238.15.1023 > 206.72.224.51.ssh: P 488:516(28) ack 468 win 32120 (DF) [tos 0x10]
21:56:47.176866 206.72.224.51.ssh > 199.125.238.15.1023: P 468:512(44) ack 516 win 8760 (DF) [tos 0x10]
21:56:47.186843 206.72.224.51.ssh > 199.125.238.15.1023: P 512:524(12) ack 516 win 8760 (DF) [tos 0x10]
21:56:47.196849 199.125.238.15.1023 > 206.72.224.51.ssh: . ack 524 win 32064 (DF) [tos 0x10]
21:56:47.200303 199.125.238.15.1023 > 206.72.224.51.ssh: P 516:536(20) ack 524 win 32120 (DF) [tos 0x10]
21:56:47.456822 206.72.224.51.ssh > 199.125.238.15.1023: P 524:536(12) ack 536 win 8760 (DF) [tos 0x10]
21:56:47.464278 199.125.238.15.1023 > 206.72.224.51.ssh: P 536:572(36) ack 536 win 32120 (DF) [tos 0x8]
21:56:47.706798 206.72.224.51.ssh > 199.125.238.15.1023: . ack 572 win 8760 (DF) [tos 0x8]
21:56:48.166782 206.72.224.51.ssh > 199.125.238.15.1023: P 536:556(20) ack 572 win 8760 (DF) [tos 0x8]
21:56:48.171049 199.125.238.15.1023 > 206.72.224.51.ssh: P 572:624(52) ack 556 win 32120 (DF) [tos 0x8]
21:56:48.376768 206.72.224.51.ssh > 199.125.238.15.1023: P 556:576(20) ack 624 win 8760 (DF) [tos 0x8]
21:56:48.393776 199.125.238.15.1023 > 206.72.224.51.ssh: . 624:2084(1460) ack 576 win 32120 (DF) [tos 0x8]
21:56:48.394336 199.125.238.15.1023 > 206.72.224.51.ssh: . 2084:3544(1460) ack 576 win 32120 (DF) [tos 0x8]
21:56:48.394783 199.125.238.15.1023 > 206.72.224.51.ssh: P 3544:4748(1204) ack 576 win 32120 (DF) [tos 0x8]
21:56:48.413928 199.125.238.15.1023 > 206.72.224.51.ssh: . 4748:6208(1460) ack 576 win 32120 (DF) [tos 0x8]
21:56:48.414123 199.125.238.15.1023 > 206.72.224.51.ssh: . 6208:7668(1460) ack 576 win 32120 (DF) [tos 0x8]
21:56:48.702368 199.125.238.15.ntp > 204.70.131.13.ntp: v3 client strat 2 poll 6 prec -17
21:56:48.702455 199.125.238.15.1023 > 206.72.224.51.ssh: . 6208:7668(1460) ack 576 win 32120 (DF) [tos 0x8]
21:56:48.702815 199.125.238.15.1023 > 206.72.224.51.ssh: P 7668:8872(1204) ack 576 win 32120 (DF) [tos 0x8]
21:56:48.784938 199.125.238.15.1023 > 206.72.224.51.ssh: P 7668:8872(1204) ack 576 win 32120 (DF) [tos 0x8]
21:56:49.076720 206.72.224.51.ssh > 199.125.238.15.1023: . ack 2084 win 8760 (DF) [tos 0x8]
21:56:49.077817 199.125.238.15.1023 > 206.72.224.51.ssh: . 8872:10332(1460) ack 576 win 32120 (DF) [tos 0x8]
21:56:49.196224 199.125.238.15.1023 > 206.72.224.51.ssh: . 8872:10332(1460) ack 576 win 32120 (DF) [tos 0x8]
21:56:49.606670 199.125.238.15.1023 > 206.72.224.51.ssh: . 2084:3544(1460) ack 576 win 32120 (DF) [tos 0x8]
21:56:49.736596 206.72.224.51.ssh > 199.125.238.15.1023: . ack 3544 win 8760 (DF) [tos 0x8]
21:56:49.736677 199.125.238.15.1023 > 206.72.224.51.ssh: P 3544:4748(1204) ack 576 win 32120 (DF) [tos 0x8]
21:56:50.006569 206.72.224.51.ssh > 199.125.238.15.1023: . ack 4748 win 8760 (DF) [tos 0x8]
21:56:50.187345 199.125.238.15.1023 > 206.72.224.51.ssh: P 3544:4748(1204) ack 576 win 32120 (DF) [tos 0x8]
21:56:50.187468 199.125.238.15.1023 > 206.72.224.51.ssh: . 4748:6208(1460) ack 576 win 32120 (DF) [tos 0x8]
21:56:50.522798 199.125.238.15.1023 > 206.72.224.51.ssh: . 4748:6208(1460) ack 576 win 32120 (DF) [tos 0x8]
21:56:50.522858 199.125.238.15.1023 > 206.72.224.51.ssh: . 6208:7668(1460) ack 576 win 32120 (DF) [tos 0x8]
21:56:50.536577 206.72.224.51.ssh > 199.125.238.15.1023: . ack 6208 win 8760 (DF) [tos 0x8]
21:56:51.022116 199.125.238.15.1023 > 206.72.224.51.ssh: . 6208:7668(1460) ack 576 win 32120 (DF) [tos 0x8]
21:56:51.022178 199.125.238.15.1023 > 206.72.224.51.ssh: P 7668:8872(1204) ack 576 win 32120 (DF) [tos 0x8]
21:56:51.046494 206.72.224.51.ssh > 199.125.238.15.1023: . ack 7668 win 8760 (DF) [tos 0x8]
21:56:51.416477 206.72.224.51.ssh > 199.125.238.15.1023: . ack 8872 win 8760 (DF) [tos 0x8]
21:56:51.514216 199.125.238.15.1023 > 206.72.224.51.ssh: P 7668:8872(1204) ack 576 win 32120 (DF) [tos 0x8]
21:56:51.514283 199.125.238.15.1023 > 206.72.224.51.ssh: . 8872:10332(1460) ack 576 win 32120 (DF) [tos 0x8]
21:56:51.916393 206.72.224.51.ssh > 199.125.238.15.1023: . ack 10332 win 8760 (DF) [tos 0x8]
21:56:51.931675 199.125.238.15.1023 > 206.72.224.51.ssh: . 8872:10332(1460) ack 576 win 32120 (DF) [tos 0x8]
21:56:51.931745 199.125.238.15.1023 > 206.72.224.51.ssh: . 10332:11792(1460) ack 576 win 32120 (DF) [tos 0x8]
21:56:52.336396 206.72.224.51.ssh > 199.125.238.15.1023: . ack 10332 win 8760 (DF) [tos 0x8]
21:56:52.432669 199.125.238.15.1023 > 206.72.224.51.ssh: . 10332:11792(1460) ack 576 win 32120 (DF) [tos 0x8]
21:56:52.432786 199.125.238.15.1023 > 206.72.224.51.ssh: P 11792:13252(1460) ack 576 win 32120 (DF) [tos 0x8]
21:56:52.746333 206.72.224.51.ssh > 199.125.238.15.1023: . ack 10332 win 8760 (DF) [tos 0x8]
21:56:52.842118 199.125.238.15.1023 > 206.72.224.51.ssh: P 11792:13252(1460) ack 576 win 32120 (DF) [tos 0x8]
21:56:52.842179 199.125.238.15.1023 > 206.72.224.51.ssh: . 13252:14712(1460) ack 576 win 32120 (DF) [tos 0x8]
21:56:53.226311 206.72.224.51.ssh > 199.125.238.15.1023: . ack 10332 win 8760 (DF) [tos 0x8]
21:56:53.342139 199.125.238.15.1023 > 206.72.224.51.ssh: . 13252:14712(1460) ack 576 win 32120 (DF) [tos 0x8]
21:56:53.342205 199.125.238.15.1023 > 206.72.224.51.ssh: . 14712:16172(1460) ack 576 win 32120 (DF) [tos 0x8]
21:56:53.706267 206.72.224.51.ssh > 199.125.238.15.1023: . ack 10332 win 8760 (DF) [tos 0x8]
21:56:53.846346 199.125.238.15.1023 > 206.72.224.51.ssh: . 14712:16172(1460) ack 576 win 32120 (DF) [tos 0x8]
21:56:53.846413 199.125.238.15.1023 > 206.72.224.51.ssh: P 16172:17632(1460) ack 576 win 32120 (DF) [tos 0x8]
21:56:54.116224 206.72.224.51.ssh > 199.125.238.15.1023: . ack 10332 win 8760 (DF) [tos 0x8]
21:56:54.346028 199.125.238.15.1023 > 206.72.224.51.ssh: P 16172:17632(1460) ack 576 win 32120 (DF) [tos 0x8]
21:56:54.346094 199.125.238.15.1023 > 206.72.224.51.ssh: . 17632:19092(1460) ack 576 win 32120 (DF) [tos 0x8]
21:56:54.616223 206.72.224.51.ssh > 199.125.238.15.1023: . ack 10332 win 8760 (DF) [tos 0x8]
21:56:54.845051 199.125.238.15.1023 > 206.72.224.51.ssh: . 17632:19092(1460) ack 576 win 32120 (DF) [tos 0x8]
21:56:54.845113 199.125.238.15.1023 > 206.72.224.51.ssh: . 10332:11792(1460) ack 576 win 32120 (DF) [tos 0x8]
21:56:55.076140 206.72.224.51.ssh > 199.125.238.15.1023: . ack 11792 win 8760 (DF) [tos 0x8]
21:56:55.251753 199.125.238.15.1023 > 206.72.224.51.ssh: . 10332:11792(1460) ack 576 win 32120 (DF) [tos 0x8]
21:56:55.251811 199.125.238.15.1023 > 206.72.224.51.ssh: P 11792:13252(1460) ack 576 win 32120 (DF) [tos 0x8]
21:56:55.596176 206.72.224.51.ssh > 199.125.238.15.1023: . ack 13252 win 8760 (DF) [tos 0x8]
21:56:55.831320 199.125.238.15.1023 > 206.72.224.51.ssh: P 11792:13252(1460) ack 576 win 32120 (DF) [tos 0x8]
21:56:55.831438 199.125.238.15.1023 > 206.72.224.51.ssh: . 19092:20552(1460) ack 576 win 32120 (DF) [tos 0x8]
21:56:56.226058 206.72.224.51.ssh > 199.125.238.15.1023: . ack 14712 win 8760 (DF) [tos 0x8]
21:56:56.247175 199.125.238.15.1023 > 206.72.224.51.ssh: . 19092:20552(1460) ack 576 win 32120 (DF) [tos 0x8]
21:56:56.247254 199.125.238.15.1023 > 206.72.224.51.ssh: . 13252:14712(1460) ack 576 win 32120 (DF) [tos 0x8]
21:56:56.606061 206.72.224.51.ssh > 199.125.238.15.1023: . ack 16172 win 8760 (DF) [tos 0x8]
21:56:56.749974 199.125.238.15.1023 > 206.72.224.51.ssh: . 13252:14712(1460) ack 576 win 32120 (DF) [tos 0x8]
21:56:56.750030 199.125.238.15.1023 > 206.72.224.51.ssh: P 20552:22012(1460) ack 576 win 32120 (DF) [tos 0x8]
21:56:57.055974 206.72.224.51.ssh > 199.125.238.15.1023: . ack 17632 win 8760 (DF) [tos 0x8]
21:56:57.329074 199.125.238.15.1023 > 206.72.224.51.ssh: P 20552:22012(1460) ack 576 win 32120 (DF) [tos 0x8]
21:56:57.329200 199.125.238.15.1023 > 206.72.224.51.ssh: . 14712:16172(1460) ack 576 win 32120 (DF) [tos 0x8]
21:56:57.565974 206.72.224.51.ssh > 199.125.238.15.1023: . ack 19092 win 8760 (DF) [tos 0x8]
21:56:57.746683 199.125.238.15.1023 > 206.72.224.51.ssh: . 14712:16172(1460) ack 576 win 32120 (DF) [tos 0x8]
21:56:57.746743 199.125.238.15.1023 > 206.72.224.51.ssh: . 22012:23472(1460) ack 576 win 32120 (DF) [tos 0x8]
21:56:57.955934 206.72.224.51.ssh > 199.125.238.15.1023: . ack 19092 win 8760 (DF) [tos 0x8]
21:56:58.320407 199.125.238.15.1023 > 206.72.224.51.ssh: . 22012:23472(1460) ack 576 win 32120 (DF) [tos 0x8]
21:56:58.320545 199.125.238.15.1023 > 206.72.224.51.ssh: P 16172:17632(1460) ack 576 win 32120 (DF) [tos 0x8]
21:56:58.485908 206.72.224.51.ssh > 199.125.238.15.1023: . ack 19092 win 8760 (DF) [tos 0x8]
21:56:58.738122 199.125.238.15.1023 > 206.72.224.51.ssh: P 16172:17632(1460) ack 576 win 32120 (DF) [tos 0x8]
21:56:58.738183 199.125.238.15.1023 > 206.72.224.51.ssh: . 23472:24932(1460) ack 576 win 32120 (DF) [tos 0x8]
21:56:58.945814 206.72.224.51.ssh > 199.125.238.15.1023: . ack 20552 win 8760 (DF) [tos 0x8]
21:56:59.241820 199.125.238.15.1023 > 206.72.224.51.ssh: . 23472:24932(1460) ack 576 win 32120 (DF) [tos 0x8]
21:56:59.241887 199.125.238.15.1023 > 206.72.224.51.ssh: . 17632:19092(1460) ack 576 win 32120 (DF) [tos 0x8]
21:56:59.435825 206.72.224.51.ssh > 199.125.238.15.1023: . ack 20552 win 8760 (DF) [tos 0x8]
21:56:59.651999 199.125.238.15.1023 > 206.72.224.51.ssh: . 17632:19092(1460) ack 576 win 32120 (DF) [tos 0x8]
21:56:59.652059 199.125.238.15.1023 > 206.72.224.51.ssh: P 24932:26392(1460) ack 576 win 32120 (DF) [tos 0x8]
21:56:59.925725 206.72.224.51.ssh > 199.125.238.15.1023: . ack 22012 win 8760 (DF) [tos 0x8]
21:57:00.234669 199.125.238.15.1023 > 206.72.224.51.ssh: P 24932:26392(1460) ack 576 win 32120 (DF) [tos 0x8]
21:57:00.234800 199.125.238.15.1023 > 206.72.224.51.ssh: . 19092:20552(1460) ack 576 win 32120 (DF) [tos 0x8]
21:57:00.455722 206.72.224.51.ssh > 199.125.238.15.1023: . ack 22012 win 8760 (DF) [tos 0x8]
21:57:00.649835 199.125.238.15.1023 > 206.72.224.51.ssh: . 19092:20552(1460) ack 576 win 32120 (DF) [tos 0x8]
21:57:00.649893 199.125.238.15.1023 > 206.72.224.51.ssh: P 20552:22012(1460) ack 576 win 32120 (DF) [tos 0x8]
21:57:00.895643 206.72.224.51.ssh > 199.125.238.15.1023: . ack 23472 win 8760 (DF) [tos 0x8]
21:57:01.230749 199.125.238.15.1023 > 206.72.224.51.ssh: P 20552:22012(1460) ack 576 win 32120 (DF) [tos 0x8]
21:57:01.230862 199.125.238.15.1023 > 206.72.224.51.ssh: . 22012:23472(1460) ack 576 win 32120 (DF) [tos 0x8]
21:57:01.475680 206.72.224.51.ssh > 199.125.238.15.1023: . ack 23472 win 8760 (DF) [tos 0x8]
21:57:01.640547 199.125.238.15.1023 > 206.72.224.51.ssh: . 22012:23472(1460) ack 576 win 32120 (DF) [tos 0x8]
21:57:01.640607 199.125.238.15.1023 > 206.72.224.51.ssh: . 23472:24932(1460) ack 576 win 32120 (DF) [tos 0x8]
21:57:01.895559 206.72.224.51.ssh > 199.125.238.15.1023: . ack 24932 win 8760 (DF) [tos 0x8]
21:57:02.141451 199.125.238.15.1023 > 206.72.224.51.ssh: . 23472:24932(1460) ack 576 win 32120 (DF) [tos 0x8]
21:57:02.141513 199.125.238.15.1023 > 206.72.224.51.ssh: P 24932:26392(1460) ack 576 win 32120 (DF) [tos 0x8]
21:57:02.385554 206.72.224.51.ssh > 199.125.238.15.1023: . ack 24932 win 8760 (DF) [tos 0x8]
21:57:02.635495 199.125.238.15.1023 > 206.72.224.51.ssh: P 24932:26392(1460) ack 576 win 32120 (DF) [tos 0x8]
21:57:02.635569 199.125.238.15.1023 > 206.72.224.51.ssh: . 22012:23472(1460) ack 576 win 32120 (DF) [tos 0x8]
21:57:02.875471 206.72.224.51.ssh > 199.125.238.15.1023: . ack 26392 win 8760 (DF) [tos 0x8]
21:57:03.137331 199.125.238.15.1023 > 206.72.224.51.ssh: . 22012:23472(1460) ack 576 win 32120 (DF) [tos 0x8]
21:57:03.137386 199.125.238.15.1023 > 206.72.224.51.ssh: . 23472:24932(1460) ack 576 win 32120 (DF) [tos 0x8]
21:57:03.345480 206.72.224.51.ssh > 199.125.238.15.1023: . ack 26392 win 8760 (DF) [tos 0x8]
21:57:03.630041 199.125.238.15.1023 > 206.72.224.51.ssh: . 23472:24932(1460) ack 576 win 32120 (DF) [tos 0x8]
21:57:03.630102 199.125.238.15.1023 > 206.72.224.51.ssh: P 24932:26392(1460) ack 576 win 32120 (DF) [tos 0x8]
21:57:03.835421 206.72.224.51.ssh > 199.125.238.15.1023: . ack 26392 win 8760 (DF) [tos 0x8]
21:57:04.045406 199.125.238.15.1023 > 206.72.224.51.ssh: P 24932:26392(1460) ack 576 win 32120 (DF) [tos 0x8]
21:57:04.045489 199.125.238.15.1023 > 206.72.224.51.ssh: . 26392:27852(1460) ack 576 win 32120 (DF) [tos 0x8]
21:57:04.335383 206.72.224.51.ssh > 199.125.238.15.1023: . ack 26392 win 8760 (DF) [tos 0x8]
21:57:04.540922 199.125.238.15.1023 > 206.72.224.51.ssh: . 26392:27852(1460) ack 576 win 32120 (DF) [tos 0x8]
21:57:04.540981 199.125.238.15.1023 > 206.72.224.51.ssh: . 27852:29312(1460) ack 576 win 32120 (DF) [tos 0x8]
21:57:04.815317 206.72.224.51.ssh > 199.125.238.15.1023: . ack 26392 win 8760 (DF) [tos 0x8]
21:57:05.044667 199.125.238.15.1023 > 206.72.224.51.ssh: . 27852:29312(1460) ack 576 win 32120 (DF) [tos 0x8]
21:57:05.044726 199.125.238.15.1023 > 206.72.224.51.ssh: . 26392:27852(1460) ack 576 win 32120 (DF) [tos 0x8]
21:57:05.295347 206.72.224.51.ssh > 199.125.238.15.1023: . ack 26392 win 8760 (DF) [tos 0x8]
21:57:05.542394 199.125.238.15.1023 > 206.72.224.51.ssh: . 26392:27852(1460) ack 576 win 32120 (DF) [tos 0x8]
21:57:05.542453 199.125.238.15.1023 > 206.72.224.51.ssh: P 29312:30772(1460) ack 576 win 32120 (DF) [tos 0x8]
21:57:05.855235 206.72.224.51.ssh > 199.125.238.15.1023: . ack 26392 win 8760 (DF) [tos 0x8]
21:57:06.116328 199.125.238.15.1023 > 206.72.224.51.ssh: P 29312:30772(1460) ack 576 win 32120 (DF) [tos 0x8]
21:57:06.116468 199.125.238.15.1023 > 206.72.224.51.ssh: . 30772:32232(1460) ack 576 win 32120 (DF) [tos 0x8]
21:57:06.305240 206.72.224.51.ssh > 199.125.238.15.1023: . ack 26392 win 8760 (DF) [tos 0x8]
21:57:06.532159 199.125.238.15.1023 > 206.72.224.51.ssh: . 30772:32232(1460) ack 576 win 32120 (DF) [tos 0x8]
21:57:06.532215 199.125.238.15.1023 > 206.72.224.51.ssh: P 32232:33692(1460) ack 576 win 32120 (DF) [tos 0x8]
21:57:06.865154 206.72.224.51.ssh > 199.125.238.15.1023: . ack 26392 win 8760 (DF) [tos 0x8]
21:57:07.027164 199.125.238.15.1023 > 206.72.224.51.ssh: P 32232:33692(1460) ack 576 win 32120 (DF) [tos 0x8]
21:57:07.027277 199.125.238.15.1023 > 206.72.224.51.ssh: . 33692:35152(1460) ack 576 win 32120 (DF) [tos 0x8]
21:57:07.375146 206.72.224.51.ssh > 199.125.238.15.1023: . ack 27852 win 8760 (DF) [tos 0x8]
21:57:07.441434 199.125.238.15.1023 > 206.72.224.51.ssh: . 33692:35152(1460) ack 576 win 32120 (DF) [tos 0x8]
21:57:07.441493 199.125.238.15.1023 > 206.72.224.51.ssh: . 27852:29312(1460) ack 576 win 32120 (DF) [tos 0x8]
21:57:07.805055 206.72.224.51.ssh > 199.125.238.15.1023: . ack 29312 win 8760 (DF) [tos 0x8]
21:57:07.939077 199.125.238.15.1023 > 206.72.224.51.ssh: . 27852:29312(1460) ack 576 win 32120 (DF) [tos 0x8]
21:57:07.939132 199.125.238.15.1023 > 206.72.224.51.ssh: . 35152:36612(1460) ack 576 win 32120 (DF) [tos 0x8]
21:57:08.205052 206.72.224.51.ssh > 199.125.238.15.1023: . ack 29312 win 8760 (DF) [tos 0x8]
21:57:08.520787 199.125.238.15.1023 > 206.72.224.51.ssh: . 35152:36612(1460) ack 576 win 32120 (DF) [tos 0x8]
21:57:08.695022 206.72.224.51.ssh > 199.125.238.15.1023: . ack 30772 win 8760 (DF) [tos 0x8]
21:57:09.284970 206.72.224.51.ssh > 199.125.238.15.1023: . ack 32232 win 8760 (DF) [tos 0x8]
21:57:09.285039 199.125.238.15.1023 > 206.72.224.51.ssh: P 36612:38072(1460) ack 576 win 32120 (DF) [tos 0x8]
21:57:09.704932 206.72.224.51.ssh > 199.125.238.15.1023: . ack 33692 win 8760 (DF) [tos 0x8]
21:57:09.705004 199.125.238.15.1023 > 206.72.224.51.ssh: . 38072:39532(1460) ack 576 win 32120 (DF) [tos 0x8]
21:57:10.244889 206.72.224.51.ssh > 199.125.238.15.1023: . ack 35152 win 8760 (DF) [tos 0x8]
21:57:10.244958 199.125.238.15.1023 > 206.72.224.51.ssh: . 39532:40992(1460) ack 576 win 32120 (DF) [tos 0x8]
21:57:10.634897 206.72.224.51.ssh > 199.125.238.15.1023: . ack 35152 win 8760 (DF) [tos 0x8]
21:57:11.134801 206.72.224.51.ssh > 199.125.238.15.1023: . ack 36612 win 8760 (DF) [tos 0x8]
21:57:11.134867 199.125.238.15.1023 > 206.72.224.51.ssh: . 40992:42452(1460) ack 576 win 32120 (DF) [tos 0x8]
21:57:11.654793 206.72.224.51.ssh > 199.125.238.15.1023: . ack 38072 win 8760 (DF) [tos 0x8]
21:57:11.654864 199.125.238.15.1023 > 206.72.224.51.ssh: . 42452:43912(1460) ack 576 win 32120 (DF) [tos 0x8]
21:57:12.204721 206.72.224.51.ssh > 199.125.238.15.1023: . ack 39532 win 8760 (DF) [tos 0x8]
21:57:12.204791 199.125.238.15.1023 > 206.72.224.51.ssh: . 43912:45372(1460) ack 576 win 32120 (DF) [tos 0x8]
21:57:12.205229 199.125.238.15.1023 > 206.72.224.51.ssh: . 45372:46832(1460) ack 576 win 32120 (DF) [tos 0x8]
21:57:12.684690 206.72.224.51.ssh > 199.125.238.15.1023: . ack 40992 win 8760 (DF) [tos 0x8]
21:57:12.684761 199.125.238.15.1023 > 206.72.224.51.ssh: . 46832:48292(1460) ack 576 win 32120 (DF) [tos 0x8]
21:57:13.154637 206.72.224.51.ssh > 199.125.238.15.1023: . ack 42452 win 8760 (DF) [tos 0x8]
21:57:13.154707 199.125.238.15.1023 > 206.72.224.51.ssh: . 48292:49752(1460) ack 576 win 32120 (DF) [tos 0x8]
21:57:13.654622 206.72.224.51.ssh > 199.125.238.15.1023: . ack 43912 win 8760 (DF) [tos 0x8]
21:57:13.654692 199.125.238.15.1023 > 206.72.224.51.ssh: . 49752:51212(1460) ack 576 win 32120 (DF) [tos 0x8]
21:57:14.114552 206.72.224.51.ssh > 199.125.238.15.1023: . ack 45372 win 8760 (DF) [tos 0x8]
21:57:14.114624 199.125.238.15.1023 > 206.72.224.51.ssh: . 51212:52672(1460) ack 576 win 32120 (DF) [tos 0x8]
21:57:14.684521 206.72.224.51.ssh > 199.125.238.15.1023: . ack 46832 win 8760 (DF) [tos 0x8]
21:57:14.684592 199.125.238.15.1023 > 206.72.224.51.ssh: . 52672:54132(1460) ack 576 win 32120 (DF) [tos 0x8]
21:57:15.104468 206.72.224.51.ssh > 199.125.238.15.1023: . ack 48292 win 8760 (DF) [tos 0x8]
21:57:15.104536 199.125.238.15.1023 > 206.72.224.51.ssh: . 54132:55592(1460) ack 576 win 32120 (DF) [tos 0x8]
21:57:15.104919 199.125.238.15.1023 > 206.72.224.51.ssh: . 55592:57052(1460) ack 576 win 32120 (DF) [tos 0x8]
21:57:15.239098 199.125.238.15.1023 > 206.72.224.51.ssh: . 55592:57052(1460) ack 576 win 32120 (DF) [tos 0x8]
21:57:15.634472 206.72.224.51.ssh > 199.125.238.15.1023: . ack 49752 win 8760 (DF) [tos 0x8]
21:57:15.634544 199.125.238.15.1023 > 206.72.224.51.ssh: . 57052:58512(1460) ack 576 win 32120 (DF) [tos 0x8]
21:57:15.738684 199.125.238.15.1023 > 206.72.224.51.ssh: . 57052:58512(1460) ack 576 win 32120 (DF) [tos 0x8]
21:57:16.064383 206.72.224.51.ssh > 199.125.238.15.1023: . ack 51212 win 8760 (DF) [tos 0x8]
21:57:16.064450 199.125.238.15.1023 > 206.72.224.51.ssh: . 58512:59972(1460) ack 576 win 32120 (DF) [tos 0x8]
21:57:16.155165 199.125.238.15.1023 > 206.72.224.51.ssh: . 58512:59972(1460) ack 576 win 32120 (DF) [tos 0x8]
21:57:16.554384 206.72.224.51.ssh > 199.125.238.15.1023: . ack 52672 win 8760 (DF) [tos 0x8]
21:57:16.554455 199.125.238.15.1023 > 206.72.224.51.ssh: . 59972:61432(1460) ack 576 win 32120 (DF) [tos 0x8]
21:57:16.652148 199.125.238.15.1023 > 206.72.224.51.ssh: . 59972:61432(1460) ack 576 win 32120 (DF) [tos 0x8]
21:57:17.014300 206.72.224.51.ssh > 199.125.238.15.1023: . ack 54132 win 8760 (DF) [tos 0x8]
21:57:17.014368 199.125.238.15.1023 > 206.72.224.51.ssh: . 61432:62892(1460) ack 576 win 32120 (DF) [tos 0x8]
21:57:17.149727 199.125.238.15.1023 > 206.72.224.51.ssh: . 61432:62892(1460) ack 576 win 32120 (DF) [tos 0x8]
21:57:17.504307 206.72.224.51.ssh > 199.125.238.15.1023: . ack 55592 win 8760 (DF) [tos 0x8]
21:57:17.504377 199.125.238.15.1023 > 206.72.224.51.ssh: . 62892:64352(1460) ack 576 win 32120 (DF) [tos 0x8]
21:57:17.641860 199.125.238.15.1023 > 206.72.224.51.ssh: . 62892:64352(1460) ack 576 win 32120 (DF) [tos 0x8]
21:57:18.004222 206.72.224.51.ssh > 199.125.238.15.1023: . ack 57052 win 8760 (DF) [tos 0x8]
21:57:18.004291 199.125.238.15.1023 > 206.72.224.51.ssh: . 64352:65812(1460) ack 576 win 32120 (DF) [tos 0x8]
21:57:18.139820 199.125.238.15.1023 > 206.72.224.51.ssh: . 64352:65812(1460) ack 576 win 32120 (DF) [tos 0x8]
21:57:18.464217 206.72.224.51.ssh > 199.125.238.15.1023: . ack 58512 win 8760 (DF) [tos 0x8]
21:57:18.464287 199.125.238.15.1023 > 206.72.224.51.ssh: . 65812:67272(1460) ack 576 win 32120 (DF) [tos 0x8]
21:57:18.554831 199.125.238.15.1023 > 206.72.224.51.ssh: . 65812:67272(1460) ack 576 win 32120 (DF) [tos 0x8]
21:57:19.034131 206.72.224.51.ssh > 199.125.238.15.1023: . ack 59972 win 8760 (DF) [tos 0x8]
21:57:19.034200 199.125.238.15.1023 > 206.72.224.51.ssh: . 67272:68732(1460) ack 576 win 32120 (DF) [tos 0x8]
21:57:19.052856 199.125.238.15.1023 > 206.72.224.51.ssh: . 67272:68732(1460) ack 576 win 32120 (DF) [tos 0x8]
21:57:19.414133 206.72.224.51.ssh > 199.125.238.15.1023: . ack 61432 win 8760 (DF) [tos 0x8]
21:57:19.414203 199.125.238.15.1023 > 206.72.224.51.ssh: . 68732:70192(1460) ack 576 win 32120 (DF) [tos 0x8]
21:57:19.553457 199.125.238.15.1023 > 206.72.224.51.ssh: . 68732:70192(1460) ack 576 win 32120 (DF) [tos 0x8]
21:57:19.954052 206.72.224.51.ssh > 199.125.238.15.1023: . ack 62892 win 8760 (DF) [tos 0x8]
21:57:19.954122 199.125.238.15.1023 > 206.72.224.51.ssh: . 70192:71652(1460) ack 576 win 32120 (DF) [tos 0x8]
21:57:20.045961 199.125.238.15.1023 > 206.72.224.51.ssh: . 70192:71652(1460) ack 576 win 32120 (DF) [tos 0x8]
21:57:20.394054 206.72.224.51.ssh > 199.125.238.15.1023: . ack 64352 win 8760 (DF) [tos 0x8]
21:57:20.394127 199.125.238.15.1023 > 206.72.224.51.ssh: . 71652:73112(1460) ack 576 win 32120 (DF) [tos 0x8]
21:57:20.547998 199.125.238.15.1023 > 206.72.224.51.ssh: . 71652:73112(1460) ack 576 win 32120 (DF) [tos 0x8]
21:57:20.873969 206.72.224.51.ssh > 199.125.238.15.1023: . ack 65812 win 8760 (DF) [tos 0x8]
21:57:20.874040 199.125.238.15.1023 > 206.72.224.51.ssh: . 73112:74572(1460) ack 576 win 32120 (DF) [tos 0x8]
21:57:20.968176 199.125.238.15.1023 > 206.72.224.51.ssh: . 73112:74572(1460) ack 576 win 32120 (DF) [tos 0x8]
21:57:21.363967 206.72.224.51.ssh > 199.125.238.15.1023: . ack 67272 win 8760 (DF) [tos 0x8]
21:57:21.364039 199.125.238.15.1023 > 206.72.224.51.ssh: . 74572:76032(1460) ack 576 win 32120 (DF) [tos 0x8]
21:57:21.464794 199.125.238.15.1023 > 206.72.224.51.ssh: . 74572:76032(1460) ack 576 win 32120 (DF) [tos 0x8]
21:57:21.863883 206.72.224.51.ssh > 199.125.238.15.1023: . ack 68732 win 8760 (DF) [tos 0x8]
21:57:21.863955 199.125.238.15.1023 > 206.72.224.51.ssh: . 76032:77492(1460) ack 576 win 32120 (DF) [tos 0x8]
21:57:21.957230 199.125.238.15.1023 > 206.72.224.51.ssh: . 76032:77492(1460) ack 576 win 32120 (DF) [tos 0x8]
21:57:22.353884 206.72.224.51.ssh > 199.125.238.15.1023: . ack 70192 win 8760 (DF) [tos 0x8]
21:57:22.353954 199.125.238.15.1023 > 206.72.224.51.ssh: . 77492:78952(1460) ack 576 win 32120 (DF) [tos 0x8]
21:57:22.454545 199.125.238.15.1023 > 206.72.224.51.ssh: . 77492:78952(1460) ack 576 win 32120 (DF) [tos 0x8]
21:57:22.833798 206.72.224.51.ssh > 199.125.238.15.1023: . ack 71652 win 8760 (DF) [tos 0x8]
21:57:22.833872 199.125.238.15.1023 > 206.72.224.51.ssh: . 78952:80412(1460) ack 576 win 32120 (DF) [tos 0x8]
21:57:22.957759 199.125.238.15.1023 > 206.72.224.51.ssh: . 78952:80412(1460) ack 576 win 32120 (DF) [tos 0x8]
21:57:23.353804 206.72.224.51.ssh > 199.125.238.15.1023: . ack 73112 win 8760 (DF) [tos 0x8]
21:57:23.353874 199.125.238.15.1023 > 206.72.224.51.ssh: . 80412:81872(1460) ack 576 win 32120 (DF) [tos 0x8]
21:57:23.450231 199.125.238.15.1023 > 206.72.224.51.ssh: . 80412:81872(1460) ack 576 win 32120 (DF) [tos 0x8]
21:57:23.803717 206.72.224.51.ssh > 199.125.238.15.1023: . ack 74572 win 8760 (DF) [tos 0x8]
21:57:23.803792 199.125.238.15.1023 > 206.72.224.51.ssh: . 81872:83332(1460) ack 576 win 32120 (DF) [tos 0x8]
21:57:23.862574 199.125.238.15.1023 > 206.72.224.51.ssh: . 81872:83332(1460) ack 576 win 32120 (DF) [tos 0x8]
21:57:24.283717 206.72.224.51.ssh > 199.125.238.15.1023: . ack 76032 win 8760 (DF) [tos 0x8]
21:57:24.283788 199.125.238.15.1023 > 206.72.224.51.ssh: . 83332:84792(1460) ack 576 win 32120 (DF) [tos 0x8]
21:57:24.362876 199.125.238.15.1023 > 206.72.224.51.ssh: . 83332:84792(1460) ack 576 win 32120 (DF) [tos 0x8]
21:57:24.733662 206.72.224.51.ssh > 199.125.238.15.1023: . ack 77492 win 8760 (DF) [tos 0x8]
21:57:24.733734 199.125.238.15.1023 > 206.72.224.51.ssh: . 84792:86252(1460) ack 576 win 32120 (DF) [tos 0x8]
21:57:24.859741 199.125.238.15.1023 > 206.72.224.51.ssh: . 84792:86252(1460) ack 576 win 32120 (DF) [tos 0x8]
21:57:25.223629 206.72.224.51.ssh > 199.125.238.15.1023: . ack 78952 win 8760 (DF) [tos 0x8]
21:57:25.223703 199.125.238.15.1023 > 206.72.224.51.ssh: . 86252:87712(1460) ack 576 win 32120 (DF) [tos 0x8]
21:57:25.363117 199.125.238.15.1023 > 206.72.224.51.ssh: . 86252:87712(1460) ack 576 win 32120 (DF) [tos 0x8]
21:57:25.723583 206.72.224.51.ssh > 199.125.238.15.1023: . ack 80412 win 8760 (DF) [tos 0x8]
21:57:25.723653 199.125.238.15.1023 > 206.72.224.51.ssh: . 87712:89172(1460) ack 576 win 32120 (DF) [tos 0x8]
21:57:25.861079 199.125.238.15.1023 > 206.72.224.51.ssh: . 87712:89172(1460) ack 576 win 32120 (DF) [tos 0x8]
21:57:26.183548 206.72.224.51.ssh > 199.125.238.15.1023: . ack 81872 win 8760 (DF) [tos 0x8]
21:57:26.183630 199.125.238.15.1023 > 206.72.224.51.ssh: . 89172:90632(1460) ack 576 win 32120 (DF) [tos 0x8]
21:57:26.352144 199.125.238.15.1023 > 206.72.224.51.ssh: . 89172:90632(1460) ack 576 win 32120 (DF) [tos 0x8]
21:57:26.673524 206.72.224.51.ssh > 199.125.238.15.1023: . ack 83332 win 8760 (DF) [tos 0x8]
21:57:26.673598 199.125.238.15.1023 > 206.72.224.51.ssh: . 90632:92092(1460) ack 576 win 32120 (DF) [tos 0x8]
21:57:26.766750 199.125.238.15.1023 > 206.72.224.51.ssh: . 90632:92092(1460) ack 576 win 32120 (DF) [tos 0x8]
21:57:27.173466 206.72.224.51.ssh > 199.125.238.15.1023: . ack 84792 win 8760 (DF) [tos 0x8]
21:57:27.173536 199.125.238.15.1023 > 206.72.224.51.ssh: . 92092:93552(1460) ack 576 win 32120 (DF) [tos 0x8]
21:57:27.268417 199.125.238.15.1023 > 206.72.224.51.ssh: . 92092:93552(1460) ack 576 win 32120 (DF) [tos 0x8]
21:57:27.673440 206.72.224.51.ssh > 199.125.238.15.1023: . ack 86252 win 8760 (DF) [tos 0x8]
21:57:27.673510 199.125.238.15.1023 > 206.72.224.51.ssh: . 93552:95012(1460) ack 576 win 32120 (DF) [tos 0x8]
21:57:27.761117 199.125.238.15.1023 > 206.72.224.51.ssh: . 93552:95012(1460) ack 576 win 32120 (DF) [tos 0x8]
21:57:28.123381 206.72.224.51.ssh > 199.125.238.15.1023: . ack 87712 win 8760 (DF) [tos 0x8]
21:57:28.123451 199.125.238.15.1023 > 206.72.224.51.ssh: . 95012:96472(1460) ack 576 win 32120 (DF) [tos 0x8]
21:57:28.260911 199.125.238.15.1023 > 206.72.224.51.ssh: . 95012:96472(1460) ack 576 win 32120 (DF) [tos 0x8]
21:57:28.623391 206.72.224.51.ssh > 199.125.238.15.1023: . ack 89172 win 8760 (DF) [tos 0x8]
21:57:28.623463 199.125.238.15.1023 > 206.72.224.51.ssh: . 96472:97932(1460) ack 576 win 32120 (DF) [tos 0x8]
21:57:28.757836 199.125.238.15.1023 > 206.72.224.51.ssh: . 96472:97932(1460) ack 576 win 32120 (DF) [tos 0x8]
21:57:29.093300 206.72.224.51.ssh > 199.125.238.15.1023: . ack 90632 win 8760 (DF) [tos 0x8]
21:57:29.093370 199.125.238.15.1023 > 206.72.224.51.ssh: . 97932:99392(1460) ack 576 win 32120 (DF) [tos 0x8]
21:57:29.254486 199.125.238.15.1023 > 206.72.224.51.ssh: . 97932:99392(1460) ack 576 win 32120 (DF) [tos 0x8]
21:57:29.573298 206.72.224.51.ssh > 199.125.238.15.1023: . ack 92092 win 8760 (DF) [tos 0x8]
21:57:29.573366 199.125.238.15.1023 > 206.72.224.51.ssh: . 99392:100852(1460) ack 576 win 32120 (DF) [tos 0x8]
21:57:29.671883 199.125.238.15.1023 > 206.72.224.51.ssh: . 99392:100852(1460) ack 576 win 32120 (DF) [tos 0x8]
21:57:30.063214 206.72.224.51.ssh > 199.125.238.15.1023: . ack 93552 win 8760 (DF) [tos 0x8]
21:57:30.063284 199.125.238.15.1023 > 206.72.224.51.ssh: . 100852:102312(1460) ack 576 win 32120 (DF) [tos 0x8]
21:57:30.162355 199.125.238.15.1023 > 206.72.224.51.ssh: . 100852:102312(1460) ack 576 win 32120 (DF) [tos 0x8]
21:57:30.533213 206.72.224.51.ssh > 199.125.238.15.1023: . ack 95012 win 8760 (DF) [tos 0x8]
21:57:30.533281 199.125.238.15.1023 > 206.72.224.51.ssh: . 102312:103772(1460) ack 576 win 32120 (DF) [tos 0x8]
21:57:30.661184 199.125.238.15.1023 > 206.72.224.51.ssh: . 102312:103772(1460) ack 576 win 32120 (DF) [tos 0x8]
21:57:31.033130 206.72.224.51.ssh > 199.125.238.15.1023: . ack 96472 win 8760 (DF) [tos 0x8]
21:57:31.033201 199.125.238.15.1023 > 206.72.224.51.ssh: . 103772:105232(1460) ack 576 win 32120 (DF) [tos 0x8]
21:57:31.164498 199.125.238.15.1023 > 206.72.224.51.ssh: . 103772:105232(1460) ack 576 win 32120 (DF) [tos 0x8]
21:57:31.903063 206.72.224.51.ssh > 199.125.238.15.1023: . ack 96472 win 8760 (DF) [tos 0x8]
21:57:32.383045 206.72.224.51.ssh > 199.125.238.15.1023: . ack 96472 win 8760 (DF) [tos 0x8]
21:57:32.403067 199.125.238.15.1023 > 206.72.224.51.ssh: . 96472:97932(1460) ack 576 win 32120 (DF) [tos 0x8]
21:57:32.942967 206.72.224.51.ssh > 199.125.238.15.1023: . ack 96472 win 8760 (DF) [tos 0x8]
21:57:33.342964 206.72.224.51.ssh > 199.125.238.15.1023: . ack 96472 win 8760 (DF) [tos 0x8]
21:57:33.842881 206.72.224.51.ssh > 199.125.238.15.1023: . ack 96472 win 8760 (DF) [tos 0x8]
21:57:34.312880 206.72.224.51.ssh > 199.125.238.15.1023: . ack 105232 win 8760 (DF) [tos 0x8]
21:57:34.312965 199.125.238.15.1023 > 206.72.224.51.ssh: . 105232:106692(1460) ack 576 win 32120 (DF) [tos 0x8]
21:57:34.313452 199.125.238.15.1023 > 206.72.224.51.ssh: . 106692:108152(1460) ack 576 win 32120 (DF) [tos 0x8]
21:57:35.092801 206.72.224.51.ssh > 199.125.238.15.1023: . ack 106692 win 8760 (DF) [tos 0x8]
21:57:35.092869 199.125.238.15.1023 > 206.72.224.51.ssh: . 108152:109612(1460) ack 576 win 32120 (DF) [tos 0x8]
21:57:35.093346 199.125.238.15.1023 > 206.72.224.51.ssh: . 109612:111072(1460) ack 576 win 32120 (DF) [tos 0x8]
21:57:35.592798 206.72.224.51.ssh > 199.125.238.15.1023: . ack 108152 win 8760 (DF) [tos 0x8]
21:57:35.592866 199.125.238.15.1023 > 206.72.224.51.ssh: . 111072:112532(1460) ack 576 win 32120 (DF) [tos 0x8]
21:57:35.593338 199.125.238.15.1023 > 206.72.224.51.ssh: . 112532:113992(1460) ack 576 win 32120 (DF) [tos 0x8]
21:57:35.622964 199.125.238.15.ntp > 128.167.1.222.ntp: v3 client strat 2 poll 6 prec -17
21:57:36.052717 206.72.224.51.ssh > 199.125.238.15.1023: . ack 109612 win 8760 (DF) [tos 0x8]
21:57:36.052786 199.125.238.15.1023 > 206.72.224.51.ssh: . 113992:115452(1460) ack 576 win 32120 (DF) [tos 0x8]
21:57:36.053227 199.125.238.15.1023 > 206.72.224.51.ssh: . 115452:116912(1460) ack 576 win 32120 (DF) [tos 0x8]
21:57:36.552715 206.72.224.51.ssh > 199.125.238.15.1023: . ack 111072 win 8760 (DF) [tos 0x8]
21:57:36.552785 199.125.238.15.1023 > 206.72.224.51.ssh: . 116912:118372(1460) ack 576 win 32120 (DF) [tos 0x8]
21:57:37.042635 206.72.224.51.ssh > 199.125.238.15.1023: . ack 112532 win 8760 (DF) [tos 0x8]
21:57:37.042704 199.125.238.15.1023 > 206.72.224.51.ssh: . 118372:119832(1460) ack 576 win 32120 (DF) [tos 0x8]
21:57:37.412639 128.167.1.222.ntp > 199.125.238.15.ntp: v3 server strat 2 poll 6 prec -16 (DF)
21:57:37.492637 206.72.224.51.ssh > 199.125.238.15.1023: . ack 113992 win 8760 (DF) [tos 0x8]
21:57:37.492707 199.125.238.15.1023 > 206.72.224.51.ssh: . 119832:121292(1460) ack 576 win 32120 (DF) [tos 0x8]
21:57:38.002550 206.72.224.51.ssh > 199.125.238.15.1023: . ack 115452 win 8760 (DF) [tos 0x8]
21:57:38.002620 199.125.238.15.1023 > 206.72.224.51.ssh: . 121292:122752(1460) ack 576 win 32120 (DF) [tos 0x8]
21:57:38.502549 206.72.224.51.ssh > 199.125.238.15.1023: . ack 116912 win 8760 (DF) [tos 0x8]
21:57:38.502618 199.125.238.15.1023 > 206.72.224.51.ssh: . 122752:124212(1460) ack 576 win 32120 (DF) [tos 0x8]
21:57:38.992468 206.72.224.51.ssh > 199.125.238.15.1023: . ack 118372 win 8760 (DF) [tos 0x8]
21:57:38.992536 199.125.238.15.1023 > 206.72.224.51.ssh: . 124212:125672(1460) ack 576 win 32120 (DF) [tos 0x8]
21:57:38.992906 199.125.238.15.1023 > 206.72.224.51.ssh: . 125672:127132(1460) ack 576 win 32120 (DF) [tos 0x8]
21:57:39.126584 199.125.238.15.1023 > 206.72.224.51.ssh: . 125672:127132(1460) ack 576 win 32120 (DF) [tos 0x8]
21:57:39.452464 206.72.224.51.ssh > 199.125.238.15.1023: . ack 119832 win 8760 (DF) [tos 0x8]
21:57:39.452536 199.125.238.15.1023 > 206.72.224.51.ssh: . 127132:128592(1460) ack 576 win 32120 (DF) [tos 0x8]
21:57:39.628292 199.125.238.15.1023 > 206.72.224.51.ssh: . 127132:128592(1460) ack 576 win 32120 (DF) [tos 0x8]
21:57:39.942388 206.72.224.51.ssh > 199.125.238.15.1023: . ack 121292 win 8760 (DF) [tos 0x8]
21:57:39.942457 199.125.238.15.1023 > 206.72.224.51.ssh: . 128592:130052(1460) ack 576 win 32120 (DF) [tos 0x8]
21:57:40.045529 199.125.238.15.1023 > 206.72.224.51.ssh: . 128592:130052(1460) ack 576 win 32120 (DF) [tos 0x8]
21:57:40.492384 206.72.224.51.ssh > 199.125.238.15.1023: . ack 122752 win 8760 (DF) [tos 0x8]
21:57:40.492454 199.125.238.15.1023 > 206.72.224.51.ssh: . 130052:131512(1460) ack 576 win 32120 (DF) [tos 0x8]
21:57:40.538041 199.125.238.15.1023 > 206.72.224.51.ssh: . 130052:131512(1460) ack 576 win 32120 (DF) [tos 0x8]
21:57:40.902300 206.72.224.51.ssh > 199.125.238.15.1023: . ack 124212 win 8760 (DF) [tos 0x8]
21:57:40.902371 199.125.238.15.1023 > 206.72.224.51.ssh: . 131512:132972(1460) ack 576 win 32120 (DF) [tos 0x8]
21:57:41.041335 199.125.238.15.1023 > 206.72.224.51.ssh: . 131512:132972(1460) ack 576 win 32120 (DF) [tos 0x8]
21:57:41.392302 206.72.224.51.ssh > 199.125.238.15.1023: . ack 125672 win 8760 (DF) [tos 0x8]
21:57:41.392374 199.125.238.15.1023 > 206.72.224.51.ssh: . 132972:134432(1460) ack 576 win 32120 (DF) [tos 0x8]
21:57:41.532319 199.125.238.15.1023 > 206.72.224.51.ssh: . 132972:134432(1460) ack 576 win 32120 (DF) [tos 0x8]
21:57:41.892217 206.72.224.51.ssh > 199.125.238.15.1023: . ack 127132 win 8760 (DF) [tos 0x8]
21:57:41.892289 199.125.238.15.1023 > 206.72.224.51.ssh: . 134432:135892(1460) ack 576 win 32120 (DF) [tos 0x8]
21:57:42.029627 199.125.238.15.1023 > 206.72.224.51.ssh: . 134432:135892(1460) ack 576 win 32120 (DF) [tos 0x8]
21:57:42.352216 206.72.224.51.ssh > 199.125.238.15.1023: . ack 128592 win 8760 (DF) [tos 0x8]
21:57:42.352285 199.125.238.15.1023 > 206.72.224.51.ssh: . 135892:137352(1460) ack 576 win 32120 (DF) [tos 0x8]
21:57:42.534333 199.125.238.15.1023 > 206.72.224.51.ssh: . 135892:137352(1460) ack 576 win 32120 (DF) [tos 0x8]
21:57:42.842133 206.72.224.51.ssh > 199.125.238.15.1023: . ack 130052 win 8760 (DF) [tos 0x8]
21:57:42.842204 199.125.238.15.1023 > 206.72.224.51.ssh: . 137352:138812(1460) ack 576 win 32120 (DF) [tos 0x8]
21:57:42.940289 199.125.238.15.1023 > 206.72.224.51.ssh: . 137352:138812(1460) ack 576 win 32120 (DF) [tos 0x8]
21:57:43.342136 206.72.224.51.ssh > 199.125.238.15.1023: . ack 131512 win 8760 (DF) [tos 0x8]
21:57:43.342207 199.125.238.15.1023 > 206.72.224.51.ssh: . 138812:140272(1460) ack 576 win 32120 (DF) [tos 0x8]
21:57:43.442256 199.125.238.15.1023 > 206.72.224.51.ssh: . 138812:140272(1460) ack 576 win 32120 (DF) [tos 0x8]
21:57:43.962047 206.72.224.51.ssh > 199.125.238.15.1023: . ack 132972 win 8760 (DF) [tos 0x8]
21:57:43.962120 199.125.238.15.1023 > 206.72.224.51.ssh: . 140272:141732(1460) ack 576 win 32120 (DF) [tos 0x8]
21:57:44.302052 206.72.224.51.ssh > 199.125.238.15.1023: . ack 134432 win 8760 (DF) [tos 0x8]
21:57:44.302124 199.125.238.15.1023 > 206.72.224.51.ssh: . 141732:143192(1460) ack 576 win 32120 (DF) [tos 0x8]
21:57:44.439622 199.125.238.15.1023 > 206.72.224.51.ssh: . 141732:143192(1460) ack 576 win 32120 (DF) [tos 0x8]
21:57:44.831962 206.72.224.51.ssh > 199.125.238.15.1023: . ack 135892 win 8760 (DF) [tos 0x8]
21:57:44.832034 199.125.238.15.1023 > 206.72.224.51.ssh: . 143192:144652(1460) ack 576 win 32120 (DF) [tos 0x8]
21:57:44.937586 199.125.238.15.1023 > 206.72.224.51.ssh: . 143192:144652(1460) ack 576 win 32120 (DF) [tos 0x8]
21:57:45.251967 206.72.224.51.ssh > 199.125.238.15.1023: . ack 137352 win 8760 (DF) [tos 0x8]
21:57:45.252037 199.125.238.15.1023 > 206.72.224.51.ssh: . 144652:146112(1460) ack 576 win 32120 (DF) [tos 0x8]
21:57:45.431302 199.125.238.15.1023 > 206.72.224.51.ssh: . 144652:146112(1460) ack 576 win 32120 (DF) [tos 0x8]
21:57:45.751899 206.72.224.51.ssh > 199.125.238.15.1023: . ack 138812 win 8760 (DF) [tos 0x8]
21:57:45.751970 199.125.238.15.1023 > 206.72.224.51.ssh: . 146112:147572(1460) ack 576 win 32120 (DF) [tos 0x8]
21:57:45.844654 199.125.238.15.1023 > 206.72.224.51.ssh: . 146112:147572(1460) ack 576 win 32120 (DF) [tos 0x8]
21:57:46.241883 206.72.224.51.ssh > 199.125.238.15.1023: . ack 140272 win 8760 (DF) [tos 0x8]
21:57:46.241954 199.125.238.15.1023 > 206.72.224.51.ssh: . 147572:149032(1460) ack 576 win 32120 (DF) [tos 0x8]
21:57:46.346580 199.125.238.15.1023 > 206.72.224.51.ssh: . 147572:149032(1460) ack 576 win 32120 (DF) [tos 0x8]
21:57:46.691851 206.72.224.51.ssh > 199.125.238.15.1023: . ack 141732 win 8760 (DF) [tos 0x8]
21:57:46.691921 199.125.238.15.1023 > 206.72.224.51.ssh: . 149032:150492(1460) ack 576 win 32120 (DF) [tos 0x8]
21:57:46.842980 199.125.238.15.1023 > 206.72.224.51.ssh: . 149032:150492(1460) ack 576 win 32120 (DF) [tos 0x8]
21:57:47.201798 206.72.224.51.ssh > 199.125.238.15.1023: . ack 143192 win 8760 (DF) [tos 0x8]
21:57:47.201870 199.125.238.15.1023 > 206.72.224.51.ssh: . 150492:151952(1460) ack 576 win 32120 (DF) [tos 0x8]
21:57:47.338931 199.125.238.15.1023 > 206.72.224.51.ssh: . 150492:151952(1460) ack 576 win 32120 (DF) [tos 0x8]
21:57:47.681766 206.72.224.51.ssh > 199.125.238.15.1023: . ack 144652 win 8760 (DF) [tos 0x8]
21:57:47.681838 199.125.238.15.1023 > 206.72.224.51.ssh: . 151952:153412(1460) ack 576 win 32120 (DF) [tos 0x8]
21:57:47.837283 199.125.238.15.1023 > 206.72.224.51.ssh: . 151952:153412(1460) ack 576 win 32120 (DF) [tos 0x8]
21:57:48.201718 206.72.224.51.ssh > 199.125.238.15.1023: . ack 146112 win 8760 (DF) [tos 0x8]
21:57:48.201790 199.125.238.15.1023 > 206.72.224.51.ssh: . 153412:154872(1460) ack 576 win 32120 (DF) [tos 0x8]
21:57:48.333313 199.125.238.15.1023 > 206.72.224.51.ssh: . 153412:154872(1460) ack 576 win 32120 (DF) [tos 0x8]
21:57:48.641710 206.72.224.51.ssh > 199.125.238.15.1023: . ack 147572 win 8760 (DF) [tos 0x8]
21:57:48.641781 199.125.238.15.1023 > 206.72.224.51.ssh: . 154872:156332(1460) ack 576 win 32120 (DF) [tos 0x8]
21:57:48.748667 199.125.238.15.1023 > 206.72.224.51.ssh: . 154872:156332(1460) ack 576 win 32120 (DF) [tos 0x8]
21:57:49.151632 206.72.224.51.ssh > 199.125.238.15.1023: . ack 149032 win 8760 (DF) [tos 0x8]
21:57:49.151706 199.125.238.15.1023 > 206.72.224.51.ssh: . 156332:157792(1460) ack 576 win 32120 (DF) [tos 0x8]
21:57:49.249013 199.125.238.15.1023 > 206.72.224.51.ssh: . 156332:157792(1460) ack 576 win 32120 (DF) [tos 0x8]
21:57:49.621635 206.72.224.51.ssh > 199.125.238.15.1023: . ack 150492 win 8760 (DF) [tos 0x8]
21:57:49.621706 199.125.238.15.1023 > 206.72.224.51.ssh: . 157792:159252(1460) ack 576 win 32120 (DF) [tos 0x8]
21:57:49.754614 199.125.238.15.1023 > 206.72.224.51.ssh: . 157792:159252(1460) ack 576 win 32120 (DF) [tos 0x8]
21:57:50.121548 206.72.224.51.ssh > 199.125.238.15.1023: . ack 151952 win 8760 (DF) [tos 0x8]
21:57:50.121617 199.125.238.15.1023 > 206.72.224.51.ssh: . 159252:160712(1460) ack 576 win 32120 (DF) [tos 0x8]
21:57:50.244687 199.125.238.15.1023 > 206.72.224.51.ssh: . 159252:160712(1460) ack 576 win 32120 (DF) [tos 0x8]
21:57:50.601547 206.72.224.51.ssh > 199.125.238.15.1023: . ack 153412 win 8760 (DF) [tos 0x8]
21:57:50.601615 199.125.238.15.1023 > 206.72.224.51.ssh: . 160712:162172(1460) ack 576 win 32120 (DF) [tos 0x8]
21:57:50.747283 199.125.238.15.1023 > 206.72.224.51.ssh: . 160712:162172(1460) ack 576 win 32120 (DF) [tos 0x8]
21:57:51.071464 206.72.224.51.ssh > 199.125.238.15.1023: . ack 154872 win 8760 (DF) [tos 0x8]
21:57:51.071537 199.125.238.15.1023 > 206.72.224.51.ssh: . 162172:163632(1460) ack 576 win 32120 (DF) [tos 0x8]
21:57:51.242950 199.125.238.15.1023 > 206.72.224.51.ssh: . 162172:163632(1460) ack 576 win 32120 (DF) [tos 0x8]
21:57:51.561484 206.72.224.51.ssh > 199.125.238.15.1023: . ack 156332 win 8760 (DF) [tos 0x8]
21:57:51.561696 199.125.238.15.1023 > 206.72.224.51.ssh: . 163632:165092(1460) ack 576 win 32120 (DF) [tos 0x8]
21:57:51.655215 199.125.238.15.1023 > 206.72.224.51.ssh: . 163632:165092(1460) ack 576 win 32120 (DF) [tos 0x8]
21:57:52.061396 206.72.224.51.ssh > 199.125.238.15.1023: . ack 157792 win 8760 (DF) [tos 0x8]
21:57:52.061469 199.125.238.15.1023 > 206.72.224.51.ssh: . 165092:166552(1460) ack 576 win 32120 (DF) [tos 0x8]
21:57:52.158367 199.125.238.15.1023 > 206.72.224.51.ssh: . 165092:166552(1460) ack 576 win 32120 (DF) [tos 0x8]
21:57:52.581381 206.72.224.51.ssh > 199.125.238.15.1023: . ack 159252 win 8760 (DF) [tos 0x8]
21:57:52.581454 199.125.238.15.1023 > 206.72.224.51.ssh: . 166552:168012(1460) ack 576 win 32120 (DF) [tos 0x8]
21:57:52.655937 199.125.238.15.ntp > 204.70.131.13.ntp: v3 client strat 2 poll 6 prec -17
21:57:52.655967 199.125.238.15.1023 > 206.72.224.51.ssh: . 166552:168012(1460) ack 576 win 32120 (DF) [tos 0x8]
21:57:52.735271 199.125.238.15.1023 > 206.72.224.51.ssh: . 166552:168012(1460) ack 576 win 32120 (DF) [tos 0x8]
21:57:53.021296 206.72.224.51.ssh > 199.125.238.15.1023: . ack 160712 win 8760 (DF) [tos 0x8]
21:57:53.021368 199.125.238.15.1023 > 206.72.224.51.ssh: . 168012:169472(1460) ack 576 win 32120 (DF) [tos 0x8]
21:57:53.148353 199.125.238.15.1023 > 206.72.224.51.ssh: . 168012:169472(1460) ack 576 win 32120 (DF) [tos 0x8]
21:57:53.511297 206.72.224.51.ssh > 199.125.238.15.1023: . ack 162172 win 8760 (DF) [tos 0x8]
21:57:53.511367 199.125.238.15.1023 > 206.72.224.51.ssh: . 169472:170932(1460) ack 576 win 32120 (DF) [tos 0x8]
21:57:53.646721 199.125.238.15.1023 > 206.72.224.51.ssh: . 169472:170932(1460) ack 576 win 32120 (DF) [tos 0x8]
21:57:54.011213 206.72.224.51.ssh > 199.125.238.15.1023: . ack 163632 win 8760 (DF) [tos 0x8]
21:57:54.011283 199.125.238.15.1023 > 206.72.224.51.ssh: . 170932:172392(1460) ack 576 win 32120 (DF) [tos 0x8]
21:57:54.149999 199.125.238.15.1023 > 206.72.224.51.ssh: . 170932:172392(1460) ack 576 win 32120 (DF) [tos 0x8]
21:57:54.461215 206.72.224.51.ssh > 199.125.238.15.1023: . ack 165092 win 8760 (DF) [tos 0x8]
21:57:54.461283 199.125.238.15.1023 > 206.72.224.51.ssh: . 172392:173852(1460) ack 576 win 32120 (DF) [tos 0x8]
21:57:54.644057 199.125.238.15.1023 > 206.72.224.51.ssh: . 172392:173852(1460) ack 576 win 32120 (DF) [tos 0x8]
21:57:54.851126 204.70.131.13.ntp > 199.125.238.15.ntp: v3 server strat 1 poll 6 prec -17
21:57:54.961134 206.72.224.51.ssh > 199.125.238.15.1023: . ack 166552 win 8760 (DF) [tos 0x8]
21:57:54.961204 199.125.238.15.1023 > 206.72.224.51.ssh: . 173852:175312(1460) ack 576 win 32120 (DF) [tos 0x8]
21:57:55.098002 199.125.238.15.1023 > 206.72.224.51.ssh: . 173852:175312(1460) ack 576 win 32120 (DF) [tos 0x8]
21:57:55.471129 206.72.224.51.ssh > 199.125.238.15.1023: . ack 168012 win 8760 (DF) [tos 0x8]
21:57:55.471199 199.125.238.15.1023 > 206.72.224.51.ssh: . 175312:176772(1460) ack 576 win 32120 (DF) [tos 0x8]
21:57:55.598043 199.125.238.15.1023 > 206.72.224.51.ssh: . 175312:176772(1460) ack 576 win 32120 (DF) [tos 0x8]
21:57:55.921047 206.72.224.51.ssh > 199.125.238.15.1023: . ack 169472 win 8760 (DF) [tos 0x8]
21:57:55.921116 199.125.238.15.1023 > 206.72.224.51.ssh: . 176772:178232(1460) ack 576 win 32120 (DF) [tos 0x8]
21:57:56.095642 199.125.238.15.1023 > 206.72.224.51.ssh: . 176772:178232(1460) ack 576 win 32120 (DF) [tos 0x8]
21:57:56.411059 206.72.224.51.ssh > 199.125.238.15.1023: . ack 170932 win 8760 (DF) [tos 0x8]
21:57:56.411137 199.125.238.15.1023 > 206.72.224.51.ssh: . 178232:179692(1460) ack 576 win 32120 (DF) [tos 0x8]
21:57:56.510676 199.125.238.15.1023 > 206.72.224.51.ssh: . 178232:179692(1460) ack 576 win 32120 (DF) [tos 0x8]
21:57:56.920962 206.72.224.51.ssh > 199.125.238.15.1023: . ack 172392 win 8760 (DF) [tos 0x8]
21:57:56.921033 199.125.238.15.1023 > 206.72.224.51.ssh: . 179692:181152(1460) ack 576 win 32120 (DF) [tos 0x8]
21:57:57.008589 199.125.238.15.1023 > 206.72.224.51.ssh: . 179692:181152(1460) ack 576 win 32120 (DF) [tos 0x8]
21:57:57.370964 206.72.224.51.ssh > 199.125.238.15.1023: . ack 173852 win 8760 (DF) [tos 0x8]
21:57:57.371035 199.125.238.15.1023 > 206.72.224.51.ssh: . 181152:182612(1460) ack 576 win 32120 (DF) [tos 0x8]
21:57:57.512639 199.125.238.15.1023 > 206.72.224.51.ssh: . 181152:182612(1460) ack 576 win 32120 (DF) [tos 0x8]
21:57:57.870877 206.72.224.51.ssh > 199.125.238.15.1023: . ack 175312 win 8760 (DF) [tos 0x8]
21:57:57.870950 199.125.238.15.1023 > 206.72.224.51.ssh: . 182612:184072(1460) ack 576 win 32120 (DF) [tos 0x8]
21:57:58.005074 199.125.238.15.1023 > 206.72.224.51.ssh: . 182612:184072(1460) ack 576 win 32120 (DF) [tos 0x8]
21:57:58.360876 206.72.224.51.ssh > 199.125.238.15.1023: . ack 176772 win 8760 (DF) [tos 0x8]
21:57:58.360946 199.125.238.15.1023 > 206.72.224.51.ssh: . 184072:185532(1460) ack 576 win 32120 (DF) [tos 0x8]
21:57:58.502644 199.125.238.15.1023 > 206.72.224.51.ssh: . 184072:185532(1460) ack 576 win 32120 (DF) [tos 0x8]
21:57:58.950796 206.72.224.51.ssh > 199.125.238.15.1023: . ack 178232 win 8760 (DF) [tos 0x8]
21:57:58.950865 199.125.238.15.1023 > 206.72.224.51.ssh: . 185532:186992(1460) ack 576 win 32120 (DF) [tos 0x8]
21:57:58.999317 199.125.238.15.1023 > 206.72.224.51.ssh: . 185532:186992(1460) ack 576 win 32120 (DF) [tos 0x8]
21:57:59.320792 206.72.224.51.ssh > 199.125.238.15.1023: . ack 179692 win 8760 (DF) [tos 0x8]
21:57:59.320860 199.125.238.15.1023 > 206.72.224.51.ssh: . 186992:188452(1460) ack 576 win 32120 (DF) [tos 0x8]
21:57:59.414311 199.125.238.15.1023 > 206.72.224.51.ssh: . 186992:188452(1460) ack 576 win 32120 (DF) [tos 0x8]
21:57:59.780711 206.72.224.51.ssh > 199.125.238.15.1023: . ack 181152 win 8760 (DF) [tos 0x8]
21:57:59.780780 199.125.238.15.1023 > 206.72.224.51.ssh: . 188452:189912(1460) ack 576 win 32120 (DF) [tos 0x8]
21:57:59.916273 199.125.238.15.1023 > 206.72.224.51.ssh: . 188452:189912(1460) ack 576 win 32120 (DF) [tos 0x8]
21:58:00.280708 206.72.224.51.ssh > 199.125.238.15.1023: . ack 182612 win 8760 (DF) [tos 0x8]
21:58:00.280777 199.125.238.15.1023 > 206.72.224.51.ssh: . 189912:191372(1460) ack 576 win 32120 (DF) [tos 0x8]
21:58:00.409690 199.125.238.15.1023 > 206.72.224.51.ssh: . 189912:191372(1460) ack 576 win 32120 (DF) [tos 0x8]
21:58:00.780626 206.72.224.51.ssh > 199.125.238.15.1023: . ack 184072 win 8760 (DF) [tos 0x8]
21:58:00.780699 199.125.238.15.1023 > 206.72.224.51.ssh: . 191372:192832(1460) ack 576 win 32120 (DF) [tos 0x8]
21:58:00.907735 199.125.238.15.1023 > 206.72.224.51.ssh: . 191372:192832(1460) ack 576 win 32120 (DF) [tos 0x8]
21:58:01.270624 206.72.224.51.ssh > 199.125.238.15.1023: . ack 185532 win 8760 (DF) [tos 0x8]
21:58:01.270692 199.125.238.15.1023 > 206.72.224.51.ssh: . 192832:194292(1460) ack 576 win 32120 (DF) [tos 0x8]
21:58:01.405136 199.125.238.15.1023 > 206.72.224.51.ssh: . 192832:194292(1460) ack 576 win 32120 (DF) [tos 0x8]
21:58:01.730570 206.72.224.51.ssh > 199.125.238.15.1023: . ack 186992 win 8760 (DF) [tos 0x8]
21:58:01.730639 199.125.238.15.1023 > 206.72.224.51.ssh: . 194292:195752(1460) ack 576 win 32120 (DF) [tos 0x8]
21:58:01.911674 199.125.238.15.1023 > 206.72.224.51.ssh: . 194292:195752(1460) ack 576 win 32120 (DF) [tos 0x8]
21:58:02.230539 206.72.224.51.ssh > 199.125.238.15.1023: . ack 188452 win 8760 (DF) [tos 0x8]
21:58:02.230608 199.125.238.15.1023 > 206.72.224.51.ssh: . 195752:197212(1460) ack 576 win 32120 (DF) [tos 0x8]
21:58:02.323718 199.125.238.15.1023 > 206.72.224.51.ssh: . 195752:197212(1460) ack 576 win 32120 (DF) [tos 0x8]
21:58:02.700500 206.72.224.51.ssh > 199.125.238.15.1023: . ack 189912 win 8760 (DF) [tos 0x8]
21:58:02.700571 199.125.238.15.1023 > 206.72.224.51.ssh: . 197212:198672(1460) ack 576 win 32120 (DF) [tos 0x8]
21:58:02.815762 199.125.238.15.1023 > 206.72.224.51.ssh: . 197212:198672(1460) ack 576 win 32120 (DF) [tos 0x8]
21:58:03.250459 206.72.224.51.ssh > 199.125.238.15.1023: . ack 191372 win 8760 (DF) [tos 0x8]
21:58:03.250531 199.125.238.15.1023 > 206.72.224.51.ssh: . 198672:200132(1460) ack 576 win 32120 (DF) [tos 0x8]
21:58:03.318078 199.125.238.15.1023 > 206.72.224.51.ssh: . 198672:200132(1460) ack 576 win 32120 (DF) [tos 0x8]
21:58:03.670430 206.72.224.51.ssh > 199.125.238.15.1023: . ack 192832 win 8760 (DF) [tos 0x8]
21:58:03.670502 199.125.238.15.1023 > 206.72.224.51.ssh: . 200132:201592(1460) ack 576 win 32120 (DF) [tos 0x8]
21:58:03.810164 199.125.238.15.1023 > 206.72.224.51.ssh: . 200132:201592(1460) ack 576 win 32120 (DF) [tos 0x8]
21:58:04.130372 206.72.224.51.ssh > 199.125.238.15.1023: . ack 194292 win 8760 (DF) [tos 0x8]
21:58:04.130441 199.125.238.15.1023 > 206.72.224.51.ssh: . 201592:203052(1460) ack 576 win 32120 (DF) [tos 0x8]
21:58:04.312746 199.125.238.15.1023 > 206.72.224.51.ssh: . 201592:203052(1460) ack 576 win 32120 (DF) [tos 0x8]
21:58:04.630371 206.72.224.51.ssh > 199.125.238.15.1023: . ack 195752 win 8760 (DF) [tos 0x8]
21:58:04.630441 199.125.238.15.1023 > 206.72.224.51.ssh: . 203052:204512(1460) ack 576 win 32120 (DF) [tos 0x8]
21:58:04.722107 199.125.238.15.1023 > 206.72.224.51.ssh: . 203052:204512(1460) ack 576 win 32120 (DF) [tos 0x8]
21:58:05.130305 206.72.224.51.ssh > 199.125.238.15.1023: . ack 197212 win 8760 (DF) [tos 0x8]
21:58:05.590290 206.72.224.51.ssh > 199.125.238.15.1023: . ack 198672 win 8760 (DF) [tos 0x8]
21:58:06.080202 206.72.224.51.ssh > 199.125.238.15.1023: . ack 200132 win 8760 (DF) [tos 0x8]
21:58:06.580201 206.72.224.51.ssh > 199.125.238.15.1023: . ack 201592 win 8760 (DF) [tos 0x8]
21:58:07.030121 206.72.224.51.ssh > 199.125.238.15.1023: . ack 203052 win 8760 (DF) [tos 0x8]
21:58:07.590120 206.72.224.51.ssh > 199.125.238.15.1023: . ack 204512 win 8760 (DF) [tos 0x8]
21:58:07.590188 199.125.238.15.1023 > 206.72.224.51.ssh: P 204512:204912(400) ack 576 win 32120 (DF) [tos 0x8]
21:58:08.050095 206.72.224.51.ssh > 199.125.238.15.1023: P 576:636(60) ack 204912 win 8760 (DF) [tos 0x8]
21:58:08.053771 199.125.238.15.1023 > 206.72.224.51.ssh: P 204912:204924(12) ack 636 win 32120 (DF) [tos 0x8]
21:58:08.330039 206.72.224.51.ssh > 199.125.238.15.1023: P 636:656(20) ack 204924 win 8760 (DF) [tos 0x8]
21:58:08.330579 199.125.238.15.1023 > 206.72.224.51.ssh: P 204924:204944(20) ack 656 win 32120 (DF) [tos 0x8]
21:58:08.540042 206.72.224.51.ssh > 199.125.238.15.1023: F 656:656(0) ack 204944 win 8760 (DF) [tos 0x8]
21:58:08.540136 199.125.238.15.1023 > 206.72.224.51.ssh: . ack 657 win 32119 (DF) [tos 0x8]
21:58:08.540254 199.125.238.15.1023 > 206.72.224.51.ssh: F 204944:204944(0) ack 657 win 32119 (DF) [tos 0x8]
21:58:08.710026 206.72.224.51.ssh > 199.125.238.15.1023: . ack 204945 win 8760 (DF) [tos 0x8]
21:58:08.720028 206.72.224.51.ssh > 199.125.238.15.1023: . ack 204945 win 8760 (DF) [tos 0x8]
21:58:39.617539 199.125.238.15.ntp > 128.167.1.222.ntp: v3 client strat 2 poll 6 prec -17
21:58:39.787377 128.167.1.222.ntp > 199.125.238.15.ntp: v3 server strat 2 poll 6 prec -16 (DF)
21:58:56.616095 199.125.238.15.ntp > 204.70.131.13.ntp: v3 client strat 2 poll 6 prec -17
21:58:56.765954 204.70.131.13.ntp > 199.125.238.15.ntp: v3 server strat 1 poll 6 prec -17
21:59:16.614470 199.125.238.15.ntp > 128.167.1.222.ntp: v3 client strat 2 poll 7 prec -17
21:59:16.804298 128.167.1.222.ntp > 199.125.238.15.ntp: v3 server strat 2 poll 7 prec -16 (DF)
507 packets received by filter
0 packets dropped by kernel
#
# Automatically generated make config: don't edit
#
#
# Code maturity level options
#
# CONFIG_EXPERIMENTAL is not set
#
# Processor type and features
#
# CONFIG_M386 is not set
# CONFIG_M486 is not set
# CONFIG_M586 is not set
CONFIG_M586TSC=y
# CONFIG_M686 is not set
CONFIG_X86_WP_WORKS_OK=y
CONFIG_X86_INVLPG=y
CONFIG_X86_BSWAP=y
CONFIG_X86_POPAD_OK=y
CONFIG_X86_TSC=y
# CONFIG_MATH_EMULATION is not set
# CONFIG_MTRR is not set
# CONFIG_SMP is not set
#
# Loadable module support
#
CONFIG_MODULES=y
# CONFIG_MODVERSIONS is not set
CONFIG_KMOD=y
#
# General setup
#
CONFIG_NET=y
CONFIG_PCI=y
# CONFIG_PCI_GOBIOS is not set
# CONFIG_PCI_GODIRECT is not set
CONFIG_PCI_GOANY=y
CONFIG_PCI_BIOS=y
CONFIG_PCI_DIRECT=y
CONFIG_PCI_QUIRKS=y
CONFIG_PCI_OLD_PROC=y
# CONFIG_MCA is not set
CONFIG_SYSVIPC=y
# CONFIG_BSD_PROCESS_ACCT is not set
CONFIG_SYSCTL=y
CONFIG_BINFMT_AOUT=y
CONFIG_BINFMT_ELF=y
CONFIG_BINFMT_MISC=y
CONFIG_PARPORT=m
CONFIG_PARPORT_PC=m
# CONFIG_PARPORT_OTHER is not set
# CONFIG_APM is not set
#
# Plug and Play support
#
# CONFIG_PNP is not set
#
# Block devices
#
CONFIG_BLK_DEV_FD=y
# CONFIG_BLK_DEV_IDE is not set
#
# Please see Documentation/ide.txt for help/info on IDE drives
#
# CONFIG_BLK_DEV_HD_ONLY is not set
#
# Additional Block Devices
#
# CONFIG_BLK_DEV_LOOP is not set
# CONFIG_BLK_DEV_NBD is not set
# CONFIG_BLK_DEV_MD is not set
# CONFIG_BLK_DEV_RAM is not set
# CONFIG_BLK_DEV_XD is not set
CONFIG_PARIDE_PARPORT=m
# CONFIG_PARIDE is not set
# CONFIG_BLK_DEV_HD is not set
#
# Networking options
#
CONFIG_PACKET=y
# CONFIG_NETLINK is not set
# CONFIG_FIREWALL is not set
# CONFIG_NET_ALIAS is not set
# CONFIG_FILTER is not set
CONFIG_UNIX=y
CONFIG_INET=y
# CONFIG_IP_MULTICAST is not set
# CONFIG_IP_ADVANCED_ROUTER is not set
# CONFIG_IP_PNP is not set
# CONFIG_IP_ROUTER is not set
# CONFIG_NET_IPIP is not set
# CONFIG_NET_IPGRE is not set
# CONFIG_IP_ALIAS is not set
# CONFIG_SYN_COOKIES is not set
#
# (it is safe to leave these untouched)
#
# CONFIG_INET_RARP is not set
CONFIG_IP_NOSR=y
CONFIG_SKB_LARGE=y
#
#  
#
# CONFIG_IPX is not set
# CONFIG_ATALK is not set
#
# SCSI support
#
CONFIG_SCSI=y
#
# SCSI support type (disk, tape, CD-ROM)
#
CONFIG_BLK_DEV_SD=y
CONFIG_CHR_DEV_ST=m
CONFIG_BLK_DEV_SR=m
CONFIG_BLK_DEV_SR_VENDOR=y
CONFIG_CHR_DEV_SG=m
#
# Some SCSI devices (e.g. CD jukebox) support multiple LUNs
#
CONFIG_SCSI_MULTI_LUN=y
CONFIG_SCSI_CONSTANTS=y
# CONFIG_SCSI_LOGGING is not set
#
# SCSI low-level drivers
#
# CONFIG_SCSI_7000FASST is not set
# CONFIG_SCSI_ACARD is not set
# CONFIG_SCSI_AHA152X is not set
# CONFIG_SCSI_AHA1542 is not set
# CONFIG_SCSI_AHA1740 is not set
# CONFIG_SCSI_AIC7XXX is not set
# CONFIG_SCSI_ADVANSYS is not set
# CONFIG_SCSI_IN2000 is not set
# CONFIG_SCSI_AM53C974 is not set
# CONFIG_SCSI_MEGARAID is not set
CONFIG_SCSI_BUSLOGIC=y
# CONFIG_SCSI_OMIT_FLASHPOINT is not set
# CONFIG_SCSI_DTC3280 is not set
# CONFIG_SCSI_EATA is not set
# CONFIG_SCSI_EATA_DMA is not set
# CONFIG_SCSI_EATA_PIO is not set
# CONFIG_SCSI_FUTURE_DOMAIN is not set
# CONFIG_SCSI_GDTH is not set
# CONFIG_SCSI_GENERIC_NCR5380 is not set
# CONFIG_SCSI_G_NCR5380_PORT is not set
# CONFIG_SCSI_G_NCR5380_MEM is not set
# CONFIG_SCSI_INITIO is not set
# CONFIG_SCSI_PPA is not set
# CONFIG_SCSI_IMM is not set
# CONFIG_SCSI_NCR53C406A is not set
# CONFIG_SCSI_NCR53C7xx is not set
# CONFIG_SCSI_NCR53C8XX is not set
# CONFIG_SCSI_PAS16 is not set
# CONFIG_SCSI_PCI2000 is not set
# CONFIG_SCSI_PCI2220I is not set
# CONFIG_SCSI_PSI240I is not set
# CONFIG_SCSI_QLOGIC_FAS is not set
# CONFIG_SCSI_QLOGIC_ISP is not set
# CONFIG_SCSI_SEAGATE is not set
# CONFIG_SCSI_DC390T is not set
# CONFIG_SCSI_T128 is not set
# CONFIG_SCSI_U14_34F is not set
# CONFIG_SCSI_ULTRASTOR is not set
#
# Network device support
#
CONFIG_NETDEVICES=y
# CONFIG_ARCNET is not set
CONFIG_DUMMY=m
# CONFIG_EQUALIZER is not set
CONFIG_NET_ETHERNET=y
# CONFIG_NET_VENDOR_3COM is not set
# CONFIG_LANCE is not set
# CONFIG_NET_VENDOR_SMC is not set
# CONFIG_NET_VENDOR_RACAL is not set
# CONFIG_NET_ISA is not set
CONFIG_NET_EISA=y
# CONFIG_PCNET32 is not set
# CONFIG_APRICOT is not set
# CONFIG_CS89x0 is not set
# CONFIG_DE4X5 is not set
CONFIG_DEC_ELCP=m
# CONFIG_DGRS is not set
# CONFIG_EEXPRESS_PRO100 is not set
# CONFIG_NE2K_PCI is not set
# CONFIG_TLAN is not set
# CONFIG_VIA_RHINE is not set
# CONFIG_NET_POCKET is not set
# CONFIG_FDDI is not set
# CONFIG_DLCI is not set
# CONFIG_PLIP is not set
CONFIG_PPP=m
#
# CCP compressors for PPP are only built as modules.
#
# CONFIG_SLIP is not set
# CONFIG_NET_RADIO is not set
# CONFIG_TR is not set
# CONFIG_HOSTESS_SV11 is not set
# CONFIG_COSA is not set
# CONFIG_RCPCI is not set
# CONFIG_WAN_DRIVERS is not set
#
# Amateur Radio support
#
# CONFIG_HAMRADIO is not set
#
# ISDN subsystem
#
# CONFIG_ISDN is not set
#
# CD-ROM drivers (not for SCSI or IDE/ATAPI drives)
#
# CONFIG_CD_NO_IDESCSI is not set
#
# Character devices
#
CONFIG_VT=y
CONFIG_VT_CONSOLE=y
CONFIG_SERIAL=m
# CONFIG_SERIAL_EXTENDED is not set
# CONFIG_SERIAL_NONSTANDARD is not set
CONFIG_UNIX98_PTYS=y
CONFIG_UNIX98_PTY_COUNT=256
CONFIG_PRINTER=m
CONFIG_PRINTER_READBACK=y
# CONFIG_MOUSE is not set
# CONFIG_QIC02_TAPE is not set
# CONFIG_WATCHDOG is not set
# CONFIG_NVRAM is not set
# CONFIG_RTC is not set
#
# Video For Linux
#
# CONFIG_VIDEO_DEV is not set
#
# Joystick support
#
# CONFIG_JOYSTICK is not set
#
# Ftape, the floppy tape device driver
#
# CONFIG_FTAPE is not set
# CONFIG_FT_NORMAL_DEBUG is not set
# CONFIG_FT_FULL_DEBUG is not set
# CONFIG_FT_NO_TRACE is not set
# CONFIG_FT_NO_TRACE_AT_ALL is not set
# CONFIG_FT_STD_FDC is not set
# CONFIG_FT_MACH2 is not set
# CONFIG_FT_PROBE_FC10 is not set
# CONFIG_FT_ALT_FDC is not set
#
# Filesystems
#
# CONFIG_QUOTA is not set
# CONFIG_AUTOFS_FS is not set
# CONFIG_AFFS_FS is not set
# CONFIG_HFS_FS is not set
CONFIG_FAT_FS=m
CONFIG_MSDOS_FS=m
# CONFIG_UMSDOS_FS is not set
CONFIG_VFAT_FS=m
CONFIG_ISO9660_FS=m
# CONFIG_JOLIET is not set
# CONFIG_MINIX_FS is not set
# CONFIG_NTFS_FS is not set
# CONFIG_HPFS_FS is not set
CONFIG_PROC_FS=y
CONFIG_DEVPTS_FS=y
# CONFIG_ROMFS_FS is not set
CONFIG_EXT2_FS=y
# CONFIG_SYSV_FS is not set
# CONFIG_UFS_FS is not set
#
# Network File Systems
#
# CONFIG_CODA_FS is not set
CONFIG_NFS_FS=y
# CONFIG_NFSD_SUN is not set
CONFIG_SUNRPC=y
CONFIG_LOCKD=y
# CONFIG_SMB_FS is not set
# CONFIG_NCP_FS is not set
#
# Partition Types
#
# CONFIG_BSD_DISKLABEL is not set
# CONFIG_MAC_PARTITION is not set
# CONFIG_SMD_DISKLABEL is not set
# CONFIG_SOLARIS_X86_PARTITION is not set
CONFIG_NLS=y
#
# Native Language Support
#
CONFIG_NLS_CODEPAGE_437=m
# CONFIG_NLS_CODEPAGE_737 is not set
# CONFIG_NLS_CODEPAGE_775 is not set
# CONFIG_NLS_CODEPAGE_850 is not set
# CONFIG_NLS_CODEPAGE_852 is not set
# CONFIG_NLS_CODEPAGE_855 is not set
# CONFIG_NLS_CODEPAGE_857 is not set
# CONFIG_NLS_CODEPAGE_860 is not set
# CONFIG_NLS_CODEPAGE_861 is not set
# CONFIG_NLS_CODEPAGE_862 is not set
# CONFIG_NLS_CODEPAGE_863 is not set
# CONFIG_NLS_CODEPAGE_864 is not set
# CONFIG_NLS_CODEPAGE_865 is not set
# CONFIG_NLS_CODEPAGE_866 is not set
# CONFIG_NLS_CODEPAGE_869 is not set
# CONFIG_NLS_CODEPAGE_874 is not set
CONFIG_NLS_ISO8859_1=m
# CONFIG_NLS_ISO8859_2 is not set
# CONFIG_NLS_ISO8859_3 is not set
# CONFIG_NLS_ISO8859_4 is not set
# CONFIG_NLS_ISO8859_5 is not set
# CONFIG_NLS_ISO8859_6 is not set
# CONFIG_NLS_ISO8859_7 is not set
# CONFIG_NLS_ISO8859_8 is not set
# CONFIG_NLS_ISO8859_9 is not set
# CONFIG_NLS_ISO8859_15 is not set
# CONFIG_NLS_KOI8_R is not set
#
# Console drivers
#
CONFIG_VGA_CONSOLE=y
# CONFIG_VIDEO_SELECT is not set
#
# Sound
#
CONFIG_SOUND=m
# CONFIG_SOUND_ES1370 is not set
# CONFIG_SOUND_ES1371 is not set
# CONFIG_SOUND_SONICVIBES is not set
# CONFIG_SOUND_MSNDCLAS is not set
# CONFIG_SOUND_MSNDPIN is not set
CONFIG_SOUND_OSS=m
# CONFIG_SOUND_PAS is not set
CONFIG_SOUND_SB=m
# CONFIG_SOUND_ADLIB is not set
# CONFIG_SOUND_GUS is not set
# CONFIG_SOUND_MPU401 is not set
# CONFIG_SOUND_PSS is not set
# CONFIG_SOUND_MSS is not set
# CONFIG_SOUND_SSCAPE is not set
# CONFIG_SOUND_TRIX is not set
# CONFIG_SOUND_MAD16 is not set
# CONFIG_SOUND_WAVEFRONT is not set
# CONFIG_SOUND_CS4232 is not set
# CONFIG_SOUND_OPL3SA2 is not set
# CONFIG_SOUND_MAUI is not set
# CONFIG_SOUND_SGALAXY is not set
# CONFIG_SOUND_OPL3SA1 is not set
# CONFIG_SOUND_SOFTOSS is not set
# CONFIG_SOUND_YM3812 is not set
# CONFIG_SOUND_VMIDI is not set
# CONFIG_SOUND_UART6850 is not set
#
# Additional low level sound drivers
#
# CONFIG_LOWLEVEL_SOUND is not set
#
# Kernel hacking
#
CONFIG_MAGIC_SYSRQ=y
-
To unsubscribe from this list: send the line "unsubscribe linux-kernel" in
the body of a message to majordomo@vger.rutgers.edu
Please read the FAQ at 
http://www.tux.org/lkml/